69,ARS|s_CareConnect-GPC-DiagnosticReport-1,DiagnosticReport.performer.extension,DiagnosticReport.performer.extension,Additional Content defined by implementations,"May be used to represent additional information that is not part of the basic definition of the element. In order to make the use of extensions safe and manageable, there is a strict set of governance  applied to the definition and use of extensions. Though any implementer is allowed to define an extension, there is a set of requirements that SHALL be met as part of the definition of the extension.","There can be no stigma associated with the use of extensions by any application, project, or standard - regardless of the institution or jurisdiction that uses or defines the extensions.  The use of extensions is what allows the FHIR specification to retain a core level of simplicity for everyone.","['extensions', 'user content']",0,*,0..*,Element.extension,0,*,"['ele-1', 'ext-1']","['error', 'error']","['All FHIR elements must have a @value or children', 'Must have either extensions or value[x], not both']","['hasValue() | (children().count() > id.count())', 'extension.exists() != value.exists()']","['@value|f:*|h:div', ""exists(f:extension)!=exists(f:*[starts-with(local-name(.), 'value')])""]","['rim', 'rim']","['n/a', 'N/A']",Extension,ele-1,,,value,url,Extensions are always sliced by (at least) url,open,,,,,,,,,,,,,,,,,,,
70,ARS|s_CareConnect-GPC-DiagnosticReport-1,DiagnosticReport.performer.modifierExtension,DiagnosticReport.performer.modifierExtension,Extensions that cannot be ignored,"May be used to represent additional information that is not part of the basic definition of the element, and that modifies the understanding of the element that contains it. Usually modifier elements provide negation or qualification. In order to make the use of extensions safe and manageable, there is a strict set of governance applied to the definition and use of extensions. Though any implementer is allowed to define an extension, there is a set of requirements that SHALL be met as part of the definition of the extension. Applications processing a resource are required to check for modifier extensions.","There can be no stigma associated with the use of extensions by any application, project, or standard - regardless of the institution or jurisdiction that uses or defines the extensions.  The use of extensions is what allows the FHIR specification to retain a core level of simplicity for everyone.","['extensions', 'user content', 'modifiers']",0,*,0..*,BackboneElement.modifierExtension,0,*,"['ele-1', 'ext-1']","['error', 'error']","['All FHIR elements must have a @value or children', 'Must have either extensions or value[x], not both']","['hasValue() | (children().count() > id.count())', 'extension.exists() != value.exists()']","['@value|f:*|h:div', ""exists(f:extension)!=exists(f:*[starts-with(local-name(.), 'value')])""]","['rim', 'rim']","['n/a', 'N/A']",Extension,ele-1,true,,,,,,,,,,,,true,,,,,,,,,,,,
71,ARS|s_CareConnect-GPC-DiagnosticReport-1,DiagnosticReport.performer.role,DiagnosticReport.performer.role,Type of performer,"Describes the type of participation (e.g.  a responsible party, author, or verifier).","Not all terminology uses fit this general pattern. In some cases, models should not use CodeableConcept and use Coding directly and provide their own structure for managing text, codings, translations and the relationship between elements and pre- and post-coordination.",,0,1,0..1,DiagnosticReport.performer.role,0,1,ele-1,error,All FHIR elements must have a @value or children,hasValue() | (children().count() > id.count()),@value|f:*|h:div,"['rim', 'v2', 'rim', 'orim', 'workflow', 'v2', 'rim']","['n/a', 'CE/CNE/CWE', 'CD', 'fhir:CodeableConcept rdfs:subClassOf dt:CD', 'Event.performer.role', 'PRT-8 (where this PRT-4-Participation = ""PO"")', '.functionCode']",CodeableConcept,ele-1,true,,,,,,http://hl7.org/fhir/StructureDefinition/elementdefinition-bindingName,Role,,example,Indicate a role of diagnostic report performer,http://hl7.org/fhir/ValueSet/performer-role,,,,,,,,,,,,,
72,ARS|s_CareConnect-GPC-DiagnosticReport-1,DiagnosticReport.performer.actor,DiagnosticReport.performer.actor,Practitioner or Organization  participant,"The reference to the  practitioner or organization involved in producing the report. For example, the diagnostic service that is responsible for issuing the report.",This is not necessarily the source of the atomic data items. It is the entity that takes responsibility for the clinical report.,,1,1,1..1,DiagnosticReport.performer.actor,1,1,"['ele-1', 'ref-1']","['error', 'error']","['All FHIR elements must have a @value or children', 'SHALL have a contained resource if a local reference is provided']","['hasValue() | (children().count() > id.count())', ""reference.startsWith('#').not() or (reference.substring(1).trace('url') in %resource.contained.id.trace('ids'))""]","['@value|f:*|h:div', ""not(starts-with(f:reference/@value, '#')) or exists(ancestor::*[self::f:entry or self::f:parameter]/f:resource/f:*/f:contained/f:*[f:id/@value=substring-after(current()/f:reference/@value, '#')]|/*/f:contained/f:*[f:id/@value=substring-after(current()/f:reference/@value, '#')])""]","['rim', 'rim', 'workflow', 'v2', 'rim']","['n/a', 'The target of a resource reference is a RIM entry point (Act, Role, or Entity)', 'Event.performer.actor', 'PRT-8 (where this PRT-4-Participation = ""PO"")', '.role']","['Reference', 'Reference']",ele-1,true,,,,,,,,,,,,,,Need to know whom to contact if there are queries about the results. Also may need to track the source of reports for secondary data analysis.,,,,"['https://fhir.nhs.uk/STU3/StructureDefinition/CareConnect-GPC-Organization-1', 'https://fhir.nhs.uk/STU3/StructureDefinition/CareConnect-GPC-Practitioner-1']",,,,,,
73,ARS|s_CareConnect-GPC-DiagnosticReport-1,DiagnosticReport.specimen,DiagnosticReport.specimen,Specimens this report is based on,Details about the specimens on which this diagnostic report is based.,"If the specimen is sufficiently specified with a code in the test result name, then this additional data may be redundant. If there are multiple specimens, these may be represented per observation or group.",,0,*,0..*,DiagnosticReport.specimen,0,*,"['ele-1', 'ref-1']","['error', 'error']","['All FHIR elements must have a @value or children', 'SHALL have a contained resource if a local reference is provided']","['hasValue() | (children().count() > id.count())', ""reference.startsWith('#').not() or (reference.substring(1).trace('url') in %resource.contained.id.trace('ids'))""]","['@value|f:*|h:div', ""not(starts-with(f:reference/@value, '#')) or exists(ancestor::*[self::f:entry or self::f:parameter]/f:resource/f:*/f:contained/f:*[f:id/@value=substring-after(current()/f:reference/@value, '#')]|/*/f:contained/f:*[f:id/@value=substring-after(current()/f:reference/@value, '#')])""]","['rim', 'rim', 'v2', 'rim']","['n/a', 'The target of a resource reference is a RIM entry point (Act, Role, or Entity)', 'SPM', 'participation[typeCode=SBJ]']",Reference,ele-1,,,,,,,,,,,,,,,Need to be able to report information about the collected specimens on which the report is based.,,,,https://fhir.nhs.uk/STU3/StructureDefinition/CareConnect-GPC-Specimen-1,true,,,,,
74,ARS|s_CareConnect-GPC-DiagnosticReport-1,DiagnosticReport.result,DiagnosticReport.result,"Observations - simple, or complex nested groups","Observations that are part of this diagnostic report. Observations can be simple name/value pairs (e.g. ""atomic"" results), or they can be grouping observations that include references to other members of the group (e.g. ""panels"").","References SHALL be a reference to an actual FHIR resource, and SHALL be resolveable (allowing for access control, temporary unavailability, etc). Resolution can be either by retrieval from the URL, or, where applicable by resource type, by treating an absolute reference as a canonical URL and looking it up in a local registry/repository.","['Data', 'Atomic Value', 'Result', 'Atomic result', 'Test', 'Analyte', 'Battery', 'Organizer']",0,*,0..*,DiagnosticReport.result,0,*,"['ele-1', 'ref-1']","['error', 'error']","['All FHIR elements must have a @value or children', 'SHALL have a contained resource if a local reference is provided']","['hasValue() | (children().count() > id.count())', ""reference.startsWith('#').not() or (reference.substring(1).trace('url') in %resource.contained.id.trace('ids'))""]","['@value|f:*|h:div', ""not(starts-with(f:reference/@value, '#')) or exists(ancestor::*[self::f:entry or self::f:parameter]/f:resource/f:*/f:contained/f:*[f:id/@value=substring-after(current()/f:reference/@value, '#')]|/*/f:contained/f:*[f:id/@value=substring-after(current()/f:reference/@value, '#')])""]","['rim', 'rim', 'v2', 'rim']","['n/a', 'The target of a resource reference is a RIM entry point (Act, Role, or Entity)', 'OBXs', 'outboundRelationship[typeCode=COMP].target']",Reference,ele-1,,,,,,,,,,,,,,,"Need to support individual results, or report groups of results, where the result grouping is arbitrary, but meaningful. This structure is recursive - observations can contain observations.",,,,https://fhir.nhs.uk/STU3/StructureDefinition/CareConnect-GPC-Observation-1,true,,,,,
75,ARS|s_CareConnect-GPC-DiagnosticReport-1,DiagnosticReport.imagingStudy,DiagnosticReport.imagingStudy,Reference to full details of imaging associated with the diagnostic report,"One or more links to full details of any imaging performed during the diagnostic investigation. Typically, this is imaging performed by DICOM enabled modalities, but this is not required. A fully enabled PACS viewer can use this information to provide views of the source images.","ImagingStudy and ImageManifest and the image element are somewhat overlapping - typically, the list of image references in the image element will also be found in one of the imaging study resources. However each caters to different types of displays for different types of purposes. Neither, either, or both may be provided.",,0,*,0..*,DiagnosticReport.imagingStudy,0,*,"['ele-1', 'ref-1']","['error', 'error']","['All FHIR elements must have a @value or children', 'SHALL have a contained resource if a local reference is provided']","['hasValue() | (children().count() > id.count())', ""reference.startsWith('#').not() or (reference.substring(1).trace('url') in %resource.contained.id.trace('ids'))""]","['@value|f:*|h:div', ""not(starts-with(f:reference/@value, '#')) or exists(ancestor::*[self::f:entry or self::f:parameter]/f:resource/f:*/f:contained/f:*[f:id/@value=substring-after(current()/f:reference/@value, '#')]|/*/f:contained/f:*[f:id/@value=substring-after(current()/f:reference/@value, '#')])""]","['rim', 'rim', 'rim']","['n/a', 'The target of a resource reference is a RIM entry point (Act, Role, or Entity)', 'outboundRelationship[typeCode=COMP].target[classsCode=DGIMG, moodCode=EVN]']","['Reference', 'Reference']",ele-1,,,,,,,,,,,,,,,,,,,"['http://hl7.org/fhir/StructureDefinition/ImagingStudy', 'http://hl7.org/fhir/StructureDefinition/ImagingManifest']",,,,,,
76,ARS|s_CareConnect-GPC-DiagnosticReport-1,DiagnosticReport.image,DiagnosticReport.image,Key images associated with this report,"A list of key images associated with this report. The images are generally created during the diagnostic process, and may be directly of the patient, or of treated specimens (i.e. slides of interest).",,"['DICOM', 'Slides', 'Scans']",0,*,0..*,DiagnosticReport.image,0,*,ele-1,error,All FHIR elements must have a @value or children,hasValue() | (children().count() > id.count()),@value|f:*|h:div,"['rim', 'v2', 'rim']","['n/a', 'OBX?', 'outboundRelationship[typeCode=COMP].target']",BackboneElement,ele-1,true,,,,,,,,,,,,,,Many diagnostic services include images in the report as part of their service.,,,,,,,,,,
77,ARS|s_CareConnect-GPC-DiagnosticReport-1,DiagnosticReport.image.id,DiagnosticReport.image.id,xml:id (or equivalent in JSON),unique id for the element within a resource (for internal references). This may be any string value that does not contain spaces.,Note that FHIR strings may not exceed 1MB in size,,0,1,0..1,Element.id,0,1,ele-1,error,All FHIR elements must have a @value or children,hasValue() | (children().count() > id.count()),@value|f:*|h:div,rim,n/a,string,ele-1,,xmlAttr,,,,,,,,,,,,,,,,,,,,,,,
78,ARS|s_CareConnect-GPC-DiagnosticReport-1,DiagnosticReport.image.extension,DiagnosticReport.image.extension,Additional Content defined by implementations,"May be used to represent additional information that is not part of the basic definition of the element. In order to make the use of extensions safe and manageable, there is a strict set of governance  applied to the definition and use of extensions. Though any implementer is allowed to define an extension, there is a set of requirements that SHALL be met as part of the definition of the extension.","There can be no stigma associated with the use of extensions by any application, project, or standard - regardless of the institution or jurisdiction that uses or defines the extensions.  The use of extensions is what allows the FHIR specification to retain a core level of simplicity for everyone.","['extensions', 'user content']",0,*,0..*,Element.extension,0,*,"['ele-1', 'ext-1']","['error', 'error']","['All FHIR elements must have a @value or children', 'Must have either extensions or value[x], not both']","['hasValue() | (children().count() > id.count())', 'extension.exists() != value.exists()']","['@value|f:*|h:div', ""exists(f:extension)!=exists(f:*[starts-with(local-name(.), 'value')])""]","['rim', 'rim']","['n/a', 'N/A']",Extension,ele-1,,,value,url,Extensions are always sliced by (at least) url,open,,,,,,,,,,,,,,,,,,,
79,ARS|s_CareConnect-GPC-DiagnosticReport-1,DiagnosticReport.image.modifierExtension,DiagnosticReport.image.modifierExtension,Extensions that cannot be ignored,"May be used to represent additional information that is not part of the basic definition of the element, and that modifies the understanding of the element that contains it. Usually modifier elements provide negation or qualification. In order to make the use of extensions safe and manageable, there is a strict set of governance applied to the definition and use of extensions. Though any implementer is allowed to define an extension, there is a set of requirements that SHALL be met as part of the definition of the extension. Applications processing a resource are required to check for modifier extensions.","There can be no stigma associated with the use of extensions by any application, project, or standard - regardless of the institution or jurisdiction that uses or defines the extensions.  The use of extensions is what allows the FHIR specification to retain a core level of simplicity for everyone.","['extensions', 'user content', 'modifiers']",0,*,0..*,BackboneElement.modifierExtension,0,*,"['ele-1', 'ext-1']","['error', 'error']","['All FHIR elements must have a @value or children', 'Must have either extensions or value[x], not both']","['hasValue() | (children().count() > id.count())', 'extension.exists() != value.exists()']","['@value|f:*|h:div', ""exists(f:extension)!=exists(f:*[starts-with(local-name(.), 'value')])""]","['rim', 'rim']","['n/a', 'N/A']",Extension,ele-1,true,,,,,,,,,,,,true,,,,,,,,,,,,
80,ARS|s_CareConnect-GPC-DiagnosticReport-1,DiagnosticReport.image.comment,DiagnosticReport.image.comment,Comment about the image (e.g. explanation),"A comment about the image. Typically, this is used to provide an explanation for why the image is included, or to draw the viewer's attention to important features.",The comment should be displayed with the image. It would be common for the report to include additional discussion of the image contents in other sections such as the conclusion.,,0,1,0..1,DiagnosticReport.image.comment,0,1,ele-1,error,All FHIR elements must have a @value or children,hasValue() | (children().count() > id.count()),@value|f:*|h:div,"['rim', 'rim']","['n/a', '.inboundRelationship[typeCode=COMP].source[classCode=OBS, moodCode=EVN, code=""annotation""].value']",string,ele-1,,,,,,,,,,,,,,,The provider of the report should make a comment about each image included in the report.,,,,,,,,,,
81,ARS|s_CareConnect-GPC-DiagnosticReport-1,DiagnosticReport.image.link,DiagnosticReport.image.link,Reference to the image source,Reference to the image source.,"References SHALL be a reference to an actual FHIR resource, and SHALL be resolveable (allowing for access control, temporary unavailability, etc). Resolution can be either by retrieval from the URL, or, where applicable by resource type, by treating an absolute reference as a canonical URL and looking it up in a local registry/repository.",,1,1,1..1,DiagnosticReport.image.link,1,1,"['ele-1', 'ref-1']","['error', 'error']","['All FHIR elements must have a @value or children', 'SHALL have a contained resource if a local reference is provided']","['hasValue() | (children().count() > id.count())', ""reference.startsWith('#').not() or (reference.substring(1).trace('url') in %resource.contained.id.trace('ids'))""]","['@value|f:*|h:div', ""not(starts-with(f:reference/@value, '#')) or exists(ancestor::*[self::f:entry or self::f:parameter]/f:resource/f:*/f:contained/f:*[f:id/@value=substring-after(current()/f:reference/@value, '#')]|/*/f:contained/f:*[f:id/@value=substring-after(current()/f:reference/@value, '#')])""]","['rim', 'rim', 'rim']","['n/a', 'The target of a resource reference is a RIM entry point (Act, Role, or Entity)', '.value.reference']",Reference,ele-1,true,,,,,,,,,,,,,,,,,,http://hl7.org/fhir/StructureDefinition/Media,,,,,,
82,ARS|s_CareConnect-GPC-DiagnosticReport-1,DiagnosticReport.conclusion,DiagnosticReport.conclusion,Clinical Interpretation of test results,Concise and clinically contextualized impression / summary of the diagnostic report.,Note that FHIR strings may not exceed 1MB in size,Report,0,1,0..1,DiagnosticReport.conclusion,0,1,ele-1,error,All FHIR elements must have a @value or children,hasValue() | (children().count() > id.count()),@value|f:*|h:div,"['rim', 'v2', 'rim']","['n/a', 'OBX', 'inboundRelationship[typeCode=""SPRT""].source[classCode=OBS, moodCode=EVN, code=LOINC:48767-8].value (type=ST)']",string,ele-1,,,,,,,,,,,,,,,Need to be able to provide a conclusion that is not lost among the basic result data.,,,,,true,,,,,
83,ARS|s_CareConnect-GPC-DiagnosticReport-1,DiagnosticReport.codedDiagnosis,DiagnosticReport.codedDiagnosis,Codes for the conclusion,Codes for the conclusion.,"Not all terminology uses fit this general pattern. In some cases, models should not use CodeableConcept and use Coding directly and provide their own structure for managing text, codings, translations and the relationship between elements and pre- and post-coordination.",,0,*,0..*,DiagnosticReport.codedDiagnosis,0,*,ele-1,error,All FHIR elements must have a @value or children,hasValue() | (children().count() > id.count()),@value|f:*|h:div,"['rim', 'v2', 'rim', 'orim', 'v2', 'rim']","['n/a', 'CE/CNE/CWE', 'CD', 'fhir:CodeableConcept rdfs:subClassOf dt:CD', 'OBX', 'inboundRelationship[typeCode=SPRT].source[classCode=OBS, moodCode=EVN, code=LOINC:54531-9].value (type=CD)']",CodeableConcept,ele-1,,,,,,,http://hl7.org/fhir/StructureDefinition/elementdefinition-bindingName,AdjunctDiagnosis,,preferred,A SNOMED Coded finding for the test report.,https://fhir.hl7.org.uk/STU3/ValueSet/CareConnect-FindingCode-1,,,,,,,,true,,,,,
84,ARS|s_CareConnect-GPC-DiagnosticReport-1,DiagnosticReport.codedDiagnosis.id,DiagnosticReport.codedDiagnosis.id,xml:id (or equivalent in JSON),unique id for the element within a resource (for internal references). This may be any string value that does not contain spaces.,Note that FHIR strings may not exceed 1MB in size,,0,1,0..1,Element.id,0,1,ele-1,error,All FHIR elements must have a @value or children,hasValue() | (children().count() > id.count()),@value|f:*|h:div,rim,n/a,string,ele-1,,xmlAttr,,,,,,,,,,,,,,,,,,,,,,,
85,ARS|s_CareConnect-GPC-DiagnosticReport-1,DiagnosticReport.codedDiagnosis.extension,DiagnosticReport.codedDiagnosis.extension,Additional Content defined by implementations,"May be used to represent additional information that is not part of the basic definition of the element. In order to make the use of extensions safe and manageable, there is a strict set of governance  applied to the definition and use of extensions. Though any implementer is allowed to define an extension, there is a set of requirements that SHALL be met as part of the definition of the extension.","There can be no stigma associated with the use of extensions by any application, project, or standard - regardless of the institution or jurisdiction that uses or defines the extensions.  The use of extensions is what allows the FHIR specification to retain a core level of simplicity for everyone.","['extensions', 'user content']",0,*,0..*,Element.extension,0,*,"['ele-1', 'ext-1']","['error', 'error']","['All FHIR elements must have a @value or children', 'Must have either extensions or value[x], not both']","['hasValue() | (children().count() > id.count())', 'extension.exists() != value.exists()']","['@value|f:*|h:div', ""exists(f:extension)!=exists(f:*[starts-with(local-name(.), 'value')])""]","['rim', 'rim']","['n/a', 'N/A']",Extension,ele-1,,,value,url,Extensions are always sliced by (at least) url,open,,,,,,,,,,,,,,,,,,,
86,ARS|s_CareConnect-GPC-DiagnosticReport-1,DiagnosticReport.codedDiagnosis.coding,DiagnosticReport.codedDiagnosis.coding,Code defined by a terminology system,A reference to a code defined by a terminology system.,"Codes may be defined very casually in enumerations, or code lists, up to very formal definitions such as SNOMED CT - see the HL7 v3 Core Principles for more information.  Ordering of codings is undefined and SHALL NOT be used to infer meaning. Generally, at most only one of the coding values will be labeled as UserSelected = true.",,0,*,0..*,CodeableConcept.coding,0,*,ele-1,error,All FHIR elements must have a @value or children,hasValue() | (children().count() > id.count()),@value|f:*|h:div,"['rim', 'v2', 'rim', 'orim', 'v2', 'rim', 'orim']","['n/a', 'CE/CNE/CWE subset one of the sets of component 1-3 or 4-6', 'CV', 'fhir:Coding rdfs:subClassOf dt:CDCoding', 'C*E.1-8, C*E.10-22', 'union(., ./translation)', 'fhir:CodeableConcept.coding rdfs:subPropertyOf dt:CD.coding']",Coding,ele-1,true,,value,system,,open,,,,,,,,,Allows for translations and alternate encodings within a code system.  Also supports communication of the same instance to systems requiring different encodings.,,,,,,,,,,
87,ARS|s_CareConnect-GPC-DiagnosticReport-1,DiagnosticReport.codedDiagnosis.coding:snomedCT,DiagnosticReport.codedDiagnosis.coding,Code defined by a terminology system,A reference to a code defined by a terminology system.,"Codes may be defined very casually in enumerations, or code lists, up to very formal definitions such as SNOMED CT - see the HL7 v3 Core Principles for more information.  Ordering of codings is undefined and SHALL NOT be used to infer meaning. Generally, at most only one of the coding values will be labeled as UserSelected = true.",,0,*,0..*,CodeableConcept.coding,0,*,ele-1,error,All FHIR elements must have a @value or children,hasValue() | (children().count() > id.count()),@value|f:*|h:div,"['rim', 'v2', 'rim', 'orim', 'v2', 'rim', 'orim']","['n/a', 'CE/CNE/CWE subset one of the sets of component 1-3 or 4-6', 'CV', 'fhir:Coding rdfs:subClassOf dt:CDCoding', 'C*E.1-8, C*E.10-22', 'union(., ./translation)', 'fhir:CodeableConcept.coding rdfs:subPropertyOf dt:CD.coding']",Coding,ele-1,true,,,,,,,,,extensible,A code from the SNOMED Clinical Terminology UK,https://fhir.hl7.org.uk/STU3/ValueSet/CareConnect-FindingCode-1,,,Allows for translations and alternate encodings within a code system.  Also supports communication of the same instance to systems requiring different encodings.,,,,,,snomedCT,,,,
88,ARS|s_CareConnect-GPC-DiagnosticReport-1,DiagnosticReport.codedDiagnosis.coding:snomedCT.id,DiagnosticReport.codedDiagnosis.coding.id,xml:id (or equivalent in JSON),unique id for the element within a resource (for internal references). This may be any string value that does not contain spaces.,Note that FHIR strings may not exceed 1MB in size,,0,1,0..1,Element.id,0,1,ele-1,error,All FHIR elements must have a @value or children,hasValue() | (children().count() > id.count()),@value|f:*|h:div,rim,n/a,string,ele-1,,xmlAttr,,,,,,,,,,,,,,,,,,,,,,,
