100,ARS|s_CareConnect-GPC-Medication-1,Medication.package.container.coding.system,Medication.package.container.coding.system,Identity of the terminology system,The identification of the code system that defines the meaning of the symbol in the code.,0,1,0..1,Coding.system,0,1,ele-1,error,All FHIR elements must have a @value or children,hasValue() | (children().count() > id.count()),@value|f:*|h:div,"['rim', 'v2', 'rim', 'orim']","['n/a', 'C*E.3', './codeSystem', 'fhir:Coding.system rdfs:subPropertyOf dt:CDCoding.codeSystem']","The URI may be an OID (urn:oid:...) or a UUID (urn:uuid:...).  OIDs and UUIDs SHALL be references to the HL7 OID registry. Otherwise, the URI should come from HL7's list of FHIR defined special URIs or it should de-reference to some definition that establish the system clearly and unambiguously.",uri,ele-1,true,,,,,,,,,,,,,Need to be unambiguous about the source of the definition of the symbol.,,,,,,,,,,,,,
101,ARS|s_CareConnect-GPC-Medication-1,Medication.package.container.coding.version,Medication.package.container.coding.version,Version of the system - if relevant,"The version of the code system which was used when choosing this code. Note that a well-maintained code system does not need the version reported, because the meaning of codes is consistent across versions. However this cannot consistently be assured. and when the meaning is not guaranteed to be consistent, the version SHOULD be exchanged.",0,1,0..1,Coding.version,0,1,ele-1,error,All FHIR elements must have a @value or children,hasValue() | (children().count() > id.count()),@value|f:*|h:div,"['rim', 'v2', 'rim', 'orim']","['n/a', 'C*E.7', './codeSystemVersion', 'fhir:Coding.version rdfs:subPropertyOf dt:CDCoding.codeSystemVersion']","Where the terminology does not clearly define what string should be used to identify code system versions, the recommendation is to use the date (expressed in FHIR date format) on which that version was officially published as the version date.",string,ele-1,true,,,,,,,,,,,,,,,,,,,,,,,,,,
102,ARS|s_CareConnect-GPC-Medication-1,Medication.package.container.coding.code,Medication.package.container.coding.code,Symbol in syntax defined by the system,A symbol in syntax defined by the system. The symbol may be a predefined code or an expression in a syntax defined by the coding system (e.g. post-coordination).,0,1,0..1,Coding.code,0,1,ele-1,error,All FHIR elements must have a @value or children,hasValue() | (children().count() > id.count()),@value|f:*|h:div,"['rim', 'v2', 'rim', 'orim']","['n/a', 'C*E.1', './code', 'fhir:Coding.code rdfs:subPropertyOf dt:CDCoding.code']",Note that FHIR strings may not exceed 1MB in size,code,ele-1,true,,,,,,,,,,,,,Need to refer to a particular code in the system.,,,,,,,,,,,,,
103,ARS|s_CareConnect-GPC-Medication-1,Medication.package.container.coding.display,Medication.package.container.coding.display,Representation defined by the system,"A representation of the meaning of the code in the system, following the rules of the system.",0,1,0..1,Coding.display,0,1,ele-1,error,All FHIR elements must have a @value or children,hasValue() | (children().count() > id.count()),@value|f:*|h:div,"['rim', 'v2', 'rim', 'orim']","['n/a', 'C*E.2 - but note this is not well followed', 'CV.displayName', 'fhir:Coding.display rdfs:subPropertyOf dt:CDCoding.displayName']",Note that FHIR strings may not exceed 1MB in size,string,ele-1,true,,,,,,,,,,,,,Need to be able to carry a human-readable meaning of the code for readers that do not know  the system.,http://hl7.org/fhir/StructureDefinition/elementdefinition-translatable,true,,,,,,,,,,,
104,ARS|s_CareConnect-GPC-Medication-1,Medication.package.container.coding.userSelected,Medication.package.container.coding.userSelected,If this coding was chosen directly by the user,Indicates that this coding was chosen by a user directly - i.e. off a pick list of available items (codes or displays).,0,1,0..1,Coding.userSelected,0,1,ele-1,error,All FHIR elements must have a @value or children,hasValue() | (children().count() > id.count()),@value|f:*|h:div,"['rim', 'v2', 'rim', 'orim']","['n/a', 'Sometimes implied by being first', 'CD.codingRationale', 'fhir:Coding.userSelected fhir:mapsTo dt:CDCoding.codingRationale. fhir:Coding.userSelected fhir:hasMap fhir:Coding.userSelected.map. fhir:Coding.userSelected.map a fhir:Map;   fhir:target dt:CDCoding.codingRationale. fhir:Coding.userSelected\\#true a [     fhir:source ""true"";     fhir:target dt:CDCoding.codingRationale\\#O   ]']","Amongst a set of alternatives, a directly chosen code is the most appropriate starting point for new translations. There is some ambiguity about what exactly 'directly chosen' implies, and trading partner agreement may be needed to clarify the use of this element and its consequences more completely.",boolean,ele-1,true,,,,,,,,,,,,,"This has been identified as a clinical safety criterium - that this exact system/code pair was chosen explicitly, rather than inferred by the system based on some rules or language processing.",,,,,,,,,,,,,
105,ARS|s_CareConnect-GPC-Medication-1,Medication.package.container.text,Medication.package.container.text,Plain text representation of the concept,A human language representation of the concept as seen/selected/uttered by the user who entered the data and/or which represents the intended meaning of the user.,0,1,0..1,CodeableConcept.text,0,1,ele-1,error,All FHIR elements must have a @value or children,hasValue() | (children().count() > id.count()),@value|f:*|h:div,"['rim', 'v2', 'rim', 'orim']","['n/a', 'C*E.9. But note many systems use C*E.2 for this', './originalText[mediaType/code=""text/plain""]/data', 'fhir:CodeableConcept.text rdfs:subPropertyOf dt:CD.originalText']",Very often the text is the same as a displayName of one of the codings.,string,ele-1,true,,,,,,,,,,,,,"The codes from the terminologies do not always capture the correct meaning with all the nuances of the human using them, or sometimes there is no appropriate code at all. In these cases, the text is used to capture the full meaning of the source.",http://hl7.org/fhir/StructureDefinition/elementdefinition-translatable,true,,,,,,,,,,,
106,ARS|s_CareConnect-GPC-Medication-1,Medication.package.content,Medication.package.content,What is  in the package,A set of components that go to make up the described item.,0,*,0..*,Medication.package.content,0,*,ele-1,error,All FHIR elements must have a @value or children,hasValue() | (children().count() > id.count()),@value|f:*|h:div,"['rim', 'script10.6', 'rim']","['n/a', 'no mapping', '.scopesRole[typeCode=CONT]']",,BackboneElement,ele-1,,,,,,,,,,,,,,,,,,,,,,,,,,,
107,ARS|s_CareConnect-GPC-Medication-1,Medication.package.content.id,Medication.package.content.id,xml:id (or equivalent in JSON),unique id for the element within a resource (for internal references). This may be any string value that does not contain spaces.,0,1,0..1,Element.id,0,1,ele-1,error,All FHIR elements must have a @value or children,hasValue() | (children().count() > id.count()),@value|f:*|h:div,rim,n/a,Note that FHIR strings may not exceed 1MB in size,string,ele-1,,xmlAttr,,,,,,,,,,,,,,,,,,,,,,,,,
108,ARS|s_CareConnect-GPC-Medication-1,Medication.package.content.extension,Medication.package.content.extension,Additional Content defined by implementations,"May be used to represent additional information that is not part of the basic definition of the element. In order to make the use of extensions safe and manageable, there is a strict set of governance  applied to the definition and use of extensions. Though any implementer is allowed to define an extension, there is a set of requirements that SHALL be met as part of the definition of the extension.",0,*,0..*,Element.extension,0,*,"['ele-1', 'ext-1']","['error', 'error']","['All FHIR elements must have a @value or children', 'Must have either extensions or value[x], not both']","['hasValue() | (children().count() > id.count())', 'extension.exists() != value.exists()']","['@value|f:*|h:div', ""exists(f:extension)!=exists(f:*[starts-with(local-name(.), 'value')])""]","['rim', 'rim']","['n/a', 'N/A']","There can be no stigma associated with the use of extensions by any application, project, or standard - regardless of the institution or jurisdiction that uses or defines the extensions.  The use of extensions is what allows the FHIR specification to retain a core level of simplicity for everyone.",Extension,ele-1,,,value,url,Extensions are always sliced by (at least) url,open,"['extensions', 'user content']",,,,,,,,,,,,,,,,,,,,
109,ARS|s_CareConnect-GPC-Medication-1,Medication.package.content.modifierExtension,Medication.package.content.modifierExtension,Extensions that cannot be ignored,"May be used to represent additional information that is not part of the basic definition of the element, and that modifies the understanding of the element that contains it. Usually modifier elements provide negation or qualification. In order to make the use of extensions safe and manageable, there is a strict set of governance applied to the definition and use of extensions. Though any implementer is allowed to define an extension, there is a set of requirements that SHALL be met as part of the definition of the extension. Applications processing a resource are required to check for modifier extensions.",0,*,0..*,BackboneElement.modifierExtension,0,*,"['ele-1', 'ext-1']","['error', 'error']","['All FHIR elements must have a @value or children', 'Must have either extensions or value[x], not both']","['hasValue() | (children().count() > id.count())', 'extension.exists() != value.exists()']","['@value|f:*|h:div', ""exists(f:extension)!=exists(f:*[starts-with(local-name(.), 'value')])""]","['rim', 'rim']","['n/a', 'N/A']","There can be no stigma associated with the use of extensions by any application, project, or standard - regardless of the institution or jurisdiction that uses or defines the extensions.  The use of extensions is what allows the FHIR specification to retain a core level of simplicity for everyone.",Extension,ele-1,true,,,,,,"['extensions', 'user content', 'modifiers']",,,,,,,,,,true,,,,,,,,,,
110,ARS|s_CareConnect-GPC-Medication-1,Medication.package.content.item[x],Medication.package.content.item[x],The item in the package,Identifies one of the items in the package.,1,1,1..1,Medication.package.content.item[x],1,1,ele-1,error,All FHIR elements must have a @value or children,hasValue() | (children().count() > id.count()),@value|f:*|h:div,"['rim', 'v2', 'rim', 'orim', 'script10.6', 'rim']","['n/a', 'CE/CNE/CWE', 'CD', 'fhir:CodeableConcept rdfs:subClassOf dt:CD', 'no mapping', '.player']","Not all terminology uses fit this general pattern. In some cases, models should not use CodeableConcept and use Coding directly and provide their own structure for managing text, codings, translations and the relationship between elements and pre- and post-coordination.","['CodeableConcept', 'Reference']",ele-1,,,,,,,,,,,,,,,,,,,,,https://fhir.nhs.uk/STU3/StructureDefinition/CareConnect-GPC-Medication-1,,,,,,
111,ARS|s_CareConnect-GPC-Medication-1,Medication.package.content.amount,Medication.package.content.amount,Quantity present in the package,The amount of the product that is in the package.,0,1,0..1,Medication.package.content.amount,0,1,"['ele-1', 'qty-3', 'sqty-1']","['error', 'error', 'error']","['All FHIR elements must have a @value or children', 'If a code for the unit is present, the system SHALL also be present', 'The comparator is not used on a SimpleQuantity']","['hasValue() | (children().count() > id.count())', 'code.empty() or system.exists()', 'comparator.empty()']","['@value|f:*|h:div', 'not(exists(f:code)) or exists(f:system)', 'not(exists(f:comparator))']","['rim', 'v2', 'rim', 'script10.6', 'rim']","['n/a', 'SN (see also Range) or CQ', 'PQ, IVL<PQ>, MO, CO, depending on the values', 'no mapping', '.quantity']",The context of use may frequently define what kind of quantity this is and therefore what kind of units can be used. The context of use may also restrict the values for the comparator.,Quantity,ele-1,,,,,,,,,,,,,,,,,false,,,http://hl7.org/fhir/StructureDefinition/SimpleQuantity,,,,,,,
112,ARS|s_CareConnect-GPC-Medication-1,Medication.package.content.amount.id,Medication.package.content.amount.id,xml:id (or equivalent in JSON),unique id for the element within a resource (for internal references). This may be any string value that does not contain spaces.,0,1,0..1,Element.id,0,1,ele-1,error,All FHIR elements must have a @value or children,hasValue() | (children().count() > id.count()),@value|f:*|h:div,rim,n/a,Note that FHIR strings may not exceed 1MB in size,string,ele-1,,xmlAttr,,,,,,,,,,,,,,,,,,,,,,,,,
113,ARS|s_CareConnect-GPC-Medication-1,Medication.package.content.amount.extension,Medication.package.content.amount.extension,Additional Content defined by implementations,"May be used to represent additional information that is not part of the basic definition of the element. In order to make the use of extensions safe and manageable, there is a strict set of governance  applied to the definition and use of extensions. Though any implementer is allowed to define an extension, there is a set of requirements that SHALL be met as part of the definition of the extension.",0,*,0..*,Element.extension,0,*,"['ele-1', 'ext-1']","['error', 'error']","['All FHIR elements must have a @value or children', 'Must have either extensions or value[x], not both']","['hasValue() | (children().count() > id.count())', 'extension.exists() != value.exists()']","['@value|f:*|h:div', ""exists(f:extension)!=exists(f:*[starts-with(local-name(.), 'value')])""]","['rim', 'rim']","['n/a', 'N/A']","There can be no stigma associated with the use of extensions by any application, project, or standard - regardless of the institution or jurisdiction that uses or defines the extensions.  The use of extensions is what allows the FHIR specification to retain a core level of simplicity for everyone.",Extension,ele-1,,,value,url,Extensions are always sliced by (at least) url,open,"['extensions', 'user content']",,,,,,,,,,,,,,,,,,,,
114,ARS|s_CareConnect-GPC-Medication-1,Medication.package.content.amount.value,Medication.package.content.amount.value,Numerical value (with implicit precision),The value of the measured amount. The value includes an implicit precision in the presentation of the value.,0,1,0..1,Quantity.value,0,1,ele-1,error,All FHIR elements must have a @value or children,hasValue() | (children().count() > id.count()),@value|f:*|h:div,"['rim', 'v2', 'rim']","['n/a', 'SN.2  / CQ - N/A', 'PQ.value, CO.value, MO.value, IVL.high or IVL.low depending on the value']",The implicit precision in the value should always be honored. Monetary values have their own rules for handling precision (refer to standard accounting text books).,decimal,ele-1,true,,,,,,,,,,,,,Precision is handled implicitly in almost all cases of measurement.,,,,,,,,,,,,,
115,ARS|s_CareConnect-GPC-Medication-1,Medication.package.content.amount.comparator,Medication.package.content.amount.comparator,< | <= | >= | > - how to understand the value,Not allowed to be used in this context,0,0,0..0,Quantity.comparator,0,1,ele-1,error,All FHIR elements must have a @value or children,hasValue() | (children().count() > id.count()),@value|f:*|h:div,"['rim', 'v2', 'rim']","['n/a', 'SN.1  / CQ.1', 'IVL properties']","This is labeled as ""Is Modifier"" because the comparator modifies the interpretation of the value significantly. If there is no comparator, then there is no modification of the value.",code,ele-1,true,,,,,,,http://hl7.org/fhir/StructureDefinition/elementdefinition-bindingName,QuantityComparator,,required,How the Quantity should be understood and represented.,http://hl7.org/fhir/ValueSet/quantity-comparator,Need a framework for handling measures where the value is <5ug/L or >400mg/L due to the limitations of measuring methodology.,,,true,,,,,"If there is no comparator, then there is no modification of the value",,,,,
116,ARS|s_CareConnect-GPC-Medication-1,Medication.package.content.amount.unit,Medication.package.content.amount.unit,Unit representation,A human-readable form of the unit.,0,1,0..1,Quantity.unit,0,1,ele-1,error,All FHIR elements must have a @value or children,hasValue() | (children().count() > id.count()),@value|f:*|h:div,"['rim', 'v2', 'rim']","['n/a', '(see OBX.6 etc.) / CQ.2', 'PQ.unit']",Note that FHIR strings may not exceed 1MB in size,string,ele-1,true,,,,,,,,,,,,,"There are many representations for units of measure and in many contexts, particular representations are fixed and required. I.e. mcg for micrograms.",http://hl7.org/fhir/StructureDefinition/elementdefinition-translatable,true,,,,,,,,,,,
117,ARS|s_CareConnect-GPC-Medication-1,Medication.package.content.amount.system,Medication.package.content.amount.system,System that defines coded unit form,The identification of the system that provides the coded form of the unit.,0,1,0..1,Quantity.system,0,1,ele-1,error,All FHIR elements must have a @value or children,hasValue() | (children().count() > id.count()),@value|f:*|h:div,"['rim', 'v2', 'rim']","['n/a', '(see OBX.6 etc.) / CQ.2', 'CO.codeSystem, PQ.translation.codeSystem']",see http://en.wikipedia.org/wiki/Uniform_resource_identifier,uri,"['ele-1', 'qty-3']",true,,,,,,,,,,,,,Need to know the system that defines the coded form of the unit.,,,,,,,,,,,,,
118,ARS|s_CareConnect-GPC-Medication-1,Medication.package.content.amount.code,Medication.package.content.amount.code,Coded form of the unit,A computer processable form of the unit in some unit representation system.,0,1,0..1,Quantity.code,0,1,ele-1,error,All FHIR elements must have a @value or children,hasValue() | (children().count() > id.count()),@value|f:*|h:div,"['rim', 'v2', 'rim']","['n/a', '(see OBX.6 etc.) / CQ.2', 'PQ.code, MO.currency, PQ.translation.code']","The preferred system is UCUM, but SNOMED CT can also be used (for customary units) or ISO 4217 for currency.  The context of use may additionally require a code from a particular system.",code,ele-1,true,,,,,,,,,,,,,"Need a computable form of the unit that is fixed across all forms. UCUM provides this for quantities, but SNOMED CT provides many units of interest.",,,,,,,,,,,,,
119,ARS|s_CareConnect-GPC-Medication-1,Medication.package.batch,Medication.package.batch,Identifies a single production run,Information about a group of medication produced or packaged from one production run.,0,*,0..*,Medication.package.batch,0,*,ele-1,error,All FHIR elements must have a @value or children,hasValue() | (children().count() > id.count()),@value|f:*|h:div,"['rim', 'script10.6', 'rim']","['n/a', 'no mapping', 'participation[typeCode=CSM].role[classCode=INST].scopedRole.scoper[classCode=MMAT].id']",,BackboneElement,ele-1,,,,,,,,,,,,,,,,,,,,,,,,,,,
120,ARS|s_CareConnect-GPC-Medication-1,Medication.package.batch.id,Medication.package.batch.id,xml:id (or equivalent in JSON),unique id for the element within a resource (for internal references). This may be any string value that does not contain spaces.,0,1,0..1,Element.id,0,1,ele-1,error,All FHIR elements must have a @value or children,hasValue() | (children().count() > id.count()),@value|f:*|h:div,rim,n/a,Note that FHIR strings may not exceed 1MB in size,string,ele-1,,xmlAttr,,,,,,,,,,,,,,,,,,,,,,,,,
121,ARS|s_CareConnect-GPC-Medication-1,Medication.package.batch.extension,Medication.package.batch.extension,Additional Content defined by implementations,"May be used to represent additional information that is not part of the basic definition of the element. In order to make the use of extensions safe and manageable, there is a strict set of governance  applied to the definition and use of extensions. Though any implementer is allowed to define an extension, there is a set of requirements that SHALL be met as part of the definition of the extension.",0,*,0..*,Element.extension,0,*,"['ele-1', 'ext-1']","['error', 'error']","['All FHIR elements must have a @value or children', 'Must have either extensions or value[x], not both']","['hasValue() | (children().count() > id.count())', 'extension.exists() != value.exists()']","['@value|f:*|h:div', ""exists(f:extension)!=exists(f:*[starts-with(local-name(.), 'value')])""]","['rim', 'rim']","['n/a', 'N/A']","There can be no stigma associated with the use of extensions by any application, project, or standard - regardless of the institution or jurisdiction that uses or defines the extensions.  The use of extensions is what allows the FHIR specification to retain a core level of simplicity for everyone.",Extension,ele-1,,,value,url,Extensions are always sliced by (at least) url,open,"['extensions', 'user content']",,,,,,,,,,,,,,,,,,,,
122,ARS|s_CareConnect-GPC-Medication-1,Medication.package.batch.modifierExtension,Medication.package.batch.modifierExtension,Extensions that cannot be ignored,"May be used to represent additional information that is not part of the basic definition of the element, and that modifies the understanding of the element that contains it. Usually modifier elements provide negation or qualification. In order to make the use of extensions safe and manageable, there is a strict set of governance applied to the definition and use of extensions. Though any implementer is allowed to define an extension, there is a set of requirements that SHALL be met as part of the definition of the extension. Applications processing a resource are required to check for modifier extensions.",0,*,0..*,BackboneElement.modifierExtension,0,*,"['ele-1', 'ext-1']","['error', 'error']","['All FHIR elements must have a @value or children', 'Must have either extensions or value[x], not both']","['hasValue() | (children().count() > id.count())', 'extension.exists() != value.exists()']","['@value|f:*|h:div', ""exists(f:extension)!=exists(f:*[starts-with(local-name(.), 'value')])""]","['rim', 'rim']","['n/a', 'N/A']","There can be no stigma associated with the use of extensions by any application, project, or standard - regardless of the institution or jurisdiction that uses or defines the extensions.  The use of extensions is what allows the FHIR specification to retain a core level of simplicity for everyone.",Extension,ele-1,true,,,,,,"['extensions', 'user content', 'modifiers']",,,,,,,,,,true,,,,,,,,,,
123,ARS|s_CareConnect-GPC-Medication-1,Medication.package.batch.lotNumber,Medication.package.batch.lotNumber,Identifier assigned to batch,The assigned lot number of a batch of the specified product.,0,1,0..1,Medication.package.batch.lotNumber,0,1,ele-1,error,All FHIR elements must have a @value or children,hasValue() | (children().count() > id.count()),@value|f:*|h:div,"['rim', 'script10.6', 'v2', 'rim']","['n/a', 'no mapping', 'RXA-15 Substance Lot Number / RXG-19 Substance Lot Number', '.id']",Note that FHIR strings may not exceed 1MB in size,string,ele-1,,,,,,,,,,,,,,,,,,,,,,,,,,,
124,ARS|s_CareConnect-GPC-Medication-1,Medication.package.batch.expirationDate,Medication.package.batch.expirationDate,When batch will expire,When this specific batch of product will expire.,0,1,0..1,Medication.package.batch.expirationDate,0,1,ele-1,error,All FHIR elements must have a @value or children,hasValue() | (children().count() > id.count()),@value|f:*|h:div,"['rim', 'script10.6', 'v2', 'rim']","['n/a', 'no mapping', 'RXA-16 Substance Expiration Date / RXG-20 Substance Expiration Date', 'participation[typeCode=CSM].role[classCode=INST].scopedRole.scoper[classCode=MMAT].expirationTime']",,dateTime,ele-1,,,,,,,,,,,,,,,,,,,,,,,,,,,
125,ARS|s_CareConnect-GPC-Medication-1,Medication.image,Medication.image,Picture of the medication,Photo(s) or graphic representation(s) of the medication.,0,*,0..*,Medication.image,0,*,"['ele-1', 'att-1']","['error', 'error']","['All FHIR elements must have a @value or children', 'It the Attachment has data, it SHALL have a contentType']","['hasValue() | (children().count() > id.count())', 'data.empty() or contentType.exists()']","['@value|f:*|h:div', 'not(exists(f:data)) or exists(f:contentType)']","['rim', 'v2', 'rim', 'rim']","['n/a', 'ED/RP', 'ED', '.participation[typeCode=SUBJ].role[classCode=MANU],source[classCode=OBS,moodCode=EVN,code=""type of image""].value(ED.image)']","When providing a summary view (for example with Observation.value[x]) Attachment should be represented with a brief display text such as ""Attachment"".",Attachment,ele-1,,,,,,,,,,,,,,"Note that ""image"" is only applicable when the medication.code represents a physical item (e.g. Amoxil 250 mg capsule) and not an abstract item (e.g. amoxicillin 250 mg).",,,,,,,,,,,,,
126,ARS|s_CareConnect-GPC-Medication-1,Medication.image.id,Medication.image.id,xml:id (or equivalent in JSON),unique id for the element within a resource (for internal references). This may be any string value that does not contain spaces.,0,1,0..1,Element.id,0,1,ele-1,error,All FHIR elements must have a @value or children,hasValue() | (children().count() > id.count()),@value|f:*|h:div,rim,n/a,Note that FHIR strings may not exceed 1MB in size,string,ele-1,,xmlAttr,,,,,,,,,,,,,,,,,,,,,,,,,
