,source,element_id,element_path_value,element_short_value,element_definition_value,element_min_value,element_max_value,element_cardinality,element_base_path_value,element_base_min_value,element_base_max_value,element_base_cardinality,element_constraint_key_value,element_constraint_severity_value,element_constraint_human_value,element_constraint_expression_value,element_constraint_xpath_value,element_mapping_identity_value,element_mapping_map_value,element_comment_value,element_type_code_value,element_condition_value,element_isSummary_value,element_representation_value,element_slicing_discriminator_type_value,element_slicing_discriminator_path_value,element_slicing_description_value,element_slicing_rules_value,element_alias_value,element_binding_extension_url,element_binding_extension_valueString_value,element_binding_extension_valueBoolean_value,element_binding_strength_value,element_binding_description_value,element_binding_valueSetReference_reference_value,element_requirements_value,element_extension_url,element_extension_valueBoolean_value,element_isModifier_value,element_binding_extension_valueReference_reference_value,element_sliceName_value,element_type_profile_value,element_mustSupport_value,element_example_label_value,element_example_valueUri_value,element_example_valueString_value,element_meaningWhenMissing_value,element_type_targetProfile_value,element_defaultValueCode_value,element_slicing_ordered_value,element_fixedUri_value
0,Simplifier|CareConnect-GPC-Condition-1.xml,Condition,Condition,"Detailed information about conditions, problems or diagnoses","A clinical condition, problem, diagnosis, or other event, situation, issue, or clinical concept that has risen to a level of concern.",0,*,0..*,Resource,0,*,0..*,"['dom-2', 'dom-1', 'dom-4', 'dom-3', 'con-4', 'con-3']","['error', 'error', 'error', 'error', 'error', 'error']","['If the resource is contained in another resource, it SHALL NOT contain nested Resources', 'If the resource is contained in another resource, it SHALL NOT contain any narrative', 'If a resource is contained in another resource, it SHALL NOT have a meta.versionId or a meta.lastUpdated', 'If the resource is contained in another resource, it SHALL be referred to from elsewhere in the resource', 'If condition is abated, then clinicalStatus must be either inactive, resolved, or remission', 'Condition.clinicalStatus SHALL be present if verificationStatus is not entered-in-error']","['contained.contained.empty()', 'contained.text.empty()', 'contained.meta.versionId.empty() and contained.meta.lastUpdated.empty()', ""contained.where(('#'+id in %resource.descendants().reference).not()).empty()"", ""abatement.empty() or (abatement as boolean).not()  or clinicalStatus='resolved' or clinicalStatus='remission' or clinicalStatus='inactive'"", ""verificationStatus='entered-in-error' or clinicalStatus.exists()""]","['not(parent::f:contained and f:contained)', 'not(parent::f:contained and f:text)', 'not(exists(f:contained/*/f:meta/f:versionId)) and not(exists(f:contained/*/f:meta/f:lastUpdated))', ""not(exists(for $id in f:contained/*/@id return $id[not(ancestor::f:contained/parent::*/descendant::f:reference/@value=concat('#', $id))]))"", ""not(f:abatementBoolean/@value=true() or (not(exists(f:abatementBoolean)) and exists(*[starts-with(local-name(.), 'abatement')])) or f:clinicalStatus/@value=('resolved', 'remission', 'inactive'))"", ""f:verificationStatus/@value='entered-in-error' or exists(f:clinicalStatus)""]","['rim', 'sct-concept', 'v2', 'rim', 'w5']","['Entity. Role, or Act', '< 243796009 |Situation with explicit context|: 246090004 |Associated finding| = ((< 404684003 |Clinical finding| MINUS << 420134006 |Propensity to adverse reactions| MINUS  << 473010000 |Hypersensitivity condition| MINUS  << 79899007 |Drug interaction| MINUS << 69449002 |Drug action| MINUS  << 441742003 |Evaluation finding| MINUS  << 307824009 |Administrative status| MINUS  << 385356007 |Tumor stage finding|) OR < 272379006 |Event|)', 'PPR message', 'Observation[classCode=OBS, moodCode=EVN, code=ASSERTION, value<Diagnosis]', 'clinical.general']",,,,,,,,,,,,,,,,,,,,,,,,,,,,,,,,
1,Simplifier|CareConnect-GPC-Condition-1.xml,Condition.id,Condition.id,Logical id of this artifact,"The logical id of the resource, as used in the URL for the resource. Once assigned, this value never changes.",1,1,1..1,Resource.id,0,1,0..1,ele-1,error,All FHIR elements must have a @value or children,hasValue() | (children().count() > id.count()),@value|f:*|h:div,rim,n/a,The only time that a resource does not have an id is when it is being submitted to the server using a create operation.,id,ele-1,true,,,,,,,,,,,,,,,,,,,,,,,,,,,,
2,Simplifier|CareConnect-GPC-Condition-1.xml,Condition.meta,Condition.meta,Metadata about the resource,The metadata about the resource. This is content that is maintained by the infrastructure. Changes to the content may not always be associated with version changes to the resource.,0,1,0..1,Resource.meta,0,1,0..1,ele-1,error,All FHIR elements must have a @value or children,hasValue() | (children().count() > id.count()),@value|f:*|h:div,"['rim', 'rim']","['n/a', 'N/A']",,Meta,ele-1,true,,,,,,,,,,,,,,,,,,,,,,,,,,,,
3,Simplifier|CareConnect-GPC-Condition-1.xml,Condition.meta.id,Condition.meta.id,xml:id (or equivalent in JSON),unique id for the element within a resource (for internal references). This may be any string value that does not contain spaces.,0,1,0..1,Element.id,0,1,0..1,ele-1,error,All FHIR elements must have a @value or children,hasValue() | (children().count() > id.count()),@value|f:*|h:div,rim,n/a,Note that FHIR strings may not exceed 1MB in size,string,ele-1,,xmlAttr,,,,,,,,,,,,,,,,,,,,,,,,,,,
4,Simplifier|CareConnect-GPC-Condition-1.xml,Condition.meta.extension,Condition.meta.extension,Additional Content defined by implementations,"May be used to represent additional information that is not part of the basic definition of the element. In order to make the use of extensions safe and manageable, there is a strict set of governance  applied to the definition and use of extensions. Though any implementer is allowed to define an extension, there is a set of requirements that SHALL be met as part of the definition of the extension.",0,*,0..*,Element.extension,0,*,0..*,"['ele-1', 'ext-1']","['error', 'error']","['All FHIR elements must have a @value or children', 'Must have either extensions or value[x], not both']","['hasValue() | (children().count() > id.count())', 'extension.exists() != value.exists()']","['@value|f:*|h:div', ""exists(f:extension)!=exists(f:*[starts-with(local-name(.), 'value')])""]","['rim', 'rim']","['n/a', 'N/A']","There can be no stigma associated with the use of extensions by any application, project, or standard - regardless of the institution or jurisdiction that uses or defines the extensions.  The use of extensions is what allows the FHIR specification to retain a core level of simplicity for everyone.",Extension,ele-1,,,value,url,Extensions are always sliced by (at least) url,open,"['extensions', 'user content']",,,,,,,,,,,,,,,,,,,,,,
5,Simplifier|CareConnect-GPC-Condition-1.xml,Condition.meta.versionId,Condition.meta.versionId,Version specific identifier,"The version specific identifier, as it appears in the version portion of the URL. This values changes when the resource is created, updated, or deleted.",0,1,0..1,Meta.versionId,0,1,0..1,ele-1,error,All FHIR elements must have a @value or children,hasValue() | (children().count() > id.count()),@value|f:*|h:div,rim,n/a,"The server assigns this value, and ignores what the client specifies, except in the case that the server is imposing version integrity on updates/deletes.",id,ele-1,true,,,,,,,,,,,,,,,,,,,,,,,,,,,,
6,Simplifier|CareConnect-GPC-Condition-1.xml,Condition.meta.lastUpdated,Condition.meta.lastUpdated,When the resource version last changed,When the resource last changed - e.g. when the version changed.,0,1,0..1,Meta.lastUpdated,0,1,0..1,ele-1,error,All FHIR elements must have a @value or children,hasValue() | (children().count() > id.count()),@value|f:*|h:div,rim,n/a,This value is always populated except when the resource is first being created. The server / resource manager sets this value; what a client provides is irrelevant.,instant,ele-1,true,,,,,,,,,,,,,,,,,,,,,,,,,,,,
7,Simplifier|CareConnect-GPC-Condition-1.xml,Condition.meta.profile,Condition.meta.profile,Profiles this resource claims to conform to,A list of profiles (references to [StructureDefinition](structuredefinition.html#) resources) that this resource claims to conform to. The URL is a reference to [StructureDefinition.url]().,1,*,1..*,Meta.profile,0,*,0..*,ele-1,error,All FHIR elements must have a @value or children,hasValue() | (children().count() > id.count()),@value|f:*|h:div,rim,n/a,It is up to the server and/or other infrastructure of policy to determine whether/how these claims are verified and/or updated over time.  The list of profile URLs is a set.,uri,ele-1,true,,,,,,,,,,,,,,,,,,,,,,,,,,,,
8,Simplifier|CareConnect-GPC-Condition-1.xml,Condition.meta.security,Condition.meta.security,Security Labels applied to this resource,Security labels applied to this resource. These tags connect specific resources to the overall security policy and infrastructure.,0,*,0..*,Meta.security,0,*,0..*,ele-1,error,All FHIR elements must have a @value or children,hasValue() | (children().count() > id.count()),@value|f:*|h:div,"['rim', 'v2', 'rim', 'orim']","['n/a', 'CE/CNE/CWE subset one of the sets of component 1-3 or 4-6', 'CV', 'fhir:Coding rdfs:subClassOf dt:CDCoding']","The security labels can be updated without changing the stated version of the resource  The list of security labels is a set. Uniqueness is based the system/code, and version and display are ignored.",Coding,ele-1,true,,,,,,,"['http://hl7.org/fhir/StructureDefinition/elementdefinition-bindingName', 'http://hl7.org/fhir/StructureDefinition/elementdefinition-isCommonBinding']",SecurityLabels,true,extensible,Security Labels from the Healthcare Privacy and Security Classification System.,http://hl7.org/fhir/ValueSet/security-labels,,,,,,,,,,,,,,,,
9,Simplifier|CareConnect-GPC-Condition-1.xml,Condition.meta.security.id,Condition.meta.security.id,xml:id (or equivalent in JSON),unique id for the element within a resource (for internal references). This may be any string value that does not contain spaces.,0,1,0..1,Element.id,0,1,0..1,ele-1,error,All FHIR elements must have a @value or children,hasValue() | (children().count() > id.count()),@value|f:*|h:div,rim,n/a,Note that FHIR strings may not exceed 1MB in size,string,ele-1,,xmlAttr,,,,,,,,,,,,,,,,,,,,,,,,,,,
10,Simplifier|CareConnect-GPC-Condition-1.xml,Condition.meta.security.extension,Condition.meta.security.extension,Additional Content defined by implementations,"May be used to represent additional information that is not part of the basic definition of the element. In order to make the use of extensions safe and manageable, there is a strict set of governance  applied to the definition and use of extensions. Though any implementer is allowed to define an extension, there is a set of requirements that SHALL be met as part of the definition of the extension.",0,*,0..*,Element.extension,0,*,0..*,"['ele-1', 'ext-1']","['error', 'error']","['All FHIR elements must have a @value or children', 'Must have either extensions or value[x], not both']","['hasValue() | (children().count() > id.count())', 'extension.exists() != value.exists()']","['@value|f:*|h:div', ""exists(f:extension)!=exists(f:*[starts-with(local-name(.), 'value')])""]","['rim', 'rim']","['n/a', 'N/A']","There can be no stigma associated with the use of extensions by any application, project, or standard - regardless of the institution or jurisdiction that uses or defines the extensions.  The use of extensions is what allows the FHIR specification to retain a core level of simplicity for everyone.",Extension,ele-1,,,value,url,Extensions are always sliced by (at least) url,open,"['extensions', 'user content']",,,,,,,,,,,,,,,,,,,,,,
11,Simplifier|CareConnect-GPC-Condition-1.xml,Condition.meta.security.system,Condition.meta.security.system,Identity of the terminology system,The identification of the code system that defines the meaning of the symbol in the code.,0,1,0..1,Coding.system,0,1,0..1,ele-1,error,All FHIR elements must have a @value or children,hasValue() | (children().count() > id.count()),@value|f:*|h:div,"['rim', 'v2', 'rim', 'orim']","['n/a', 'C*E.3', './codeSystem', 'fhir:Coding.system rdfs:subPropertyOf dt:CDCoding.codeSystem']","The URI may be an OID (urn:oid:...) or a UUID (urn:uuid:...).  OIDs and UUIDs SHALL be references to the HL7 OID registry. Otherwise, the URI should come from HL7's list of FHIR defined special URIs or it should de-reference to some definition that establish the system clearly and unambiguously.",uri,ele-1,true,,,,,,,,,,,,,Need to be unambiguous about the source of the definition of the symbol.,,,,,,,,,,,,,,,
12,Simplifier|CareConnect-GPC-Condition-1.xml,Condition.meta.security.version,Condition.meta.security.version,Version of the system - if relevant,"The version of the code system which was used when choosing this code. Note that a well-maintained code system does not need the version reported, because the meaning of codes is consistent across versions. However this cannot consistently be assured. and when the meaning is not guaranteed to be consistent, the version SHOULD be exchanged.",0,1,0..1,Coding.version,0,1,0..1,ele-1,error,All FHIR elements must have a @value or children,hasValue() | (children().count() > id.count()),@value|f:*|h:div,"['rim', 'v2', 'rim', 'orim']","['n/a', 'C*E.7', './codeSystemVersion', 'fhir:Coding.version rdfs:subPropertyOf dt:CDCoding.codeSystemVersion']","Where the terminology does not clearly define what string should be used to identify code system versions, the recommendation is to use the date (expressed in FHIR date format) on which that version was officially published as the version date.",string,ele-1,true,,,,,,,,,,,,,,,,,,,,,,,,,,,,
13,Simplifier|CareConnect-GPC-Condition-1.xml,Condition.meta.security.code,Condition.meta.security.code,Symbol in syntax defined by the system,A symbol in syntax defined by the system. The symbol may be a predefined code or an expression in a syntax defined by the coding system (e.g. post-coordination).,0,1,0..1,Coding.code,0,1,0..1,ele-1,error,All FHIR elements must have a @value or children,hasValue() | (children().count() > id.count()),@value|f:*|h:div,"['rim', 'v2', 'rim', 'orim']","['n/a', 'C*E.1', './code', 'fhir:Coding.code rdfs:subPropertyOf dt:CDCoding.code']",Note that FHIR strings may not exceed 1MB in size,code,ele-1,true,,,,,,,,,,,,,Need to refer to a particular code in the system.,,,,,,,,,,,,,,,
14,Simplifier|CareConnect-GPC-Condition-1.xml,Condition.meta.security.display,Condition.meta.security.display,Representation defined by the system,"A representation of the meaning of the code in the system, following the rules of the system.",0,1,0..1,Coding.display,0,1,0..1,ele-1,error,All FHIR elements must have a @value or children,hasValue() | (children().count() > id.count()),@value|f:*|h:div,"['rim', 'v2', 'rim', 'orim']","['n/a', 'C*E.2 - but note this is not well followed', 'CV.displayName', 'fhir:Coding.display rdfs:subPropertyOf dt:CDCoding.displayName']",Note that FHIR strings may not exceed 1MB in size,string,ele-1,true,,,,,,,,,,,,,Need to be able to carry a human-readable meaning of the code for readers that do not know  the system.,http://hl7.org/fhir/StructureDefinition/elementdefinition-translatable,true,,,,,,,,,,,,,
15,Simplifier|CareConnect-GPC-Condition-1.xml,Condition.meta.security.userSelected,Condition.meta.security.userSelected,If this coding was chosen directly by the user,Indicates that this coding was chosen by a user directly - i.e. off a pick list of available items (codes or displays).,0,1,0..1,Coding.userSelected,0,1,0..1,ele-1,error,All FHIR elements must have a @value or children,hasValue() | (children().count() > id.count()),@value|f:*|h:div,"['rim', 'v2', 'rim', 'orim']","['n/a', 'Sometimes implied by being first', 'CD.codingRationale', 'fhir:Coding.userSelected fhir:mapsTo dt:CDCoding.codingRationale. fhir:Coding.userSelected fhir:hasMap fhir:Coding.userSelected.map. fhir:Coding.userSelected.map a fhir:Map;   fhir:target dt:CDCoding.codingRationale. fhir:Coding.userSelected\\#true a [     fhir:source ""true"";     fhir:target dt:CDCoding.codingRationale\\#O   ]']","Amongst a set of alternatives, a directly chosen code is the most appropriate starting point for new translations. There is some ambiguity about what exactly 'directly chosen' implies, and trading partner agreement may be needed to clarify the use of this element and its consequences more completely.",boolean,ele-1,true,,,,,,,,,,,,,"This has been identified as a clinical safety criterium - that this exact system/code pair was chosen explicitly, rather than inferred by the system based on some rules or language processing.",,,,,,,,,,,,,,,
16,Simplifier|CareConnect-GPC-Condition-1.xml,Condition.meta.tag,Condition.meta.tag,Tags applied to this resource,"Tags applied to this resource. Tags are intended to be used to identify and relate resources to process and workflow, and applications are not required to consider the tags when interpreting the meaning of a resource.",0,*,0..*,Meta.tag,0,*,0..*,ele-1,error,All FHIR elements must have a @value or children,hasValue() | (children().count() > id.count()),@value|f:*|h:div,"['rim', 'v2', 'rim', 'orim']","['n/a', 'CE/CNE/CWE subset one of the sets of component 1-3 or 4-6', 'CV', 'fhir:Coding rdfs:subClassOf dt:CDCoding']","The tags can be updated without changing the stated version of the resource.  The list of tags is a set. Uniqueness is based the system/code, and version and display are ignored.",Coding,ele-1,true,,,,,,,http://hl7.org/fhir/StructureDefinition/elementdefinition-bindingName,Tags,,example,"Codes that represent various types of tags, commonly workflow-related; e.g. ""Needs review by Dr. Jones""",http://hl7.org/fhir/ValueSet/common-tags,,,,,,,,,,,,,,,,
17,Simplifier|CareConnect-GPC-Condition-1.xml,Condition.meta.tag.id,Condition.meta.tag.id,xml:id (or equivalent in JSON),unique id for the element within a resource (for internal references). This may be any string value that does not contain spaces.,0,1,0..1,Element.id,0,1,0..1,ele-1,error,All FHIR elements must have a @value or children,hasValue() | (children().count() > id.count()),@value|f:*|h:div,rim,n/a,Note that FHIR strings may not exceed 1MB in size,string,ele-1,,xmlAttr,,,,,,,,,,,,,,,,,,,,,,,,,,,
18,Simplifier|CareConnect-GPC-Condition-1.xml,Condition.meta.tag.extension,Condition.meta.tag.extension,Additional Content defined by implementations,"May be used to represent additional information that is not part of the basic definition of the element. In order to make the use of extensions safe and manageable, there is a strict set of governance  applied to the definition and use of extensions. Though any implementer is allowed to define an extension, there is a set of requirements that SHALL be met as part of the definition of the extension.",0,*,0..*,Element.extension,0,*,0..*,"['ele-1', 'ext-1']","['error', 'error']","['All FHIR elements must have a @value or children', 'Must have either extensions or value[x], not both']","['hasValue() | (children().count() > id.count())', 'extension.exists() != value.exists()']","['@value|f:*|h:div', ""exists(f:extension)!=exists(f:*[starts-with(local-name(.), 'value')])""]","['rim', 'rim']","['n/a', 'N/A']","There can be no stigma associated with the use of extensions by any application, project, or standard - regardless of the institution or jurisdiction that uses or defines the extensions.  The use of extensions is what allows the FHIR specification to retain a core level of simplicity for everyone.",Extension,ele-1,,,value,url,Extensions are always sliced by (at least) url,open,"['extensions', 'user content']",,,,,,,,,,,,,,,,,,,,,,
19,Simplifier|CareConnect-GPC-Condition-1.xml,Condition.meta.tag.system,Condition.meta.tag.system,Identity of the terminology system,The identification of the code system that defines the meaning of the symbol in the code.,0,1,0..1,Coding.system,0,1,0..1,ele-1,error,All FHIR elements must have a @value or children,hasValue() | (children().count() > id.count()),@value|f:*|h:div,"['rim', 'v2', 'rim', 'orim']","['n/a', 'C*E.3', './codeSystem', 'fhir:Coding.system rdfs:subPropertyOf dt:CDCoding.codeSystem']","The URI may be an OID (urn:oid:...) or a UUID (urn:uuid:...).  OIDs and UUIDs SHALL be references to the HL7 OID registry. Otherwise, the URI should come from HL7's list of FHIR defined special URIs or it should de-reference to some definition that establish the system clearly and unambiguously.",uri,ele-1,true,,,,,,,,,,,,,Need to be unambiguous about the source of the definition of the symbol.,,,,,,,,,,,,,,,
20,Simplifier|CareConnect-GPC-Condition-1.xml,Condition.meta.tag.version,Condition.meta.tag.version,Version of the system - if relevant,"The version of the code system which was used when choosing this code. Note that a well-maintained code system does not need the version reported, because the meaning of codes is consistent across versions. However this cannot consistently be assured. and when the meaning is not guaranteed to be consistent, the version SHOULD be exchanged.",0,1,0..1,Coding.version,0,1,0..1,ele-1,error,All FHIR elements must have a @value or children,hasValue() | (children().count() > id.count()),@value|f:*|h:div,"['rim', 'v2', 'rim', 'orim']","['n/a', 'C*E.7', './codeSystemVersion', 'fhir:Coding.version rdfs:subPropertyOf dt:CDCoding.codeSystemVersion']","Where the terminology does not clearly define what string should be used to identify code system versions, the recommendation is to use the date (expressed in FHIR date format) on which that version was officially published as the version date.",string,ele-1,true,,,,,,,,,,,,,,,,,,,,,,,,,,,,
21,Simplifier|CareConnect-GPC-Condition-1.xml,Condition.meta.tag.code,Condition.meta.tag.code,Symbol in syntax defined by the system,A symbol in syntax defined by the system. The symbol may be a predefined code or an expression in a syntax defined by the coding system (e.g. post-coordination).,0,1,0..1,Coding.code,0,1,0..1,ele-1,error,All FHIR elements must have a @value or children,hasValue() | (children().count() > id.count()),@value|f:*|h:div,"['rim', 'v2', 'rim', 'orim']","['n/a', 'C*E.1', './code', 'fhir:Coding.code rdfs:subPropertyOf dt:CDCoding.code']",Note that FHIR strings may not exceed 1MB in size,code,ele-1,true,,,,,,,,,,,,,Need to refer to a particular code in the system.,,,,,,,,,,,,,,,
22,Simplifier|CareConnect-GPC-Condition-1.xml,Condition.meta.tag.display,Condition.meta.tag.display,Representation defined by the system,"A representation of the meaning of the code in the system, following the rules of the system.",0,1,0..1,Coding.display,0,1,0..1,ele-1,error,All FHIR elements must have a @value or children,hasValue() | (children().count() > id.count()),@value|f:*|h:div,"['rim', 'v2', 'rim', 'orim']","['n/a', 'C*E.2 - but note this is not well followed', 'CV.displayName', 'fhir:Coding.display rdfs:subPropertyOf dt:CDCoding.displayName']",Note that FHIR strings may not exceed 1MB in size,string,ele-1,true,,,,,,,,,,,,,Need to be able to carry a human-readable meaning of the code for readers that do not know  the system.,http://hl7.org/fhir/StructureDefinition/elementdefinition-translatable,true,,,,,,,,,,,,,
23,Simplifier|CareConnect-GPC-Condition-1.xml,Condition.meta.tag.userSelected,Condition.meta.tag.userSelected,If this coding was chosen directly by the user,Indicates that this coding was chosen by a user directly - i.e. off a pick list of available items (codes or displays).,0,1,0..1,Coding.userSelected,0,1,0..1,ele-1,error,All FHIR elements must have a @value or children,hasValue() | (children().count() > id.count()),@value|f:*|h:div,"['rim', 'v2', 'rim', 'orim']","['n/a', 'Sometimes implied by being first', 'CD.codingRationale', 'fhir:Coding.userSelected fhir:mapsTo dt:CDCoding.codingRationale. fhir:Coding.userSelected fhir:hasMap fhir:Coding.userSelected.map. fhir:Coding.userSelected.map a fhir:Map;   fhir:target dt:CDCoding.codingRationale. fhir:Coding.userSelected\\#true a [     fhir:source ""true"";     fhir:target dt:CDCoding.codingRationale\\#O   ]']","Amongst a set of alternatives, a directly chosen code is the most appropriate starting point for new translations. There is some ambiguity about what exactly 'directly chosen' implies, and trading partner agreement may be needed to clarify the use of this element and its consequences more completely.",boolean,ele-1,true,,,,,,,,,,,,,"This has been identified as a clinical safety criterium - that this exact system/code pair was chosen explicitly, rather than inferred by the system based on some rules or language processing.",,,,,,,,,,,,,,,
