48,ARS|s_CareConnect-GPC-Immunization-1,Immunization.vaccineCode.coding:snomedCT.extension,Immunization.vaccineCode.coding.extension,Additional Content defined by implementations,"May be used to represent additional information that is not part of the basic definition of the element. In order to make the use of extensions safe and manageable, there is a strict set of governance  applied to the definition and use of extensions. Though any implementer is allowed to define an extension, there is a set of requirements that SHALL be met as part of the definition of the extension.",0,*,0..*,Element.extension,0,*,"['ele-1', 'ext-1']","['error', 'error']","['All FHIR elements must have a @value or children', 'Must have either extensions or value[x], not both']","['hasValue() | (children().count() > id.count())', 'extension.exists() != value.exists()']","['@value|f:*|h:div', ""exists(f:extension)!=exists(f:*[starts-with(local-name(.), 'value')])""]","['rim', 'rim']","['n/a', 'N/A']","There can be no stigma associated with the use of extensions by any application, project, or standard - regardless of the institution or jurisdiction that uses or defines the extensions.  The use of extensions is what allows the FHIR specification to retain a core level of simplicity for everyone.",Extension,ele-1,,,value,url,Extensions are always sliced by (at least) url,open,"['extensions', 'user content']",,,,,,,,,,,,,,,,,,,,,,
49,ARS|s_CareConnect-GPC-Immunization-1,Immunization.vaccineCode.coding:snomedCT.extension:snomedCTDescriptionID,Immunization.vaccineCode.coding.extension,The SNOMED CT Description ID for the display,The SNOMED CT Description ID for the display.,0,1,0..1,Element.extension,0,*,"['ele-1', 'ext-1']","['error', 'error']","['All FHIR elements must have a @value or children', 'Must have either extensions or value[x], not both']","['hasValue() | (children().count() > id.count())', 'extension.exists() != value.exists()']","['@value|f:*|h:div', ""exists(f:extension)!=exists(f:*[starts-with(local-name(.), 'value')])""]","['rim', 'rim']","['n/a', 'N/A']","There can be no stigma associated with the use of extensions by any application, project, or standard - regardless of the institution or jurisdiction that uses or defines the extensions.  The use of extensions is what allows the FHIR specification to retain a core level of simplicity for everyone.",Extension,ele-1,,,,,,,"['extensions', 'user content']",,,,,,,,,snomedCTDescriptionID,https://fhir.nhs.uk/STU3/StructureDefinition/Extension-coding-sctdescid,,,,,,,,,,,,
50,ARS|s_CareConnect-GPC-Immunization-1,Immunization.vaccineCode.coding:snomedCT.system,Immunization.vaccineCode.coding.system,Identity of the terminology system,The identification of the code system that defines the meaning of the symbol in the code.,1,1,1..1,Coding.system,0,1,ele-1,error,All FHIR elements must have a @value or children,hasValue() | (children().count() > id.count()),@value|f:*|h:div,"['rim', 'v2', 'rim', 'orim']","['n/a', 'C*E.3', './codeSystem', 'fhir:Coding.system rdfs:subPropertyOf dt:CDCoding.codeSystem']","The URI may be an OID (urn:oid:...) or a UUID (urn:uuid:...).  OIDs and UUIDs SHALL be references to the HL7 OID registry. Otherwise, the URI should come from HL7's list of FHIR defined special URIs or it should de-reference to some definition that establish the system clearly and unambiguously.",uri,ele-1,true,,,,,,,,,,,,,,,,,,http://snomed.info/sct,Need to be unambiguous about the source of the definition of the symbol.,,,,,,,,,
51,ARS|s_CareConnect-GPC-Immunization-1,Immunization.vaccineCode.coding:snomedCT.version,Immunization.vaccineCode.coding.version,Version of the system - if relevant,"The version of the code system which was used when choosing this code. Note that a well-maintained code system does not need the version reported, because the meaning of codes is consistent across versions. However this cannot consistently be assured. and when the meaning is not guaranteed to be consistent, the version SHOULD be exchanged.",0,0,0..0,Coding.version,0,1,ele-1,error,All FHIR elements must have a @value or children,hasValue() | (children().count() > id.count()),@value|f:*|h:div,"['rim', 'v2', 'rim', 'orim']","['n/a', 'C*E.7', './codeSystemVersion', 'fhir:Coding.version rdfs:subPropertyOf dt:CDCoding.codeSystemVersion']","Where the terminology does not clearly define what string should be used to identify code system versions, the recommendation is to use the date (expressed in FHIR date format) on which that version was officially published as the version date.",string,ele-1,true,,,,,,,,,,,,,,,,,,,,,,,,,,,,
52,ARS|s_CareConnect-GPC-Immunization-1,Immunization.vaccineCode.coding:snomedCT.code,Immunization.vaccineCode.coding.code,Symbol in syntax defined by the system,A symbol in syntax defined by the system. The symbol may be a predefined code or an expression in a syntax defined by the coding system (e.g. post-coordination).,1,1,1..1,Coding.code,0,1,ele-1,error,All FHIR elements must have a @value or children,hasValue() | (children().count() > id.count()),@value|f:*|h:div,"['rim', 'v2', 'rim', 'orim']","['n/a', 'C*E.1', './code', 'fhir:Coding.code rdfs:subPropertyOf dt:CDCoding.code']",Note that FHIR strings may not exceed 1MB in size,code,ele-1,true,,,,,,,,,,,,,,,,,,,Need to refer to a particular code in the system.,,,,,,,,,
53,ARS|s_CareConnect-GPC-Immunization-1,Immunization.vaccineCode.coding:snomedCT.display,Immunization.vaccineCode.coding.display,Representation defined by the system,"A representation of the meaning of the code in the system, following the rules of the system.",1,1,1..1,Coding.display,0,1,ele-1,error,All FHIR elements must have a @value or children,hasValue() | (children().count() > id.count()),@value|f:*|h:div,"['rim', 'v2', 'rim', 'orim']","['n/a', 'C*E.2 - but note this is not well followed', 'CV.displayName', 'fhir:Coding.display rdfs:subPropertyOf dt:CDCoding.displayName']",Note that FHIR strings may not exceed 1MB in size,string,ele-1,true,,,,,,,,,,,,,,,,,,,Need to be able to carry a human-readable meaning of the code for readers that do not know  the system.,,,,,,http://hl7.org/fhir/StructureDefinition/elementdefinition-translatable,true,,
54,ARS|s_CareConnect-GPC-Immunization-1,Immunization.vaccineCode.coding:snomedCT.userSelected,Immunization.vaccineCode.coding.userSelected,If this coding was chosen directly by the user,Indicates that this coding was chosen by a user directly - i.e. off a pick list of available items (codes or displays).,0,1,0..1,Coding.userSelected,0,1,ele-1,error,All FHIR elements must have a @value or children,hasValue() | (children().count() > id.count()),@value|f:*|h:div,"['rim', 'v2', 'rim', 'orim']","['n/a', 'Sometimes implied by being first', 'CD.codingRationale', 'fhir:Coding.userSelected fhir:mapsTo dt:CDCoding.codingRationale. fhir:Coding.userSelected fhir:hasMap fhir:Coding.userSelected.map. fhir:Coding.userSelected.map a fhir:Map;   fhir:target dt:CDCoding.codingRationale. fhir:Coding.userSelected\\#true a [     fhir:source ""true"";     fhir:target dt:CDCoding.codingRationale\\#O   ]']","Amongst a set of alternatives, a directly chosen code is the most appropriate starting point for new translations. There is some ambiguity about what exactly 'directly chosen' implies, and trading partner agreement may be needed to clarify the use of this element and its consequences more completely.",boolean,ele-1,true,,,,,,,,,,,,,,,,,,,"This has been identified as a clinical safety criterium - that this exact system/code pair was chosen explicitly, rather than inferred by the system based on some rules or language processing.",,,,,,,,,
55,ARS|s_CareConnect-GPC-Immunization-1,Immunization.vaccineCode.text,Immunization.vaccineCode.text,Plain text representation of the concept,A human language representation of the concept as seen/selected/uttered by the user who entered the data and/or which represents the intended meaning of the user.,0,1,0..1,CodeableConcept.text,0,1,ele-1,error,All FHIR elements must have a @value or children,hasValue() | (children().count() > id.count()),@value|f:*|h:div,"['rim', 'v2', 'rim', 'orim']","['n/a', 'C*E.9. But note many systems use C*E.2 for this', './originalText[mediaType/code=""text/plain""]/data', 'fhir:CodeableConcept.text rdfs:subPropertyOf dt:CD.originalText']",Very often the text is the same as a displayName of one of the codings.,string,ele-1,true,,,,,,,,,,,,,,,,,,,"The codes from the terminologies do not always capture the correct meaning with all the nuances of the human using them, or sometimes there is no appropriate code at all. In these cases, the text is used to capture the full meaning of the source.",,,,,,http://hl7.org/fhir/StructureDefinition/elementdefinition-translatable,true,,
56,ARS|s_CareConnect-GPC-Immunization-1,Immunization.patient,Immunization.patient,Who was immunized,The patient who either received or did not receive the immunization.,1,1,1..1,Immunization.patient,1,1,"['ele-1', 'ref-1']","['error', 'error']","['All FHIR elements must have a @value or children', 'SHALL have a contained resource if a local reference is provided']","['hasValue() | (children().count() > id.count())', ""reference.startsWith('#').not() or (reference.substring(1).trace('url') in %resource.contained.id.trace('ids'))""]","['@value|f:*|h:div', ""not(starts-with(f:reference/@value, '#')) or exists(ancestor::*[self::f:entry or self::f:parameter]/f:resource/f:*/f:contained/f:*[f:id/@value=substring-after(current()/f:reference/@value, '#')]|/*/f:contained/f:*[f:id/@value=substring-after(current()/f:reference/@value, '#')])""]","['rim', 'rim', 'workflow', 'v2', 'rim', 'w5']","['n/a', 'The target of a resource reference is a RIM entry point (Act, Role, or Entity)', 'Event.subject', 'PID-3', '.partipication[ttypeCode=].role', 'who.focus']","References SHALL be a reference to an actual FHIR resource, and SHALL be resolveable (allowing for access control, temporary unavailability, etc). Resolution can be either by retrieval from the URL, or, where applicable by resource type, by treating an absolute reference as a canonical URL and looking it up in a local registry/repository.",Reference,ele-1,,,,,,,,,,,,,,,,,,,,,,,,https://fhir.nhs.uk/STU3/StructureDefinition/CareConnect-GPC-Patient-1,,,,,
57,ARS|s_CareConnect-GPC-Immunization-1,Immunization.encounter,Immunization.encounter,Encounter administered as part of,The visit or admission or other contact between patient and health care provider the immunization was performed as part of.,0,1,0..1,Immunization.encounter,0,1,"['ele-1', 'ref-1']","['error', 'error']","['All FHIR elements must have a @value or children', 'SHALL have a contained resource if a local reference is provided']","['hasValue() | (children().count() > id.count())', ""reference.startsWith('#').not() or (reference.substring(1).trace('url') in %resource.contained.id.trace('ids'))""]","['@value|f:*|h:div', ""not(starts-with(f:reference/@value, '#')) or exists(ancestor::*[self::f:entry or self::f:parameter]/f:resource/f:*/f:contained/f:*[f:id/@value=substring-after(current()/f:reference/@value, '#')]|/*/f:contained/f:*[f:id/@value=substring-after(current()/f:reference/@value, '#')])""]","['rim', 'rim', 'workflow', 'v2', 'rim', 'w5']","['n/a', 'The target of a resource reference is a RIM entry point (Act, Role, or Entity)', 'Event.context', 'PV1-19', 'component->EncounterEvent', 'context']","References SHALL be a reference to an actual FHIR resource, and SHALL be resolveable (allowing for access control, temporary unavailability, etc). Resolution can be either by retrieval from the URL, or, where applicable by resource type, by treating an absolute reference as a canonical URL and looking it up in a local registry/repository.",Reference,ele-1,,,,,,,,,,,,,,,,,,true,,,,,,https://fhir.hl7.org.uk/STU3/StructureDefinition/CareConnect-Encounter-1,,,,,
58,ARS|s_CareConnect-GPC-Immunization-1,Immunization.date,Immunization.date,Vaccination administration date,Date vaccine administered or was to be administered.,0,1,0..1,Immunization.date,0,1,ele-1,error,All FHIR elements must have a @value or children,hasValue() | (children().count() > id.count()),@value|f:*|h:div,"['rim', 'workflow', 'v2', 'rim', 'cda', 'w5']","['n/a', 'Event.occurrence.occurrenceDateTime', 'RXA-3', '.effectiveTime', 'ClinicalDocument/component/StructuredBody/component/section/entry/substanceAdministration/effectiveTime/value', 'when.init']","When immunizations are given a specific date and time should always be known.   When immunizations are patient reported, a specific date might not be known. Although partial dates are allowed, an adult patient might not be able to recall the year a childhood immunization was given.",dateTime,ele-1,,,,,,,,,,,,,,,,,,true,,,,,,,,,,,
59,ARS|s_CareConnect-GPC-Immunization-1,Immunization.primarySource,Immunization.primarySource,Indicates context the data was recorded in,An indication that the content of the record is based on information from the person who administered the vaccine. This reflects the context under which the data was originally recorded.,1,1,1..1,Immunization.primarySource,1,1,ele-1,error,All FHIR elements must have a @value or children,hasValue() | (children().count() > id.count()),@value|f:*|h:div,"['rim', 'v2', 'rim', 'w5']","['n/a', 'RXA-9', 'immunization.uncertaintycode (if primary source=false, uncertainty=U)', 'who.source']",Reflects the reliability of the content.,boolean,ele-1,,,,,,,,,,,,,,,,,,,,,,,,,,,,true,
60,ARS|s_CareConnect-GPC-Immunization-1,Immunization.reportOrigin,Immunization.reportOrigin,Indicates the source of a secondarily reported record,The source of the data when the report of the immunization event is not based on information from the person who administered the vaccine.,0,1,0..1,Immunization.reportOrigin,0,1,ele-1,error,All FHIR elements must have a @value or children,hasValue() | (children().count() > id.count()),@value|f:*|h:div,"['rim', 'v2', 'rim', 'orim', 'v2', 'rim', 'w5']","['n/a', 'CE/CNE/CWE', 'CD', 'fhir:CodeableConcept rdfs:subClassOf dt:CD', 'RXA-9', '.participation[typeCode=INF].role[classCode=PAT] (this syntax for self-reported) .participation[typeCode=INF].role[classCode=LIC] (this syntax for health care professional) .participation[typeCode=INF].role[classCode=PRS] (this syntax for family member)', 'who.source']","Should not be populated if primarySource = True, will not be required even if primarySource = False.",CodeableConcept,ele-1,,,,,,,,http://hl7.org/fhir/StructureDefinition/elementdefinition-bindingName,ImmunizationReportOrigin,,example,The source of the data for a record which is not from a primary source.,http://hl7.org/fhir/ValueSet/immunization-origin,,,,,true,,,,,,,,,,,
61,ARS|s_CareConnect-GPC-Immunization-1,Immunization.location,Immunization.location,Where vaccination occurred,The service delivery location where the vaccine administration occurred.,0,1,0..1,Immunization.location,0,1,"['ele-1', 'ref-1']","['error', 'error']","['All FHIR elements must have a @value or children', 'SHALL have a contained resource if a local reference is provided']","['hasValue() | (children().count() > id.count())', ""reference.startsWith('#').not() or (reference.substring(1).trace('url') in %resource.contained.id.trace('ids'))""]","['@value|f:*|h:div', ""not(starts-with(f:reference/@value, '#')) or exists(ancestor::*[self::f:entry or self::f:parameter]/f:resource/f:*/f:contained/f:*[f:id/@value=substring-after(current()/f:reference/@value, '#')]|/*/f:contained/f:*[f:id/@value=substring-after(current()/f:reference/@value, '#')])""]","['rim', 'rim', 'v2', 'rim', 'w5']","['n/a', 'The target of a resource reference is a RIM entry point (Act, Role, or Entity)', 'RXA-27  (or RXA-11, deprecated as of v2.7)', '.participation[typeCode=LOC].COCT_MT240000UV', 'where']","References SHALL be a reference to an actual FHIR resource, and SHALL be resolveable (allowing for access control, temporary unavailability, etc). Resolution can be either by retrieval from the URL, or, where applicable by resource type, by treating an absolute reference as a canonical URL and looking it up in a local registry/repository.",Reference,ele-1,,,,,,,,,,,,,,,,,,true,,,,,,https://fhir.nhs.uk/STU3/StructureDefinition/CareConnect-GPC-Location-1,,,,,
62,ARS|s_CareConnect-GPC-Immunization-1,Immunization.manufacturer,Immunization.manufacturer,Vaccine manufacturer,Name of vaccine manufacturer.,0,1,0..1,Immunization.manufacturer,0,1,"['ele-1', 'ref-1']","['error', 'error']","['All FHIR elements must have a @value or children', 'SHALL have a contained resource if a local reference is provided']","['hasValue() | (children().count() > id.count())', ""reference.startsWith('#').not() or (reference.substring(1).trace('url') in %resource.contained.id.trace('ids'))""]","['@value|f:*|h:div', ""not(starts-with(f:reference/@value, '#')) or exists(ancestor::*[self::f:entry or self::f:parameter]/f:resource/f:*/f:contained/f:*[f:id/@value=substring-after(current()/f:reference/@value, '#')]|/*/f:contained/f:*[f:id/@value=substring-after(current()/f:reference/@value, '#')])""]","['rim', 'rim', 'v2', 'rim', 'cda']","['n/a', 'The target of a resource reference is a RIM entry point (Act, Role, or Entity)', 'RXA-17', '.participation[typeCode=CSM].role[classCode=INST].scopedRole.scoper[classCode=ORG]', 'ClinicalDocument/component/StructuredBody/component/section/entry/substanceAdministration/consumable/manfacturedProduct/manufacuturerOrganization/name']","References SHALL be a reference to an actual FHIR resource, and SHALL be resolveable (allowing for access control, temporary unavailability, etc). Resolution can be either by retrieval from the URL, or, where applicable by resource type, by treating an absolute reference as a canonical URL and looking it up in a local registry/repository.",Reference,ele-1,,,,,,,,,,,,,,,,,,true,,,,,,https://fhir.nhs.uk/STU3/StructureDefinition/CareConnect-GPC-Organization-1,,,,,
63,ARS|s_CareConnect-GPC-Immunization-1,Immunization.lotNumber,Immunization.lotNumber,Vaccine lot number,Lot number of the  vaccine product.,0,1,0..1,Immunization.lotNumber,0,1,ele-1,error,All FHIR elements must have a @value or children,hasValue() | (children().count() > id.count()),@value|f:*|h:div,"['rim', 'v2', 'rim', 'cda']","['n/a', 'RXA-15', '.participation[typeCode=CSM].role[classCode=INST].scopedRole.scoper[classCode=MMAT].id', 'ClinicalDocument/component/StructuredBody/component/section/entry/substanceAdministration/consumable/manfacturedProduct/manufacturedMaterial/lotNumberText']",Note that FHIR strings may not exceed 1MB in size,string,ele-1,,,,,,,,,,,,,,,,,,true,,,,,,,,,,,
64,ARS|s_CareConnect-GPC-Immunization-1,Immunization.expirationDate,Immunization.expirationDate,Vaccine expiration date,Date vaccine batch expires.,0,1,0..1,Immunization.expirationDate,0,1,ele-1,error,All FHIR elements must have a @value or children,hasValue() | (children().count() > id.count()),@value|f:*|h:div,"['rim', 'v2', 'rim']","['n/a', 'RXA-16', '.participation[typeCode=CSM].role[classCode=INST].scopedRole.scoper[classCode=MMAT].expirationTime']",,date,ele-1,,,,,,,,,,,,,,,,,,true,,,,,,,,,,,
65,ARS|s_CareConnect-GPC-Immunization-1,Immunization.site,Immunization.site,Body site vaccine  was administered,Body site where vaccine was administered.,0,1,0..1,Immunization.site,0,1,ele-1,error,All FHIR elements must have a @value or children,hasValue() | (children().count() > id.count()),@value|f:*|h:div,"['rim', 'v2', 'rim', 'orim', 'v2', 'rim', 'cda']","['n/a', 'CE/CNE/CWE', 'CD', 'fhir:CodeableConcept rdfs:subClassOf dt:CD', 'RXR-2', 'observation.targetSiteCode', 'ClinicalDocument/component/StructuredBody/component/section/entry/substanceAdministration/approachSiteCode/code']","Not all terminology uses fit this general pattern. In some cases, models should not use CodeableConcept and use Coding directly and provide their own structure for managing text, codings, translations and the relationship between elements and pre- and post-coordination.",CodeableConcept,ele-1,,,,,,,,http://hl7.org/fhir/StructureDefinition/elementdefinition-bindingName,ImmunizationSite,,example,The site at which the vaccine was administered,http://hl7.org/fhir/ValueSet/immunization-site,,,,,true,,,,,,,,,,,
66,ARS|s_CareConnect-GPC-Immunization-1,Immunization.site.id,Immunization.site.id,xml:id (or equivalent in JSON),unique id for the element within a resource (for internal references). This may be any string value that does not contain spaces.,0,1,0..1,Element.id,0,1,ele-1,error,All FHIR elements must have a @value or children,hasValue() | (children().count() > id.count()),@value|f:*|h:div,rim,n/a,Note that FHIR strings may not exceed 1MB in size,string,ele-1,,xmlAttr,,,,,,,,,,,,,,,,,,,,,,,,,,,
67,ARS|s_CareConnect-GPC-Immunization-1,Immunization.site.extension,Immunization.site.extension,Additional Content defined by implementations,"May be used to represent additional information that is not part of the basic definition of the element. In order to make the use of extensions safe and manageable, there is a strict set of governance  applied to the definition and use of extensions. Though any implementer is allowed to define an extension, there is a set of requirements that SHALL be met as part of the definition of the extension.",0,*,0..*,Element.extension,0,*,"['ele-1', 'ext-1']","['error', 'error']","['All FHIR elements must have a @value or children', 'Must have either extensions or value[x], not both']","['hasValue() | (children().count() > id.count())', 'extension.exists() != value.exists()']","['@value|f:*|h:div', ""exists(f:extension)!=exists(f:*[starts-with(local-name(.), 'value')])""]","['rim', 'rim']","['n/a', 'N/A']","There can be no stigma associated with the use of extensions by any application, project, or standard - regardless of the institution or jurisdiction that uses or defines the extensions.  The use of extensions is what allows the FHIR specification to retain a core level of simplicity for everyone.",Extension,ele-1,,,value,url,Extensions are always sliced by (at least) url,open,"['extensions', 'user content']",,,,,,,,,,,,,,,,,,,,,,
68,ARS|s_CareConnect-GPC-Immunization-1,Immunization.site.coding,Immunization.site.coding,Code defined by a terminology system,A reference to a code defined by a terminology system.,0,*,0..*,CodeableConcept.coding,0,*,ele-1,error,All FHIR elements must have a @value or children,hasValue() | (children().count() > id.count()),@value|f:*|h:div,"['rim', 'v2', 'rim', 'orim', 'v2', 'rim', 'orim']","['n/a', 'CE/CNE/CWE subset one of the sets of component 1-3 or 4-6', 'CV', 'fhir:Coding rdfs:subClassOf dt:CDCoding', 'C*E.1-8, C*E.10-22', 'union(., ./translation)', 'fhir:CodeableConcept.coding rdfs:subPropertyOf dt:CD.coding']","Codes may be defined very casually in enumerations, or code lists, up to very formal definitions such as SNOMED CT - see the HL7 v3 Core Principles for more information.  Ordering of codings is undefined and SHALL NOT be used to infer meaning. Generally, at most only one of the coding values will be labeled as UserSelected = true.",Coding,ele-1,true,,value,system,,open,,,,,,,,,,,,,,Allows for translations and alternate encodings within a code system.  Also supports communication of the same instance to systems requiring different encodings.,,,,,,,,,false
69,ARS|s_CareConnect-GPC-Immunization-1,Immunization.site.coding:snomedCT,Immunization.site.coding,Code defined by a terminology system,A reference to a code defined by a terminology system.,0,1,0..1,CodeableConcept.coding,0,*,ele-1,error,All FHIR elements must have a @value or children,hasValue() | (children().count() > id.count()),@value|f:*|h:div,"['rim', 'v2', 'rim', 'orim', 'v2', 'rim', 'orim']","['n/a', 'CE/CNE/CWE subset one of the sets of component 1-3 or 4-6', 'CV', 'fhir:Coding rdfs:subClassOf dt:CDCoding', 'C*E.1-8, C*E.10-22', 'union(., ./translation)', 'fhir:CodeableConcept.coding rdfs:subPropertyOf dt:CD.coding']","Codes may be defined very casually in enumerations, or code lists, up to very formal definitions such as SNOMED CT - see the HL7 v3 Core Principles for more information.  Ordering of codings is undefined and SHALL NOT be used to infer meaning. Generally, at most only one of the coding values will be labeled as UserSelected = true.",Coding,ele-1,true,,,,,,,,,,,,,,,snomedCT,,,,Allows for translations and alternate encodings within a code system.  Also supports communication of the same instance to systems requiring different encodings.,,,,,,,,,
70,ARS|s_CareConnect-GPC-Immunization-1,Immunization.site.coding:snomedCT.id,Immunization.site.coding.id,xml:id (or equivalent in JSON),unique id for the element within a resource (for internal references). This may be any string value that does not contain spaces.,0,1,0..1,Element.id,0,1,ele-1,error,All FHIR elements must have a @value or children,hasValue() | (children().count() > id.count()),@value|f:*|h:div,rim,n/a,Note that FHIR strings may not exceed 1MB in size,string,ele-1,,xmlAttr,,,,,,,,,,,,,,,,,,,,,,,,,,,
