,source,element_id,element_path_value,element_short_value,element_definition_value,element_min_value,element_max_value,element_cardinality,element_base_path_value,element_base_min_value,element_base_max_value,element_constraint_key_value,element_constraint_severity_value,element_constraint_human_value,element_constraint_expression_value,element_constraint_xpath_value,element_mapping_identity_value,element_mapping_map_value,element_comment_value,element_type_code_value,element_condition_value,element_isSummary_value,element_representation_value,element_slicing_discriminator_type_value,element_slicing_discriminator_path_value,element_slicing_description_value,element_slicing_rules_value,element_alias_value,element_binding_extension_url,element_binding_extension_valueString_value,element_binding_extension_valueBoolean_value,element_binding_strength_value,element_binding_description_value,element_binding_valueSetReference_reference_value,element_isModifier_value,element_binding_extension_valueReference_reference_value,element_sliceName_value,element_type_profile_value,element_mustSupport_value,element_fixedUri_value,element_requirements_value,element_example_label_value,element_example_valueUri_value,element_example_valueString_value,element_type_targetProfile_value,element_fixedCode_value,element_extension_url,element_extension_valueBoolean_value,element_defaultValueBoolean_value,element_slicing_ordered_value
0,ARS|s_CareConnect-GPC-Immunization-1,Immunization,Immunization,Immunization event information,"Describes the event of a patient being administered a vaccination or a record of a vaccination as reported by a patient, a clinician or another party and may include vaccine reaction information and what vaccination protocol was followed.",0,*,0..*,Resource,0,*,"['dom-2', 'dom-1', 'dom-4', 'dom-3', 'imm-2', 'imm-1']","['error', 'error', 'error', 'error', 'error', 'error']","['If the resource is contained in another resource, it SHALL NOT contain nested Resources', 'If the resource is contained in another resource, it SHALL NOT contain any narrative', 'If a resource is contained in another resource, it SHALL NOT have a meta.versionId or a meta.lastUpdated', 'If the resource is contained in another resource, it SHALL be referred to from elsewhere in the resource', 'If immunization was administered (notGiven=false) then explanation.reasonNotGiven SHALL be absent.', 'If immunization was not administered (notGiven=true) then there SHALL be no reaction nor explanation.reason present']","['contained.contained.empty()', 'contained.text.empty()', 'contained.meta.versionId.empty() and contained.meta.lastUpdated.empty()', ""contained.where(('#'+id in %resource.descendants().reference).not()).empty()"", '(notGiven = true) or explanation.reasonNotGiven.empty()', '(notGiven = true).not() or (reaction.empty() and explanation.reason.empty())']","['not(parent::f:contained and f:contained)', 'not(parent::f:contained and f:text)', 'not(exists(f:contained/*/f:meta/f:versionId)) and not(exists(f:contained/*/f:meta/f:lastUpdated))', ""not(exists(for $id in f:contained/*/@id return $id[not(ancestor::f:contained/parent::*/descendant::f:reference/@value=concat('#', $id))]))"", 'not(f:notGiven/@value=false() and exists(f:explanation/f:reasonNotGiven))', 'not(f:notGiven/@value=true() and (count(f:reaction) > 0 or exists(f:explanation/f:reason)))']","['rim', 'v2', 'rim', 'w5']","['Entity. Role, or Act', 'VXU_V04', 'SubstanceAdministration', 'clinical.medication']",,,,,,,,,,,,,,,,,,,,,,,,,,,,,,,,
1,ARS|s_CareConnect-GPC-Immunization-1,Immunization.id,Immunization.id,Logical id of this artifact,"The logical id of the resource, as used in the URL for the resource. Once assigned, this value never changes.",0,1,0..1,Resource.id,0,1,ele-1,error,All FHIR elements must have a @value or children,hasValue() | (children().count() > id.count()),@value|f:*|h:div,rim,n/a,The only time that a resource does not have an id is when it is being submitted to the server using a create operation.,id,ele-1,true,,,,,,,,,,,,,,,,,,,,,,,,,,,,
2,ARS|s_CareConnect-GPC-Immunization-1,Immunization.meta,Immunization.meta,Metadata about the resource,The metadata about the resource. This is content that is maintained by the infrastructure. Changes to the content may not always be associated with version changes to the resource.,0,1,0..1,Resource.meta,0,1,ele-1,error,All FHIR elements must have a @value or children,hasValue() | (children().count() > id.count()),@value|f:*|h:div,"['rim', 'rim']","['n/a', 'N/A']",,Meta,ele-1,true,,,,,,,,,,,,,,,,,,,,,,,,,,,,
3,ARS|s_CareConnect-GPC-Immunization-1,Immunization.meta.id,Immunization.meta.id,xml:id (or equivalent in JSON),unique id for the element within a resource (for internal references). This may be any string value that does not contain spaces.,0,1,0..1,Element.id,0,1,ele-1,error,All FHIR elements must have a @value or children,hasValue() | (children().count() > id.count()),@value|f:*|h:div,rim,n/a,Note that FHIR strings may not exceed 1MB in size,string,ele-1,,xmlAttr,,,,,,,,,,,,,,,,,,,,,,,,,,,
4,ARS|s_CareConnect-GPC-Immunization-1,Immunization.meta.extension,Immunization.meta.extension,Additional Content defined by implementations,"May be used to represent additional information that is not part of the basic definition of the element. In order to make the use of extensions safe and manageable, there is a strict set of governance  applied to the definition and use of extensions. Though any implementer is allowed to define an extension, there is a set of requirements that SHALL be met as part of the definition of the extension.",0,*,0..*,Element.extension,0,*,"['ele-1', 'ext-1']","['error', 'error']","['All FHIR elements must have a @value or children', 'Must have either extensions or value[x], not both']","['hasValue() | (children().count() > id.count())', 'extension.exists() != value.exists()']","['@value|f:*|h:div', ""exists(f:extension)!=exists(f:*[starts-with(local-name(.), 'value')])""]","['rim', 'rim']","['n/a', 'N/A']","There can be no stigma associated with the use of extensions by any application, project, or standard - regardless of the institution or jurisdiction that uses or defines the extensions.  The use of extensions is what allows the FHIR specification to retain a core level of simplicity for everyone.",Extension,ele-1,,,value,url,Extensions are always sliced by (at least) url,open,"['extensions', 'user content']",,,,,,,,,,,,,,,,,,,,,,
5,ARS|s_CareConnect-GPC-Immunization-1,Immunization.meta.versionId,Immunization.meta.versionId,Version specific identifier,"The version specific identifier, as it appears in the version portion of the URL. This values changes when the resource is created, updated, or deleted.",0,1,0..1,Meta.versionId,0,1,ele-1,error,All FHIR elements must have a @value or children,hasValue() | (children().count() > id.count()),@value|f:*|h:div,rim,n/a,"The server assigns this value, and ignores what the client specifies, except in the case that the server is imposing version integrity on updates/deletes.",id,ele-1,true,,,,,,,,,,,,,,,,,,,,,,,,,,,,
6,ARS|s_CareConnect-GPC-Immunization-1,Immunization.meta.lastUpdated,Immunization.meta.lastUpdated,When the resource version last changed,When the resource last changed - e.g. when the version changed.,0,1,0..1,Meta.lastUpdated,0,1,ele-1,error,All FHIR elements must have a @value or children,hasValue() | (children().count() > id.count()),@value|f:*|h:div,rim,n/a,This value is always populated except when the resource is first being created. The server / resource manager sets this value; what a client provides is irrelevant.,instant,ele-1,true,,,,,,,,,,,,,,,,,,,,,,,,,,,,
7,ARS|s_CareConnect-GPC-Immunization-1,Immunization.meta.profile,Immunization.meta.profile,Profiles this resource claims to conform to,A list of profiles (references to [StructureDefinition](structuredefinition.html#) resources) that this resource claims to conform to. The URL is a reference to [StructureDefinition.url]().,1,*,1..*,Meta.profile,0,*,ele-1,error,All FHIR elements must have a @value or children,hasValue() | (children().count() > id.count()),@value|f:*|h:div,rim,n/a,It is up to the server and/or other infrastructure of policy to determine whether/how these claims are verified and/or updated over time.  The list of profile URLs is a set.,uri,ele-1,true,,,,,,,,,,,,,,,,,,,,,,,,,,,,
8,ARS|s_CareConnect-GPC-Immunization-1,Immunization.meta.security,Immunization.meta.security,Security Labels applied to this resource,Security labels applied to this resource. These tags connect specific resources to the overall security policy and infrastructure.,0,*,0..*,Meta.security,0,*,ele-1,error,All FHIR elements must have a @value or children,hasValue() | (children().count() > id.count()),@value|f:*|h:div,"['rim', 'v2', 'rim', 'orim']","['n/a', 'CE/CNE/CWE subset one of the sets of component 1-3 or 4-6', 'CV', 'fhir:Coding rdfs:subClassOf dt:CDCoding']","The security labels can be updated without changing the stated version of the resource  The list of security labels is a set. Uniqueness is based the system/code, and version and display are ignored.",Coding,ele-1,true,,,,,,,"['http://hl7.org/fhir/StructureDefinition/elementdefinition-bindingName', 'http://hl7.org/fhir/StructureDefinition/elementdefinition-isCommonBinding']",SecurityLabels,true,extensible,Security Labels from the Healthcare Privacy and Security Classification System.,http://hl7.org/fhir/ValueSet/security-labels,,,,,,,,,,,,,,,,
9,ARS|s_CareConnect-GPC-Immunization-1,Immunization.meta.tag,Immunization.meta.tag,Tags applied to this resource,"Tags applied to this resource. Tags are intended to be used to identify and relate resources to process and workflow, and applications are not required to consider the tags when interpreting the meaning of a resource.",0,*,0..*,Meta.tag,0,*,ele-1,error,All FHIR elements must have a @value or children,hasValue() | (children().count() > id.count()),@value|f:*|h:div,"['rim', 'v2', 'rim', 'orim']","['n/a', 'CE/CNE/CWE subset one of the sets of component 1-3 or 4-6', 'CV', 'fhir:Coding rdfs:subClassOf dt:CDCoding']","The tags can be updated without changing the stated version of the resource.  The list of tags is a set. Uniqueness is based the system/code, and version and display are ignored.",Coding,ele-1,true,,,,,,,http://hl7.org/fhir/StructureDefinition/elementdefinition-bindingName,Tags,,example,"Codes that represent various types of tags, commonly workflow-related; e.g. ""Needs review by Dr. Jones""",http://hl7.org/fhir/ValueSet/common-tags,,,,,,,,,,,,,,,,
10,ARS|s_CareConnect-GPC-Immunization-1,Immunization.implicitRules,Immunization.implicitRules,A set of rules under which this content was created,"A reference to a set of rules that were followed when the resource was constructed, and which must be understood when processing the content.",0,1,0..1,Resource.implicitRules,0,1,ele-1,error,All FHIR elements must have a @value or children,hasValue() | (children().count() > id.count()),@value|f:*|h:div,rim,n/a,"Asserting this rule set restricts the content to be only understood by a limited set of trading partners. This inherently limits the usefulness of the data in the long term. However, the existing health eco-system is highly fractured, and not yet ready to define, collect, and exchange data in a generally computable sense. Wherever possible, implementers and/or specification writers should avoid using this element.   This element is labelled as a modifier because the implicit rules may provide additional knowledge about the resource that modifies it's meaning or interpretation.",uri,ele-1,true,,,,,,,,,,,,,true,,,,,,,,,,,,,,,
11,ARS|s_CareConnect-GPC-Immunization-1,Immunization.language,Immunization.language,Language of the resource content,The base language in which the resource is written.,0,1,0..1,Resource.language,0,1,ele-1,error,All FHIR elements must have a @value or children,hasValue() | (children().count() > id.count()),@value|f:*|h:div,rim,n/a,"Language is provided to support indexing and accessibility (typically, services such as text to speech use the language tag). The html language tag in the narrative applies  to the narrative. The language tag on the resource may be used to specify the language of other presentations generated from the data in the resource  Not all the content has to be in the base language. The Resource.language should not be assumed to apply to the narrative automatically. If a language is specified, it should it also be specified on the div element in the html (see rules in HTML5 for information about the relationship between xml:lang and the html lang attribute).",code,ele-1,,,,,,,,"['http://hl7.org/fhir/StructureDefinition/elementdefinition-maxValueSet', 'http://hl7.org/fhir/StructureDefinition/elementdefinition-bindingName', 'http://hl7.org/fhir/StructureDefinition/elementdefinition-isCommonBinding']",Language,true,extensible,A human language.,http://hl7.org/fhir/ValueSet/languages,,http://hl7.org/fhir/ValueSet/all-languages,,,,,,,,,,,,,,
12,ARS|s_CareConnect-GPC-Immunization-1,Immunization.text,Immunization.text,"Text summary of the resource, for human interpretation","A human-readable narrative that contains a summary of the resource, and may be used to represent the content of the resource to a human. The narrative need not encode all the structured data, but is required to contain sufficient detail to make it ""clinically safe"" for a human to just read the narrative. Resource definitions may define what content should be represented in the narrative to ensure clinical safety.",0,1,0..1,DomainResource.text,0,1,ele-1,error,All FHIR elements must have a @value or children,hasValue() | (children().count() > id.count()),@value|f:*|h:div,"['rim', 'rim', 'rim']","['n/a', 'N/A', 'Act.text?']","Contained resources do not have narrative. Resources that are not contained SHOULD have a narrative. In some cases, a resource may only have text with little or no additional discrete data (as long as all minOccurs=1 elements are satisfied).  This may be necessary for data from legacy systems where information is captured as a ""text blob"" or where text is additionally entered raw or narrated and encoded in formation is added later.",Narrative,"['ele-1', 'dom-1']",,,,,,,"['narrative', 'html', 'xhtml', 'display']",,,,,,,,,,,,,,,,,,,,,,
13,ARS|s_CareConnect-GPC-Immunization-1,Immunization.contained,Immunization.contained,"Contained, inline Resources","These resources do not have an independent existence apart from the resource that contains them - they cannot be identified independently, and nor can they have their own independent transaction scope.",0,*,0..*,DomainResource.contained,0,*,,,,,,"['rim', 'rim']","['Entity. Role, or Act', 'N/A']","This should never be done when the content can be identified properly, as once identification is lost, it is extremely difficult (and context dependent) to restore it again.",Resource,,,,,,,,"['inline resources', 'anonymous resources', 'contained resources']",,,,,,,,,,,,,,,,,,,,,,
14,ARS|s_CareConnect-GPC-Immunization-1,Immunization.extension,Immunization.extension,Additional Content defined by implementations,"May be used to represent additional information that is not part of the basic definition of the resource. In order to make the use of extensions safe and manageable, there is a strict set of governance  applied to the definition and use of extensions. Though any implementer is allowed to define an extension, there is a set of requirements that SHALL be met as part of the definition of the extension.",0,*,0..*,DomainResource.extension,0,*,"['ele-1', 'ext-1']","['error', 'error']","['All FHIR elements must have a @value or children', 'Must have either extensions or value[x], not both']","['hasValue() | (children().count() > id.count())', 'extension.exists() != value.exists()']","['@value|f:*|h:div', ""exists(f:extension)!=exists(f:*[starts-with(local-name(.), 'value')])""]","['rim', 'rim']","['n/a', 'N/A']","There can be no stigma associated with the use of extensions by any application, project, or standard - regardless of the institution or jurisdiction that uses or defines the extensions.  The use of extensions is what allows the FHIR specification to retain a core level of simplicity for everyone.",Extension,ele-1,,,value,url,Extensions are always sliced by (at least) url,open,"['extensions', 'user content']",,,,,,,,,,,,,,,,,,,,,,
15,ARS|s_CareConnect-GPC-Immunization-1,Immunization.extension:parentPresent,Immunization.extension,Additional Content defined by implementations,"May be used to represent additional information that is not part of the basic definition of the resource. In order to make the use of extensions safe and manageable, there is a strict set of governance  applied to the definition and use of extensions. Though any implementer is allowed to define an extension, there is a set of requirements that SHALL be met as part of the definition of the extension.",0,1,0..1,DomainResource.extension,0,*,"['ele-1', 'ext-1']","['error', 'error']","['All FHIR elements must have a @value or children', 'Must have either extensions or value[x], not both']","['hasValue() | (children().count() > id.count())', 'extension.exists() != value.exists()']","['@value|f:*|h:div', ""exists(f:extension)!=exists(f:*[starts-with(local-name(.), 'value')])""]","['rim', 'rim']","['n/a', 'N/A']","There can be no stigma associated with the use of extensions by any application, project, or standard - regardless of the institution or jurisdiction that uses or defines the extensions.  The use of extensions is what allows the FHIR specification to retain a core level of simplicity for everyone.",Extension,ele-1,,,,,,,"['extensions', 'user content']",,,,,,,,,parentPresent,https://fhir.hl7.org.uk/STU3/StructureDefinition/Extension-CareConnect-ParentPresent-1,true,,,,,,,,,,,
16,ARS|s_CareConnect-GPC-Immunization-1,Immunization.extension:parentPresent.id,Immunization.extension.id,xml:id (or equivalent in JSON),unique id for the element within a resource (for internal references). This may be any string value that does not contain spaces.,0,1,0..1,Element.id,0,1,ele-1,error,All FHIR elements must have a @value or children,hasValue() | (children().count() > id.count()),@value|f:*|h:div,rim,n/a,Note that FHIR strings may not exceed 1MB in size,string,ele-1,,xmlAttr,,,,,,,,,,,,,,,,,,,,,,,,,,,
17,ARS|s_CareConnect-GPC-Immunization-1,Immunization.extension:parentPresent.extension,Immunization.extension.extension,Additional Content defined by implementations,"May be used to represent additional information that is not part of the basic definition of the element. In order to make the use of extensions safe and manageable, there is a strict set of governance  applied to the definition and use of extensions. Though any implementer is allowed to define an extension, there is a set of requirements that SHALL be met as part of the definition of the extension.",0,*,0..*,Element.extension,0,*,"['ele-1', 'ext-1']","['error', 'error']","['All FHIR elements must have a @value or children', 'Must have either extensions or value[x], not both']","['hasValue() | (children().count() > id.count())', 'extension.exists() != value.exists()']","['@value|f:*|h:div', ""exists(f:extension)!=exists(f:*[starts-with(local-name(.), 'value')])""]","['rim', 'rim']","['n/a', 'N/A']","There can be no stigma associated with the use of extensions by any application, project, or standard - regardless of the institution or jurisdiction that uses or defines the extensions.  The use of extensions is what allows the FHIR specification to retain a core level of simplicity for everyone.",Extension,ele-1,,,value,url,Extensions are always sliced by (at least) url,open,"['extensions', 'user content']",,,,,,,,,,,,,,,,,,,,,,
18,ARS|s_CareConnect-GPC-Immunization-1,Immunization.extension:parentPresent.url,Immunization.extension.url,identifies the meaning of the extension,Source of the definition for the extension code - a logical name or a URL.,1,1,1..1,Extension.url,1,1,ele-1,error,All FHIR elements must have a @value or children,hasValue() | (children().count() > id.count()),@value|f:*|h:div,"['rim', 'rim']","['n/a', 'N/A']","The definition may point directly to a computable or human-readable definition of the extensibility codes, or it may be a logical URI as declared in some other specification. The definition SHALL be a URI for the Structure Definition defining the extension.",uri,ele-1,,xmlAttr,,,,,,,,,,,,,,,,,https://fhir.hl7.org.uk/STU3/StructureDefinition/Extension-CareConnect-ParentPresent-1,,,,,,,,,,
19,ARS|s_CareConnect-GPC-Immunization-1,Immunization.extension:parentPresent.value[x],Immunization.extension.value[x],Value of extension,Value of extension - may be a resource or one of a constrained set of the data types (see Extensibility in the spec for list).,0,1,0..1,Extension.value[x],0,1,ele-1,error,All FHIR elements must have a @value or children,hasValue() | (children().count() > id.count()),@value|f:*|h:div,"['rim', 'rim']","['n/a', 'N/A']","A stream of bytes, base64 encoded","['base64Binary', 'boolean', 'code', 'date', 'dateTime', 'decimal', 'id', 'instant', 'integer', 'markdown', 'oid', 'positiveInt', 'string', 'time', 'unsignedInt', 'uri', 'Address', 'Age', 'Annotation', 'Attachment', 'CodeableConcept', 'Coding', 'ContactPoint', 'Count', 'Distance', 'Duration', 'HumanName', 'Identifier', 'Money', 'Period', 'Quantity', 'Range', 'Ratio', 'Reference', 'SampledData', 'Signature', 'Timing', 'Meta']",ele-1,,,,,,,,,,,,,,,,,,,,,,,,,,,,,
20,ARS|s_CareConnect-GPC-Immunization-1,Immunization.extension:recordedDate,Immunization.extension,The date that the Vaccination was recorded,"May be used to represent additional information that is not part of the basic definition of the resource. In order to make the use of extensions safe and manageable, there is a strict set of governance  applied to the definition and use of extensions. Though any implementer is allowed to define an extension, there is a set of requirements that SHALL be met as part of the definition of the extension.",1,1,1..1,DomainResource.extension,0,*,"['ele-1', 'ext-1']","['error', 'error']","['All FHIR elements must have a @value or children', 'Must have either extensions or value[x], not both']","['hasValue() | (children().count() > id.count())', 'extension.exists() != value.exists()']","['@value|f:*|h:div', ""exists(f:extension)!=exists(f:*[starts-with(local-name(.), 'value')])""]","['rim', 'rim']","['n/a', 'N/A']","There can be no stigma associated with the use of extensions by any application, project, or standard - regardless of the institution or jurisdiction that uses or defines the extensions.  The use of extensions is what allows the FHIR specification to retain a core level of simplicity for everyone.",Extension,ele-1,,,,,,,"['extensions', 'user content']",,,,,,,,,recordedDate,https://fhir.hl7.org.uk/STU3/StructureDefinition/Extension-CareConnect-DateRecorded-1,,,,,,,,,,,,
21,ARS|s_CareConnect-GPC-Immunization-1,Immunization.extension:recordedDate.id,Immunization.extension.id,xml:id (or equivalent in JSON),unique id for the element within a resource (for internal references). This may be any string value that does not contain spaces.,0,1,0..1,Element.id,0,1,ele-1,error,All FHIR elements must have a @value or children,hasValue() | (children().count() > id.count()),@value|f:*|h:div,rim,n/a,Note that FHIR strings may not exceed 1MB in size,string,ele-1,,xmlAttr,,,,,,,,,,,,,,,,,,,,,,,,,,,
22,ARS|s_CareConnect-GPC-Immunization-1,Immunization.extension:recordedDate.extension,Immunization.extension.extension,Additional Content defined by implementations,"May be used to represent additional information that is not part of the basic definition of the element. In order to make the use of extensions safe and manageable, there is a strict set of governance  applied to the definition and use of extensions. Though any implementer is allowed to define an extension, there is a set of requirements that SHALL be met as part of the definition of the extension.",0,*,0..*,Element.extension,0,*,"['ele-1', 'ext-1']","['error', 'error']","['All FHIR elements must have a @value or children', 'Must have either extensions or value[x], not both']","['hasValue() | (children().count() > id.count())', 'extension.exists() != value.exists()']","['@value|f:*|h:div', ""exists(f:extension)!=exists(f:*[starts-with(local-name(.), 'value')])""]","['rim', 'rim']","['n/a', 'N/A']","There can be no stigma associated with the use of extensions by any application, project, or standard - regardless of the institution or jurisdiction that uses or defines the extensions.  The use of extensions is what allows the FHIR specification to retain a core level of simplicity for everyone.",Extension,ele-1,,,value,url,Extensions are always sliced by (at least) url,open,"['extensions', 'user content']",,,,,,,,,,,,,,,,,,,,,,
23,ARS|s_CareConnect-GPC-Immunization-1,Immunization.extension:recordedDate.url,Immunization.extension.url,identifies the meaning of the extension,Source of the definition for the extension code - a logical name or a URL.,1,1,1..1,Extension.url,1,1,ele-1,error,All FHIR elements must have a @value or children,hasValue() | (children().count() > id.count()),@value|f:*|h:div,"['rim', 'rim']","['n/a', 'N/A']","The definition may point directly to a computable or human-readable definition of the extensibility codes, or it may be a logical URI as declared in some other specification. The definition SHALL be a URI for the Structure Definition defining the extension.",uri,ele-1,,xmlAttr,,,,,,,,,,,,,,,,,https://fhir.hl7.org.uk/STU3/StructureDefinition/Extension-CareConnect-DateRecorded-1,,,,,,,,,,
