25,ARS|s_CareConnect-GPC-Medication-1,Medication.language,Medication.language,Language of the resource content,The base language in which the resource is written.,0,1,0..1,Resource.language,0,1,ele-1,error,All FHIR elements must have a @value or children,hasValue() | (children().count() > id.count()),@value|f:*|h:div,rim,n/a,"Language is provided to support indexing and accessibility (typically, services such as text to speech use the language tag). The html language tag in the narrative applies  to the narrative. The language tag on the resource may be used to specify the language of other presentations generated from the data in the resource  Not all the content has to be in the base language. The Resource.language should not be assumed to apply to the narrative automatically. If a language is specified, it should it also be specified on the div element in the html (see rules in HTML5 for information about the relationship between xml:lang and the html lang attribute).",code,ele-1,,,,,,,,"['http://hl7.org/fhir/StructureDefinition/elementdefinition-maxValueSet', 'http://hl7.org/fhir/StructureDefinition/elementdefinition-bindingName', 'http://hl7.org/fhir/StructureDefinition/elementdefinition-isCommonBinding']",Language,true,extensible,A human language.,http://hl7.org/fhir/ValueSet/languages,,,,,http://hl7.org/fhir/ValueSet/all-languages,,,,,,,,,
26,ARS|s_CareConnect-GPC-Medication-1,Medication.text,Medication.text,"Text summary of the resource, for human interpretation","A human-readable narrative that contains a summary of the resource, and may be used to represent the content of the resource to a human. The narrative need not encode all the structured data, but is required to contain sufficient detail to make it ""clinically safe"" for a human to just read the narrative. Resource definitions may define what content should be represented in the narrative to ensure clinical safety.",0,1,0..1,DomainResource.text,0,1,ele-1,error,All FHIR elements must have a @value or children,hasValue() | (children().count() > id.count()),@value|f:*|h:div,"['rim', 'rim', 'rim']","['n/a', 'N/A', 'Act.text?']","Contained resources do not have narrative. Resources that are not contained SHOULD have a narrative. In some cases, a resource may only have text with little or no additional discrete data (as long as all minOccurs=1 elements are satisfied).  This may be necessary for data from legacy systems where information is captured as a ""text blob"" or where text is additionally entered raw or narrated and encoded in formation is added later.",Narrative,"['ele-1', 'dom-1']",,,,,,,"['narrative', 'html', 'xhtml', 'display']",,,,,,,,,,,,,,,,,,,,
27,ARS|s_CareConnect-GPC-Medication-1,Medication.contained,Medication.contained,"Contained, inline Resources","These resources do not have an independent existence apart from the resource that contains them - they cannot be identified independently, and nor can they have their own independent transaction scope.",0,*,0..*,DomainResource.contained,0,*,,,,,,"['rim', 'rim']","['Entity. Role, or Act', 'N/A']","This should never be done when the content can be identified properly, as once identification is lost, it is extremely difficult (and context dependent) to restore it again.",Resource,,,,,,,,"['inline resources', 'anonymous resources', 'contained resources']",,,,,,,,,,,,,,,,,,,,
28,ARS|s_CareConnect-GPC-Medication-1,Medication.extension,Medication.extension,Additional Content defined by implementations,"May be used to represent additional information that is not part of the basic definition of the resource. In order to make the use of extensions safe and manageable, there is a strict set of governance  applied to the definition and use of extensions. Though any implementer is allowed to define an extension, there is a set of requirements that SHALL be met as part of the definition of the extension.",0,*,0..*,DomainResource.extension,0,*,"['ele-1', 'ext-1']","['error', 'error']","['All FHIR elements must have a @value or children', 'Must have either extensions or value[x], not both']","['hasValue() | (children().count() > id.count())', 'extension.exists() != value.exists()']","['@value|f:*|h:div', ""exists(f:extension)!=exists(f:*[starts-with(local-name(.), 'value')])""]","['rim', 'rim']","['n/a', 'N/A']","There can be no stigma associated with the use of extensions by any application, project, or standard - regardless of the institution or jurisdiction that uses or defines the extensions.  The use of extensions is what allows the FHIR specification to retain a core level of simplicity for everyone.",Extension,ele-1,,,value,url,Extensions are always sliced by (at least) url,open,"['extensions', 'user content']",,,,,,,,,,,,,,,,,,,,
29,ARS|s_CareConnect-GPC-Medication-1,Medication.modifierExtension,Medication.modifierExtension,Extensions that cannot be ignored,"May be used to represent additional information that is not part of the basic definition of the resource, and that modifies the understanding of the element that contains it. Usually modifier elements provide negation or qualification. In order to make the use of extensions safe and manageable, there is a strict set of governance applied to the definition and use of extensions. Though any implementer is allowed to define an extension, there is a set of requirements that SHALL be met as part of the definition of the extension. Applications processing a resource are required to check for modifier extensions.",0,*,0..*,DomainResource.modifierExtension,0,*,"['ele-1', 'ext-1']","['error', 'error']","['All FHIR elements must have a @value or children', 'Must have either extensions or value[x], not both']","['hasValue() | (children().count() > id.count())', 'extension.exists() != value.exists()']","['@value|f:*|h:div', ""exists(f:extension)!=exists(f:*[starts-with(local-name(.), 'value')])""]","['rim', 'rim']","['n/a', 'N/A']","There can be no stigma associated with the use of extensions by any application, project, or standard - regardless of the institution or jurisdiction that uses or defines the extensions.  The use of extensions is what allows the FHIR specification to retain a core level of simplicity for everyone.",Extension,ele-1,,,value,url,Extensions are always sliced by (at least) url,open,"['extensions', 'user content']",,,,,,,,,,true,,,,,,,,,,
30,ARS|s_CareConnect-GPC-Medication-1,Medication.code,Medication.code,Codes that identify this medication,"A code (or set of codes) that specify this medication, or a textual description if no code is available. Usage note: This could be a standard medication code such as a code from RxNorm, SNOMED CT, IDMP etc. It could also be a national or local formulary code, optionally with translations to other code systems.",1,1,1..1,Medication.code,0,1,ele-1,error,All FHIR elements must have a @value or children,hasValue() | (children().count() > id.count()),@value|f:*|h:div,"['rim', 'v2', 'rim', 'orim', 'script10.6', 'v2', 'rim', 'w5']","['n/a', 'CE/CNE/CWE', 'CD', 'fhir:CodeableConcept rdfs:subClassOf dt:CD', 'coding.code = //element(*,MedicationType)/DrugCoded/ProductCode  coding.system = //element(*,MedicationType)/DrugCoded/ProductCodeQualifier  coding.display = //element(*,MedicationType)/DrugDescription', 'RXO-1.1-Requested Give Code.code / RXE-2.1-Give Code.code / RXD-2.1-Dispense/Give Code.code / RXG-4.1-Give Code.code /RXA-5.1-Administered Code.code / RXC-2.1 Component Code', '.code', 'class']","Depending on the context of use, the code that was actually selected by the user (prescriber, dispenser, etc.) will have the coding.userSelected set to true.  As described in the coding datatype: ""A coding may be marked as a ""userSelected"" if a user selected the particular coded value in a user interface (e.g. the user selects an item in a pick-list). If a user selected coding exists, it is the preferred choice for performing translations etc.",CodeableConcept,ele-1,true,,,,,,,http://hl7.org/fhir/StructureDefinition/elementdefinition-bindingName,MedicationFormalRepresentation,,required,A code from the SNOMED Clinical Terminology UK coding system that describes a medication from the VTM/VMP/VMPP/AMP/AMPP subsets from the dm+d terminology,https://fhir.nhs.uk/STU3/ValueSet/CareConnect-MedicationCode-1,,,,,,,,,,,,,,
31,ARS|s_CareConnect-GPC-Medication-1,Medication.code.id,Medication.code.id,xml:id (or equivalent in JSON),unique id for the element within a resource (for internal references). This may be any string value that does not contain spaces.,0,1,0..1,Element.id,0,1,ele-1,error,All FHIR elements must have a @value or children,hasValue() | (children().count() > id.count()),@value|f:*|h:div,rim,n/a,Note that FHIR strings may not exceed 1MB in size,string,ele-1,,xmlAttr,,,,,,,,,,,,,,,,,,,,,,,,,
32,ARS|s_CareConnect-GPC-Medication-1,Medication.code.extension,Medication.code.extension,Additional Content defined by implementations,"May be used to represent additional information that is not part of the basic definition of the element. In order to make the use of extensions safe and manageable, there is a strict set of governance  applied to the definition and use of extensions. Though any implementer is allowed to define an extension, there is a set of requirements that SHALL be met as part of the definition of the extension.",0,*,0..*,Element.extension,0,*,"['ele-1', 'ext-1']","['error', 'error']","['All FHIR elements must have a @value or children', 'Must have either extensions or value[x], not both']","['hasValue() | (children().count() > id.count())', 'extension.exists() != value.exists()']","['@value|f:*|h:div', ""exists(f:extension)!=exists(f:*[starts-with(local-name(.), 'value')])""]","['rim', 'rim']","['n/a', 'N/A']","There can be no stigma associated with the use of extensions by any application, project, or standard - regardless of the institution or jurisdiction that uses or defines the extensions.  The use of extensions is what allows the FHIR specification to retain a core level of simplicity for everyone.",Extension,ele-1,,,value,url,Extensions are always sliced by (at least) url,open,"['extensions', 'user content']",,,,,,,,,,,,,,,,,,,,
33,ARS|s_CareConnect-GPC-Medication-1,Medication.code.coding,Medication.code.coding,Code defined by a terminology system,A reference to a code defined by a terminology system.,0,*,0..*,CodeableConcept.coding,0,*,ele-1,error,All FHIR elements must have a @value or children,hasValue() | (children().count() > id.count()),@value|f:*|h:div,"['rim', 'v2', 'rim', 'orim', 'v2', 'rim', 'orim']","['n/a', 'CE/CNE/CWE subset one of the sets of component 1-3 or 4-6', 'CV', 'fhir:Coding rdfs:subClassOf dt:CDCoding', 'C*E.1-8, C*E.10-22', 'union(., ./translation)', 'fhir:CodeableConcept.coding rdfs:subPropertyOf dt:CD.coding']","Codes may be defined very casually in enumerations, or code lists, up to very formal definitions such as SNOMED CT - see the HL7 v3 Core Principles for more information.  Ordering of codings is undefined and SHALL NOT be used to infer meaning. Generally, at most only one of the coding values will be labeled as UserSelected = true.",Coding,ele-1,true,,,,,,,,,,,,,Allows for translations and alternate encodings within a code system.  Also supports communication of the same instance to systems requiring different encodings.,,,,,,,,,,,,,
34,ARS|s_CareConnect-GPC-Medication-1,Medication.code.coding.id,Medication.code.coding.id,xml:id (or equivalent in JSON),unique id for the element within a resource (for internal references). This may be any string value that does not contain spaces.,0,1,0..1,Element.id,0,1,ele-1,error,All FHIR elements must have a @value or children,hasValue() | (children().count() > id.count()),@value|f:*|h:div,rim,n/a,Note that FHIR strings may not exceed 1MB in size,string,ele-1,,xmlAttr,,,,,,,,,,,,,,,,,,,,,,,,,
35,ARS|s_CareConnect-GPC-Medication-1,Medication.code.coding.extension,Medication.code.coding.extension,Additional Content defined by implementations,"May be used to represent additional information that is not part of the basic definition of the element. In order to make the use of extensions safe and manageable, there is a strict set of governance  applied to the definition and use of extensions. Though any implementer is allowed to define an extension, there is a set of requirements that SHALL be met as part of the definition of the extension.",0,*,0..*,Element.extension,0,*,"['ele-1', 'ext-1']","['error', 'error']","['All FHIR elements must have a @value or children', 'Must have either extensions or value[x], not both']","['hasValue() | (children().count() > id.count())', 'extension.exists() != value.exists()']","['@value|f:*|h:div', ""exists(f:extension)!=exists(f:*[starts-with(local-name(.), 'value')])""]","['rim', 'rim']","['n/a', 'N/A']","There can be no stigma associated with the use of extensions by any application, project, or standard - regardless of the institution or jurisdiction that uses or defines the extensions.  The use of extensions is what allows the FHIR specification to retain a core level of simplicity for everyone.",Extension,ele-1,,,value,url,Extensions are always sliced by (at least) url,open,"['extensions', 'user content']",,,,,,,,,,,,,,,,,,,,
36,ARS|s_CareConnect-GPC-Medication-1,Medication.code.coding.extension:snomedCTDescriptionID,Medication.code.coding.extension,The SNOMED CT Description ID for the display,The SNOMED CT Description ID for the display.,0,1,0..1,Element.extension,0,*,"['ele-1', 'ext-1']","['error', 'error']","['All FHIR elements must have a @value or children', 'Must have either extensions or value[x], not both']","['hasValue() | (children().count() > id.count())', 'extension.exists() != value.exists()']","['@value|f:*|h:div', ""exists(f:extension)!=exists(f:*[starts-with(local-name(.), 'value')])""]","['rim', 'rim']","['n/a', 'N/A']","There can be no stigma associated with the use of extensions by any application, project, or standard - regardless of the institution or jurisdiction that uses or defines the extensions.  The use of extensions is what allows the FHIR specification to retain a core level of simplicity for everyone.",Extension,ele-1,,,,,,,"['extensions', 'user content']",,,,,,,,,,,,snomedCTDescriptionID,https://fhir.nhs.uk/STU3/StructureDefinition/Extension-coding-sctdescid,,,,,,,
37,ARS|s_CareConnect-GPC-Medication-1,Medication.code.coding.system,Medication.code.coding.system,Identity of the terminology system,The identification of the code system that defines the meaning of the symbol in the code.,1,1,1..1,Coding.system,0,1,ele-1,error,All FHIR elements must have a @value or children,hasValue() | (children().count() > id.count()),@value|f:*|h:div,"['rim', 'v2', 'rim', 'orim']","['n/a', 'C*E.3', './codeSystem', 'fhir:Coding.system rdfs:subPropertyOf dt:CDCoding.codeSystem']","The URI may be an OID (urn:oid:...) or a UUID (urn:uuid:...).  OIDs and UUIDs SHALL be references to the HL7 OID registry. Otherwise, the URI should come from HL7's list of FHIR defined special URIs or it should de-reference to some definition that establish the system clearly and unambiguously.",uri,ele-1,true,,,,,,,,,,,,,Need to be unambiguous about the source of the definition of the symbol.,,,,,,,,,,,,,
38,ARS|s_CareConnect-GPC-Medication-1,Medication.code.coding.version,Medication.code.coding.version,Version of the system - if relevant,"The version of the code system which was used when choosing this code. Note that a well-maintained code system does not need the version reported, because the meaning of codes is consistent across versions. However this cannot consistently be assured. and when the meaning is not guaranteed to be consistent, the version SHOULD be exchanged.",0,0,0..0,Coding.version,0,1,ele-1,error,All FHIR elements must have a @value or children,hasValue() | (children().count() > id.count()),@value|f:*|h:div,"['rim', 'v2', 'rim', 'orim']","['n/a', 'C*E.7', './codeSystemVersion', 'fhir:Coding.version rdfs:subPropertyOf dt:CDCoding.codeSystemVersion']","Where the terminology does not clearly define what string should be used to identify code system versions, the recommendation is to use the date (expressed in FHIR date format) on which that version was officially published as the version date.",string,ele-1,true,,,,,,,,,,,,,,,,,,,,,,,,,,
39,ARS|s_CareConnect-GPC-Medication-1,Medication.code.coding.code,Medication.code.coding.code,Symbol in syntax defined by the system,A symbol in syntax defined by the system. The symbol may be a predefined code or an expression in a syntax defined by the coding system (e.g. post-coordination).,1,1,1..1,Coding.code,0,1,ele-1,error,All FHIR elements must have a @value or children,hasValue() | (children().count() > id.count()),@value|f:*|h:div,"['rim', 'v2', 'rim', 'orim']","['n/a', 'C*E.1', './code', 'fhir:Coding.code rdfs:subPropertyOf dt:CDCoding.code']",Note that FHIR strings may not exceed 1MB in size,code,ele-1,true,,,,,,,,,,,,,Need to refer to a particular code in the system.,,,,,,,,,,,,,
40,ARS|s_CareConnect-GPC-Medication-1,Medication.code.coding.display,Medication.code.coding.display,Representation defined by the system,"A representation of the meaning of the code in the system, following the rules of the system.",0,1,0..1,Coding.display,0,1,ele-1,error,All FHIR elements must have a @value or children,hasValue() | (children().count() > id.count()),@value|f:*|h:div,"['rim', 'v2', 'rim', 'orim']","['n/a', 'C*E.2 - but note this is not well followed', 'CV.displayName', 'fhir:Coding.display rdfs:subPropertyOf dt:CDCoding.displayName']",Note that FHIR strings may not exceed 1MB in size,string,ele-1,true,,,,,,,,,,,,,Need to be able to carry a human-readable meaning of the code for readers that do not know  the system.,http://hl7.org/fhir/StructureDefinition/elementdefinition-translatable,true,,,,,,,,,,,
41,ARS|s_CareConnect-GPC-Medication-1,Medication.code.coding.userSelected,Medication.code.coding.userSelected,If this coding was chosen directly by the user,Indicates that this coding was chosen by a user directly - i.e. off a pick list of available items (codes or displays).,0,1,0..1,Coding.userSelected,0,1,ele-1,error,All FHIR elements must have a @value or children,hasValue() | (children().count() > id.count()),@value|f:*|h:div,"['rim', 'v2', 'rim', 'orim']","['n/a', 'Sometimes implied by being first', 'CD.codingRationale', 'fhir:Coding.userSelected fhir:mapsTo dt:CDCoding.codingRationale. fhir:Coding.userSelected fhir:hasMap fhir:Coding.userSelected.map. fhir:Coding.userSelected.map a fhir:Map;   fhir:target dt:CDCoding.codingRationale. fhir:Coding.userSelected\\#true a [     fhir:source ""true"";     fhir:target dt:CDCoding.codingRationale\\#O   ]']","Amongst a set of alternatives, a directly chosen code is the most appropriate starting point for new translations. There is some ambiguity about what exactly 'directly chosen' implies, and trading partner agreement may be needed to clarify the use of this element and its consequences more completely.",boolean,ele-1,true,,,,,,,,,,,,,"This has been identified as a clinical safety criterium - that this exact system/code pair was chosen explicitly, rather than inferred by the system based on some rules or language processing.",,,,,,,,,,,,,
42,ARS|s_CareConnect-GPC-Medication-1,Medication.code.text,Medication.code.text,Plain text representation of the concept,A human language representation of the concept as seen/selected/uttered by the user who entered the data and/or which represents the intended meaning of the user.,0,1,0..1,CodeableConcept.text,0,1,ele-1,error,All FHIR elements must have a @value or children,hasValue() | (children().count() > id.count()),@value|f:*|h:div,"['rim', 'v2', 'rim', 'orim']","['n/a', 'C*E.9. But note many systems use C*E.2 for this', './originalText[mediaType/code=""text/plain""]/data', 'fhir:CodeableConcept.text rdfs:subPropertyOf dt:CD.originalText']",Very often the text is the same as a displayName of one of the codings.,string,ele-1,true,,,,,,,,,,,,,"The codes from the terminologies do not always capture the correct meaning with all the nuances of the human using them, or sometimes there is no appropriate code at all. In these cases, the text is used to capture the full meaning of the source.",http://hl7.org/fhir/StructureDefinition/elementdefinition-translatable,true,,,,,,,,,,,
43,ARS|s_CareConnect-GPC-Medication-1,Medication.status,Medication.status,active | inactive | entered-in-error,A code to indicate if the medication is in active use.,0,1,0..1,Medication.status,0,1,ele-1,error,All FHIR elements must have a @value or children,hasValue() | (children().count() > id.count()),@value|f:*|h:div,"['rim', 'rim']","['n/a', '.statusCode']",This status is not intended to specify if a medication is part of a formulary.,code,ele-1,true,,,,,,,http://hl7.org/fhir/StructureDefinition/elementdefinition-bindingName,MedicationStatus,,required,A coded concept defining if the medication is in active use,http://hl7.org/fhir/ValueSet/medication-status,,,,,,,,,,,,,,
44,ARS|s_CareConnect-GPC-Medication-1,Medication.isBrand,Medication.isBrand,True if a brand,Set to true if the item is attributable to a specific manufacturer.,0,1,0..1,Medication.isBrand,0,1,ele-1,error,All FHIR elements must have a @value or children,hasValue() | (children().count() > id.count()),@value|f:*|h:div,"['rim', 'script10.6', 'rim', 'w5']","['n/a', 'no mapping', 'true if .player.scopingRole[typeCode=MANU] exists', 'class']",,boolean,ele-1,true,,,,,,,,,,,,,,,,,,,,,,,,,,
45,ARS|s_CareConnect-GPC-Medication-1,Medication.isOverTheCounter,Medication.isOverTheCounter,True if medication does not require a prescription,Set to true if the medication can be obtained without an order from a prescriber.,0,1,0..1,Medication.isOverTheCounter,0,1,ele-1,error,All FHIR elements must have a @value or children,hasValue() | (children().count() > id.count()),@value|f:*|h:div,"['rim', 'rim', 'w5']","['n/a', 'NA', 'class']",,boolean,ele-1,true,,,,,,,,,,,,,,,,,,,,,,,,,,
46,ARS|s_CareConnect-GPC-Medication-1,Medication.manufacturer,Medication.manufacturer,Manufacturer of the item,Describes the details of the manufacturer of the medication product.  This is not intended to represent the distributor of a medication product.,0,1,0..1,Medication.manufacturer,0,1,"['ele-1', 'ref-1']","['error', 'error']","['All FHIR elements must have a @value or children', 'SHALL have a contained resource if a local reference is provided']","['hasValue() | (children().count() > id.count())', ""reference.startsWith('#').not() or (reference.substring(1).trace('url') in %resource.contained.id.trace('ids'))""]","['@value|f:*|h:div', ""not(starts-with(f:reference/@value, '#')) or exists(ancestor::*[self::f:entry or self::f:parameter]/f:resource/f:*/f:contained/f:*[f:id/@value=substring-after(current()/f:reference/@value, '#')]|/*/f:contained/f:*[f:id/@value=substring-after(current()/f:reference/@value, '#')])""]","['rim', 'rim', 'script10.6', 'v2', 'rim', 'w5']","['n/a', 'The target of a resource reference is a RIM entry point (Act, Role, or Entity)', 'no mapping', 'RXD-20-Substance Manufacturer Name / RXG-21-Substance Manufacturer Name / RXA-17-Substance Manufacturer Name', '.player.scopingRole[typeCode=MANU].scoper', 'who.actor']","References SHALL be a reference to an actual FHIR resource, and SHALL be resolveable (allowing for access control, temporary unavailability, etc). Resolution can be either by retrieval from the URL, or, where applicable by resource type, by treating an absolute reference as a canonical URL and looking it up in a local registry/repository.",Reference,ele-1,true,,,,,,,,,,,,,,,,,,,,https://fhir.nhs.uk/STU3/StructureDefinition/CareConnect-GPC-Organization-1,,,,,,
47,ARS|s_CareConnect-GPC-Medication-1,Medication.manufacturer.id,Medication.manufacturer.id,xml:id (or equivalent in JSON),unique id for the element within a resource (for internal references). This may be any string value that does not contain spaces.,0,1,0..1,Element.id,0,1,ele-1,error,All FHIR elements must have a @value or children,hasValue() | (children().count() > id.count()),@value|f:*|h:div,rim,n/a,Note that FHIR strings may not exceed 1MB in size,string,ele-1,,xmlAttr,,,,,,,,,,,,,,,,,,,,,,,,,
48,ARS|s_CareConnect-GPC-Medication-1,Medication.manufacturer.extension,Medication.manufacturer.extension,Additional Content defined by implementations,"May be used to represent additional information that is not part of the basic definition of the element. In order to make the use of extensions safe and manageable, there is a strict set of governance  applied to the definition and use of extensions. Though any implementer is allowed to define an extension, there is a set of requirements that SHALL be met as part of the definition of the extension.",0,*,0..*,Element.extension,0,*,"['ele-1', 'ext-1']","['error', 'error']","['All FHIR elements must have a @value or children', 'Must have either extensions or value[x], not both']","['hasValue() | (children().count() > id.count())', 'extension.exists() != value.exists()']","['@value|f:*|h:div', ""exists(f:extension)!=exists(f:*[starts-with(local-name(.), 'value')])""]","['rim', 'rim']","['n/a', 'N/A']","There can be no stigma associated with the use of extensions by any application, project, or standard - regardless of the institution or jurisdiction that uses or defines the extensions.  The use of extensions is what allows the FHIR specification to retain a core level of simplicity for everyone.",Extension,ele-1,,,value,url,Extensions are always sliced by (at least) url,open,"['extensions', 'user content']",,,,,,,,,,,,,,,,,,,,
