137,ARS|s_CareConnect-GPC-DocumentReference-1,DocumentReference.authenticator.identifier,DocumentReference.authenticator.identifier,"Logical reference, when literal reference is not known","An identifier for the other resource. This is used when there is no way to reference the other resource directly, either because the entity is not available through a FHIR server, or because there is no way for the author of the resource to convert a known identifier to an actual location. There is no requirement that a Reference.identifier point to something that is actually exposed as a FHIR instance, but it SHALL point to a business concept that would be expected to be exposed as a FHIR instance, and that instance would need to be of a FHIR resource type allowed by the reference.","When an identifier is provided in place of a reference, any system processing the reference will only be able to resolve the identifier to a reference if it understands the business context in which the identifier is used. Sometimes this is global (e.g. a national identifier) but often it is not. For this reason, none of the useful mechanisms described for working with references (e.g. chaining, includes) are possible, nor should servers be expected to be able resolve the reference. Servers may accept an identifier based reference untouched, resolve it, and/or reject it - see CapabilityStatement.rest.resource.referencePolicy.   When both an identifier and a literal reference are provided, the literal reference is preferred. Applications processing the resource are allowed - but not required - to check that the identifier matches the literal reference  Applications converting a logical reference to a literal reference may choose to leave the logical reference present, or remove it.",0,1,0..1,Reference.identifier,0,1,ele-1,error,All FHIR elements must have a @value or children,hasValue() | (children().count() > id.count()),@value|f:*|h:div,"['rim', 'v2', 'rim', 'servd', 'rim']","['n/a', 'CX / EI (occasionally, more often EI maps to a resource id or a URL)', 'II - see see identifier pattern at http://wiki.hl7.org/index.php?title=Common_Design_Patterns#Identifier_Pattern for relevant discussion. The Identifier class is a little looser than the v3 type II because it allows URIs as well as registered OIDs or GUIDs.  Also maps to Role[classCode=IDENT]', 'Identifier', '.identifier']",Identifier,ele-1,true,,,,,,,,,,,,,,,,,,,,,,,,,,
138,ARS|s_CareConnect-GPC-DocumentReference-1,DocumentReference.authenticator.display,DocumentReference.authenticator.display,Text alternative for the resource,Plain text narrative that identifies the resource in addition to the resource reference.,"This is generally not the same as the Resource.text of the referenced resource.  The purpose is to identify what's being referenced, not to fully describe it.",0,1,0..1,Reference.display,0,1,ele-1,error,All FHIR elements must have a @value or children,hasValue() | (children().count() > id.count()),@value|f:*|h:div,"['rim', 'rim']","['n/a', 'N/A']",string,ele-1,true,,,,,,,,,,,,,,http://hl7.org/fhir/StructureDefinition/elementdefinition-translatable,true,,,,,,,,,,,
139,ARS|s_CareConnect-GPC-DocumentReference-1,DocumentReference.custodian,DocumentReference.custodian,Organization which maintains the document,Identifies the organization or group who is responsible for ongoing maintenance of and access to the document.,"Identifies the logical organization to go to find the current version, where to report issues, etc. This is different from the physical location of the document, which is the technical location of the document, which host may be delegated to the management of some other organization.",0,1,0..1,DocumentReference.custodian,0,1,"['ele-1', 'ref-1']","['error', 'error']","['All FHIR elements must have a @value or children', 'SHALL have a contained resource if a local reference is provided']","['hasValue() | (children().count() > id.count())', ""reference.startsWith('#').not() or (reference.substring(1).trace('url') in %resource.contained.id.trace('ids'))""]","['@value|f:*|h:div', ""not(starts-with(f:reference/@value, '#')) or exists(ancestor::*[self::f:entry or self::f:parameter]/f:resource/f:*/f:contained/f:*[f:id/@value=substring-after(current()/f:reference/@value, '#')]|/*/f:contained/f:*[f:id/@value=substring-after(current()/f:reference/@value, '#')])""]","['rim', 'rim', 'rim']","['n/a', 'The target of a resource reference is a RIM entry point (Act, Role, or Entity)', '.participation[typeCode=""RCV""].role[classCode=""CUST""].scoper[classCode=""ORG"" and determinerCode=""INST""]']",Reference,ele-1,true,,,,,,,,,,,,,,,,,,,,,,https://fhir.nhs.uk/STU3/StructureDefinition/CareConnect-GPC-Organization-1,,,,
140,ARS|s_CareConnect-GPC-DocumentReference-1,DocumentReference.custodian.id,DocumentReference.custodian.id,xml:id (or equivalent in JSON),unique id for the element within a resource (for internal references). This may be any string value that does not contain spaces.,Note that FHIR strings may not exceed 1MB in size,0,1,0..1,Element.id,0,1,ele-1,error,All FHIR elements must have a @value or children,hasValue() | (children().count() > id.count()),@value|f:*|h:div,rim,n/a,string,ele-1,,xmlAttr,,,,,,,,,,,,,,,,,,,,,,,,,
141,ARS|s_CareConnect-GPC-DocumentReference-1,DocumentReference.custodian.extension,DocumentReference.custodian.extension,Additional Content defined by implementations,"May be used to represent additional information that is not part of the basic definition of the element. In order to make the use of extensions safe and manageable, there is a strict set of governance  applied to the definition and use of extensions. Though any implementer is allowed to define an extension, there is a set of requirements that SHALL be met as part of the definition of the extension.","There can be no stigma associated with the use of extensions by any application, project, or standard - regardless of the institution or jurisdiction that uses or defines the extensions.  The use of extensions is what allows the FHIR specification to retain a core level of simplicity for everyone.",0,*,0..*,Element.extension,0,*,"['ele-1', 'ext-1']","['error', 'error']","['All FHIR elements must have a @value or children', 'Must have either extensions or value[x], not both']","['hasValue() | (children().count() > id.count())', 'extension.exists() != value.exists()']","['@value|f:*|h:div', ""exists(f:extension)!=exists(f:*[starts-with(local-name(.), 'value')])""]","['rim', 'rim']","['n/a', 'N/A']",Extension,ele-1,,,value,url,Extensions are always sliced by (at least) url,open,"['extensions', 'user content']",,,,,,,,,,,,,,,,,,,,
142,ARS|s_CareConnect-GPC-DocumentReference-1,DocumentReference.custodian.reference,DocumentReference.custodian.reference,"Literal reference, Relative, internal or absolute URL","A reference to a location at which the other resource is found. The reference may be a relative reference, in which case it is relative to the service base URL, or an absolute URL that resolves to the location where the resource is found. The reference may be version specific or not. If the reference is not to a FHIR RESTful server, then it should be assumed to be version specific. Internal fragment references (start with '#') refer to contained resources.","Using absolute URLs provides a stable scalable approach suitable for a cloud/web context, while using relative/logical references provides a flexible approach suitable for use when trading across closed eco-system boundaries.   Absolute URLs do not need to point to a FHIR RESTful server, though this is the preferred approach. If the URL conforms to the structure ""/[type]/[id]"" then it should be assumed that the reference is to a FHIR RESTful server.",0,1,0..1,Reference.reference,0,1,ele-1,error,All FHIR elements must have a @value or children,hasValue() | (children().count() > id.count()),@value|f:*|h:div,"['rim', 'rim']","['n/a', 'N/A']",string,"['ele-1', 'ref-1']",true,,,,,,,,,,,,,,,,,,,,,,,,,,
143,ARS|s_CareConnect-GPC-DocumentReference-1,DocumentReference.custodian.identifier,DocumentReference.custodian.identifier,"Logical reference, when literal reference is not known","An identifier for the other resource. This is used when there is no way to reference the other resource directly, either because the entity is not available through a FHIR server, or because there is no way for the author of the resource to convert a known identifier to an actual location. There is no requirement that a Reference.identifier point to something that is actually exposed as a FHIR instance, but it SHALL point to a business concept that would be expected to be exposed as a FHIR instance, and that instance would need to be of a FHIR resource type allowed by the reference.","When an identifier is provided in place of a reference, any system processing the reference will only be able to resolve the identifier to a reference if it understands the business context in which the identifier is used. Sometimes this is global (e.g. a national identifier) but often it is not. For this reason, none of the useful mechanisms described for working with references (e.g. chaining, includes) are possible, nor should servers be expected to be able resolve the reference. Servers may accept an identifier based reference untouched, resolve it, and/or reject it - see CapabilityStatement.rest.resource.referencePolicy.   When both an identifier and a literal reference are provided, the literal reference is preferred. Applications processing the resource are allowed - but not required - to check that the identifier matches the literal reference  Applications converting a logical reference to a literal reference may choose to leave the logical reference present, or remove it.",0,1,0..1,Reference.identifier,0,1,ele-1,error,All FHIR elements must have a @value or children,hasValue() | (children().count() > id.count()),@value|f:*|h:div,"['rim', 'v2', 'rim', 'servd', 'rim']","['n/a', 'CX / EI (occasionally, more often EI maps to a resource id or a URL)', 'II - see see identifier pattern at http://wiki.hl7.org/index.php?title=Common_Design_Patterns#Identifier_Pattern for relevant discussion. The Identifier class is a little looser than the v3 type II because it allows URIs as well as registered OIDs or GUIDs.  Also maps to Role[classCode=IDENT]', 'Identifier', '.identifier']",Identifier,ele-1,true,,,,,,,,,,,,,,,,,,,,,,,,,,
144,ARS|s_CareConnect-GPC-DocumentReference-1,DocumentReference.custodian.display,DocumentReference.custodian.display,Text alternative for the resource,Plain text narrative that identifies the resource in addition to the resource reference.,"This is generally not the same as the Resource.text of the referenced resource.  The purpose is to identify what's being referenced, not to fully describe it.",0,1,0..1,Reference.display,0,1,ele-1,error,All FHIR elements must have a @value or children,hasValue() | (children().count() > id.count()),@value|f:*|h:div,"['rim', 'rim']","['n/a', 'N/A']",string,ele-1,true,,,,,,,,,,,,,,http://hl7.org/fhir/StructureDefinition/elementdefinition-translatable,true,,,,,,,,,,,
145,ARS|s_CareConnect-GPC-DocumentReference-1,DocumentReference.relatesTo,DocumentReference.relatesTo,Relationships to other documents,Relationships that this document has with other document references that already exist.,This element is labeled as a modifier because documents that append to other documents are incomplete on their own.,0,*,0..*,DocumentReference.relatesTo,0,*,ele-1,error,All FHIR elements must have a @value or children,hasValue() | (children().count() > id.count()),@value|f:*|h:div,"['rim', 'rim']","['n/a', '.outboundRelationship']",BackboneElement,ele-1,true,,,,,,,,,,,,,,,,true,,,,,,,,,,
146,ARS|s_CareConnect-GPC-DocumentReference-1,DocumentReference.relatesTo.id,DocumentReference.relatesTo.id,xml:id (or equivalent in JSON),unique id for the element within a resource (for internal references). This may be any string value that does not contain spaces.,Note that FHIR strings may not exceed 1MB in size,0,1,0..1,Element.id,0,1,ele-1,error,All FHIR elements must have a @value or children,hasValue() | (children().count() > id.count()),@value|f:*|h:div,rim,n/a,string,ele-1,,xmlAttr,,,,,,,,,,,,,,,,,,,,,,,,,
147,ARS|s_CareConnect-GPC-DocumentReference-1,DocumentReference.relatesTo.extension,DocumentReference.relatesTo.extension,Additional Content defined by implementations,"May be used to represent additional information that is not part of the basic definition of the element. In order to make the use of extensions safe and manageable, there is a strict set of governance  applied to the definition and use of extensions. Though any implementer is allowed to define an extension, there is a set of requirements that SHALL be met as part of the definition of the extension.","There can be no stigma associated with the use of extensions by any application, project, or standard - regardless of the institution or jurisdiction that uses or defines the extensions.  The use of extensions is what allows the FHIR specification to retain a core level of simplicity for everyone.",0,*,0..*,Element.extension,0,*,"['ele-1', 'ext-1']","['error', 'error']","['All FHIR elements must have a @value or children', 'Must have either extensions or value[x], not both']","['hasValue() | (children().count() > id.count())', 'extension.exists() != value.exists()']","['@value|f:*|h:div', ""exists(f:extension)!=exists(f:*[starts-with(local-name(.), 'value')])""]","['rim', 'rim']","['n/a', 'N/A']",Extension,ele-1,,,value,url,Extensions are always sliced by (at least) url,open,"['extensions', 'user content']",,,,,,,,,,,,,,,,,,,,
148,ARS|s_CareConnect-GPC-DocumentReference-1,DocumentReference.relatesTo.modifierExtension,DocumentReference.relatesTo.modifierExtension,Extensions that cannot be ignored,"May be used to represent additional information that is not part of the basic definition of the element, and that modifies the understanding of the element that contains it. Usually modifier elements provide negation or qualification. In order to make the use of extensions safe and manageable, there is a strict set of governance applied to the definition and use of extensions. Though any implementer is allowed to define an extension, there is a set of requirements that SHALL be met as part of the definition of the extension. Applications processing a resource are required to check for modifier extensions.","There can be no stigma associated with the use of extensions by any application, project, or standard - regardless of the institution or jurisdiction that uses or defines the extensions.  The use of extensions is what allows the FHIR specification to retain a core level of simplicity for everyone.",0,*,0..*,BackboneElement.modifierExtension,0,*,"['ele-1', 'ext-1']","['error', 'error']","['All FHIR elements must have a @value or children', 'Must have either extensions or value[x], not both']","['hasValue() | (children().count() > id.count())', 'extension.exists() != value.exists()']","['@value|f:*|h:div', ""exists(f:extension)!=exists(f:*[starts-with(local-name(.), 'value')])""]","['rim', 'rim']","['n/a', 'N/A']",Extension,ele-1,true,,,,,,"['extensions', 'user content', 'modifiers']",,,,,,,,,,true,,,,,,,,,,
149,ARS|s_CareConnect-GPC-DocumentReference-1,DocumentReference.relatesTo.code,DocumentReference.relatesTo.code,replaces | transforms | signs | appends,The type of relationship that this document has with anther document.,"If this document appends another document, then the document cannot be fully understood without also accessing the referenced document.",1,1,1..1,DocumentReference.relatesTo.code,1,1,ele-1,error,All FHIR elements must have a @value or children,hasValue() | (children().count() > id.count()),@value|f:*|h:div,"['rim', 'rim', 'xds']","['n/a', '.outboundRelationship.typeCode', 'DocumentEntry Associations type']",code,ele-1,true,,,,,,,http://hl7.org/fhir/StructureDefinition/elementdefinition-bindingName,DocumentRelationshipType,,required,The type of relationship between documents.,http://hl7.org/fhir/ValueSet/document-relationship-type,,,,,,,,,,,,,,
150,ARS|s_CareConnect-GPC-DocumentReference-1,DocumentReference.relatesTo.target,DocumentReference.relatesTo.target,Target of the relationship,The target document of this relationship.,"References SHALL be a reference to an actual FHIR resource, and SHALL be resolveable (allowing for access control, temporary unavailability, etc). Resolution can be either by retrieval from the URL, or, where applicable by resource type, by treating an absolute reference as a canonical URL and looking it up in a local registry/repository.",1,1,1..1,DocumentReference.relatesTo.target,1,1,"['ele-1', 'ref-1']","['error', 'error']","['All FHIR elements must have a @value or children', 'SHALL have a contained resource if a local reference is provided']","['hasValue() | (children().count() > id.count())', ""reference.startsWith('#').not() or (reference.substring(1).trace('url') in %resource.contained.id.trace('ids'))""]","['@value|f:*|h:div', ""not(starts-with(f:reference/@value, '#')) or exists(ancestor::*[self::f:entry or self::f:parameter]/f:resource/f:*/f:contained/f:*[f:id/@value=substring-after(current()/f:reference/@value, '#')]|/*/f:contained/f:*[f:id/@value=substring-after(current()/f:reference/@value, '#')])""]","['rim', 'rim', 'rim', 'xds']","['n/a', 'The target of a resource reference is a RIM entry point (Act, Role, or Entity)', '.target[classCode=""DOC"", moodCode=""EVN""].id', 'DocumentEntry Associations reference']",Reference,ele-1,true,,,,,,,,,,,,,,,,,,,,,,https://fhir.nhs.uk/STU3/StructureDefinition/CareConnect-GPC-DocumentReference-1,,,,
151,ARS|s_CareConnect-GPC-DocumentReference-1,DocumentReference.relatesTo.target.id,DocumentReference.relatesTo.target.id,xml:id (or equivalent in JSON),unique id for the element within a resource (for internal references). This may be any string value that does not contain spaces.,Note that FHIR strings may not exceed 1MB in size,0,1,0..1,Element.id,0,1,ele-1,error,All FHIR elements must have a @value or children,hasValue() | (children().count() > id.count()),@value|f:*|h:div,rim,n/a,string,ele-1,,xmlAttr,,,,,,,,,,,,,,,,,,,,,,,,,
152,ARS|s_CareConnect-GPC-DocumentReference-1,DocumentReference.relatesTo.target.extension,DocumentReference.relatesTo.target.extension,Additional Content defined by implementations,"May be used to represent additional information that is not part of the basic definition of the element. In order to make the use of extensions safe and manageable, there is a strict set of governance  applied to the definition and use of extensions. Though any implementer is allowed to define an extension, there is a set of requirements that SHALL be met as part of the definition of the extension.","There can be no stigma associated with the use of extensions by any application, project, or standard - regardless of the institution or jurisdiction that uses or defines the extensions.  The use of extensions is what allows the FHIR specification to retain a core level of simplicity for everyone.",0,*,0..*,Element.extension,0,*,"['ele-1', 'ext-1']","['error', 'error']","['All FHIR elements must have a @value or children', 'Must have either extensions or value[x], not both']","['hasValue() | (children().count() > id.count())', 'extension.exists() != value.exists()']","['@value|f:*|h:div', ""exists(f:extension)!=exists(f:*[starts-with(local-name(.), 'value')])""]","['rim', 'rim']","['n/a', 'N/A']",Extension,ele-1,,,value,url,Extensions are always sliced by (at least) url,open,"['extensions', 'user content']",,,,,,,,,,,,,,,,,,,,
153,ARS|s_CareConnect-GPC-DocumentReference-1,DocumentReference.relatesTo.target.reference,DocumentReference.relatesTo.target.reference,"Literal reference, Relative, internal or absolute URL","A reference to a location at which the other resource is found. The reference may be a relative reference, in which case it is relative to the service base URL, or an absolute URL that resolves to the location where the resource is found. The reference may be version specific or not. If the reference is not to a FHIR RESTful server, then it should be assumed to be version specific. Internal fragment references (start with '#') refer to contained resources.","Using absolute URLs provides a stable scalable approach suitable for a cloud/web context, while using relative/logical references provides a flexible approach suitable for use when trading across closed eco-system boundaries.   Absolute URLs do not need to point to a FHIR RESTful server, though this is the preferred approach. If the URL conforms to the structure ""/[type]/[id]"" then it should be assumed that the reference is to a FHIR RESTful server.",0,1,0..1,Reference.reference,0,1,ele-1,error,All FHIR elements must have a @value or children,hasValue() | (children().count() > id.count()),@value|f:*|h:div,"['rim', 'rim']","['n/a', 'N/A']",string,"['ele-1', 'ref-1']",true,,,,,,,,,,,,,,,,,,,,,,,,,,
154,ARS|s_CareConnect-GPC-DocumentReference-1,DocumentReference.relatesTo.target.identifier,DocumentReference.relatesTo.target.identifier,"Logical reference, when literal reference is not known","An identifier for the other resource. This is used when there is no way to reference the other resource directly, either because the entity is not available through a FHIR server, or because there is no way for the author of the resource to convert a known identifier to an actual location. There is no requirement that a Reference.identifier point to something that is actually exposed as a FHIR instance, but it SHALL point to a business concept that would be expected to be exposed as a FHIR instance, and that instance would need to be of a FHIR resource type allowed by the reference.","When an identifier is provided in place of a reference, any system processing the reference will only be able to resolve the identifier to a reference if it understands the business context in which the identifier is used. Sometimes this is global (e.g. a national identifier) but often it is not. For this reason, none of the useful mechanisms described for working with references (e.g. chaining, includes) are possible, nor should servers be expected to be able resolve the reference. Servers may accept an identifier based reference untouched, resolve it, and/or reject it - see CapabilityStatement.rest.resource.referencePolicy.   When both an identifier and a literal reference are provided, the literal reference is preferred. Applications processing the resource are allowed - but not required - to check that the identifier matches the literal reference  Applications converting a logical reference to a literal reference may choose to leave the logical reference present, or remove it.",0,1,0..1,Reference.identifier,0,1,ele-1,error,All FHIR elements must have a @value or children,hasValue() | (children().count() > id.count()),@value|f:*|h:div,"['rim', 'v2', 'rim', 'servd', 'rim']","['n/a', 'CX / EI (occasionally, more often EI maps to a resource id or a URL)', 'II - see see identifier pattern at http://wiki.hl7.org/index.php?title=Common_Design_Patterns#Identifier_Pattern for relevant discussion. The Identifier class is a little looser than the v3 type II because it allows URIs as well as registered OIDs or GUIDs.  Also maps to Role[classCode=IDENT]', 'Identifier', '.identifier']",Identifier,ele-1,true,,,,,,,,,,,,,,,,,,,,,,,,,,
155,ARS|s_CareConnect-GPC-DocumentReference-1,DocumentReference.relatesTo.target.display,DocumentReference.relatesTo.target.display,Text alternative for the resource,Plain text narrative that identifies the resource in addition to the resource reference.,"This is generally not the same as the Resource.text of the referenced resource.  The purpose is to identify what's being referenced, not to fully describe it.",0,1,0..1,Reference.display,0,1,ele-1,error,All FHIR elements must have a @value or children,hasValue() | (children().count() > id.count()),@value|f:*|h:div,"['rim', 'rim']","['n/a', 'N/A']",string,ele-1,true,,,,,,,,,,,,,,http://hl7.org/fhir/StructureDefinition/elementdefinition-translatable,true,,,,,,,,,,,
156,ARS|s_CareConnect-GPC-DocumentReference-1,DocumentReference.description,DocumentReference.description,Document description or title,"Human-readable description of the source document. This is sometimes known as the ""title"".","What the document is about, rather than a terse summary of the document. It is commonly the case that records do not have a title and are collectively referred to by the display name of Record code (e.g. a ""consultation"" or ""progress note"").",0,1,0..1,DocumentReference.description,0,1,ele-1,error,All FHIR elements must have a @value or children,hasValue() | (children().count() > id.count()),@value|f:*|h:div,"['rim', 'v2', 'rim', 'xds']","['n/a', 'TXA-25', '.outboundRelationship[typeCode=""SUBJ""].target.text', 'DocumentEntry.description']",string,ele-1,true,,,,,,,,,,,,,Helps humans to assess whether the document is of interest.,,,,,,,,,,,,,
