23,ARS|s_CareConnect-GPC-DiagnosticReport-1,DiagnosticReport.identifier.period,DiagnosticReport.identifier.period,Time period when id is/was valid for use,Time period during which identifier is/was valid for use.,"This is not a duration - that's a measure of time (a separate type), but a duration that occurs at a fixed value of time. A Period specifies a range of time; the context of use will specify whether the entire range applies (e.g. ""the patient was an inpatient of the hospital for this time range"") or one value from the range applies (e.g. ""give to the patient between these two times""). If duration is required, specify the type as Interval|Duration.",,0,1,0..1,Identifier.period,0,1,"['ele-1', 'per-1']","['error', 'error']","['All FHIR elements must have a @value or children', 'If present, start SHALL have a lower value than end']","['hasValue() | (children().count() > id.count())', 'start.empty() or end.empty() or (start <= end)']","['@value|f:*|h:div', 'not(exists(f:start)) or not(exists(f:end)) or (f:start/@value <= f:end/@value)']","['rim', 'v2', 'rim', 'v2', 'rim', 'servd']","['n/a', 'DR', 'IVL<TS>[lowClosed=""true"" and highClosed=""true""] or URG<TS>[lowClosed=""true"" and highClosed=""true""]', 'CX.7 + CX.8', 'Role.effectiveTime or implied by context', './StartDate and ./EndDate']",Period,ele-1,true,,,,,,,,,,,,,,,,,,,,,,,,
24,ARS|s_CareConnect-GPC-DiagnosticReport-1,DiagnosticReport.identifier.assigner,DiagnosticReport.identifier.assigner,Organization that issued id (may be just text),Organization that issued/manages the identifier.,The Identifier.assigner may omit the .reference element and only contain a .display element reflecting the name or other textual information about the assigning organization.,,0,1,0..1,Identifier.assigner,0,1,"['ele-1', 'ref-1']","['error', 'error']","['All FHIR elements must have a @value or children', 'SHALL have a contained resource if a local reference is provided']","['hasValue() | (children().count() > id.count())', ""reference.startsWith('#').not() or (reference.substring(1).trace('url') in %resource.contained.id.trace('ids'))""]","['@value|f:*|h:div', ""not(starts-with(f:reference/@value, '#')) or exists(ancestor::*[self::f:entry or self::f:parameter]/f:resource/f:*/f:contained/f:*[f:id/@value=substring-after(current()/f:reference/@value, '#')]|/*/f:contained/f:*[f:id/@value=substring-after(current()/f:reference/@value, '#')])""]","['rim', 'rim', 'v2', 'rim', 'servd']","['n/a', 'The target of a resource reference is a RIM entry point (Act, Role, or Entity)', 'CX.4 / (CX.4,CX.9,CX.10)', 'II.assigningAuthorityName but note that this is an improper use by the definition of the field.  Also Role.scoper', './IdentifierIssuingAuthority']",Reference,ele-1,true,,,,,,,,,,,,,,,,,,http://hl7.org/fhir/StructureDefinition/Organization,,,,,,
25,ARS|s_CareConnect-GPC-DiagnosticReport-1,DiagnosticReport.basedOn,DiagnosticReport.basedOn,What was requested,Details concerning a test or procedure requested.,"Note: Usually there is one test request for each result, however in some circumstances multiple test requests may be represented using a single test result resource. Note that there are also cases where one request leads to multiple reports.",Request,0,*,0..*,DiagnosticReport.basedOn,0,*,"['ele-1', 'ref-1']","['error', 'error']","['All FHIR elements must have a @value or children', 'SHALL have a contained resource if a local reference is provided']","['hasValue() | (children().count() > id.count())', ""reference.startsWith('#').not() or (reference.substring(1).trace('url') in %resource.contained.id.trace('ids'))""]","['@value|f:*|h:div', ""not(starts-with(f:reference/@value, '#')) or exists(ancestor::*[self::f:entry or self::f:parameter]/f:resource/f:*/f:contained/f:*[f:id/@value=substring-after(current()/f:reference/@value, '#')]|/*/f:contained/f:*[f:id/@value=substring-after(current()/f:reference/@value, '#')])""]","['rim', 'rim', 'workflow', 'v2', 'rim']","['n/a', 'The target of a resource reference is a RIM entry point (Act, Role, or Entity)', 'Event.basedOn', 'ORC? OBR-2/3?', 'outboundRelationship[typeCode=FLFS].target']",Reference,ele-1,,,,,,,,,,,,,,,This allows tracing of authorization for the report and tracking whether proposals/recommendations were acted upon.,,,,https://fhir.nhs.uk/STU3/StructureDefinition/CareConnect-GPC-ProcedureRequest-1,true,,,,,
26,ARS|s_CareConnect-GPC-DiagnosticReport-1,DiagnosticReport.status,DiagnosticReport.status,registered | partial | preliminary | final +,The status of the diagnostic report as a whole.,"This is labeled as ""Is Modifier"" because applications need to take appropriate action if a report is withdrawn.",,1,1,1..1,DiagnosticReport.status,1,1,ele-1,error,All FHIR elements must have a @value or children,hasValue() | (children().count() > id.count()),@value|f:*|h:div,"['rim', 'workflow', 'v2', 'rim', 'w5']","['n/a', 'Event.status', 'OBR-25 (not 1:1 mapping)', 'statusCode  Note: final and amended are distinguished by whether observation is the subject of a ControlAct event of type ""revise""', 'status']",code,ele-1,true,,,,,,http://hl7.org/fhir/StructureDefinition/elementdefinition-bindingName,DiagnosticReportStatus,,required,The status of the diagnostic report as a whole.,http://hl7.org/fhir/ValueSet/diagnostic-report-status,true,,"Diagnostic services routinely issue provisional/incomplete reports, and sometimes withdraw previously released reports.",,,,,,,,,,
27,ARS|s_CareConnect-GPC-DiagnosticReport-1,DiagnosticReport.category,DiagnosticReport.category,Service category,"A code that classifies the clinical discipline, department or diagnostic service that created the report (e.g. cardiology, biochemistry, hematology, MRI). This is used for searching, sorting and display purposes.",The level of granularity is defined by the category concepts in the value set. More fine-grained filtering can be performed using the metadata and/or terminology hierarchy in DiagnosticReport.code.,"['Department', 'Sub-department', 'Service', 'Discipline']",0,1,0..1,DiagnosticReport.category,0,1,ele-1,error,All FHIR elements must have a @value or children,hasValue() | (children().count() > id.count()),@value|f:*|h:div,"['rim', 'v2', 'rim', 'orim', 'v2', 'rim', 'w5']","['n/a', 'CE/CNE/CWE', 'CD', 'fhir:CodeableConcept rdfs:subClassOf dt:CD', 'OBR-24', 'inboundRelationship[typeCode=COMP].source[classCode=LIST, moodCode=EVN, code < LabService].code', 'class']",CodeableConcept,ele-1,true,,,,,,http://hl7.org/fhir/StructureDefinition/elementdefinition-bindingName,DiagnosticServiceSection,,preferred,Codes for diagnostic service sections.,http://hl7.org/fhir/ValueSet/diagnostic-service-sections,,,,,,,,true,,,,,
28,ARS|s_CareConnect-GPC-DiagnosticReport-1,DiagnosticReport.category.id,DiagnosticReport.category.id,xml:id (or equivalent in JSON),unique id for the element within a resource (for internal references). This may be any string value that does not contain spaces.,Note that FHIR strings may not exceed 1MB in size,,0,1,0..1,Element.id,0,1,ele-1,error,All FHIR elements must have a @value or children,hasValue() | (children().count() > id.count()),@value|f:*|h:div,rim,n/a,string,ele-1,,xmlAttr,,,,,,,,,,,,,,,,,,,,,,,
29,ARS|s_CareConnect-GPC-DiagnosticReport-1,DiagnosticReport.category.extension,DiagnosticReport.category.extension,Additional Content defined by implementations,"May be used to represent additional information that is not part of the basic definition of the element. In order to make the use of extensions safe and manageable, there is a strict set of governance  applied to the definition and use of extensions. Though any implementer is allowed to define an extension, there is a set of requirements that SHALL be met as part of the definition of the extension.","There can be no stigma associated with the use of extensions by any application, project, or standard - regardless of the institution or jurisdiction that uses or defines the extensions.  The use of extensions is what allows the FHIR specification to retain a core level of simplicity for everyone.","['extensions', 'user content']",0,*,0..*,Element.extension,0,*,"['ele-1', 'ext-1']","['error', 'error']","['All FHIR elements must have a @value or children', 'Must have either extensions or value[x], not both']","['hasValue() | (children().count() > id.count())', 'extension.exists() != value.exists()']","['@value|f:*|h:div', ""exists(f:extension)!=exists(f:*[starts-with(local-name(.), 'value')])""]","['rim', 'rim']","['n/a', 'N/A']",Extension,ele-1,,,value,url,Extensions are always sliced by (at least) url,open,,,,,,,,,,,,,,,,,,,
30,ARS|s_CareConnect-GPC-DiagnosticReport-1,DiagnosticReport.category.coding,DiagnosticReport.category.coding,Code defined by a terminology system,A reference to a code defined by a terminology system.,"Codes may be defined very casually in enumerations, or code lists, up to very formal definitions such as SNOMED CT - see the HL7 v3 Core Principles for more information.  Ordering of codings is undefined and SHALL NOT be used to infer meaning. Generally, at most only one of the coding values will be labeled as UserSelected = true.",,0,*,0..*,CodeableConcept.coding,0,*,ele-1,error,All FHIR elements must have a @value or children,hasValue() | (children().count() > id.count()),@value|f:*|h:div,"['rim', 'v2', 'rim', 'orim', 'v2', 'rim', 'orim']","['n/a', 'CE/CNE/CWE subset one of the sets of component 1-3 or 4-6', 'CV', 'fhir:Coding rdfs:subClassOf dt:CDCoding', 'C*E.1-8, C*E.10-22', 'union(., ./translation)', 'fhir:CodeableConcept.coding rdfs:subPropertyOf dt:CD.coding']",Coding,ele-1,true,,value,system,,open,,,,,,,,,Allows for translations and alternate encodings within a code system.  Also supports communication of the same instance to systems requiring different encodings.,,,,,,,,,,
31,ARS|s_CareConnect-GPC-DiagnosticReport-1,DiagnosticReport.category.coding:snomedCT,DiagnosticReport.category.coding,Code defined by a terminology system,A reference to a code defined by a terminology system.,"Codes may be defined very casually in enumerations, or code lists, up to very formal definitions such as SNOMED CT - see the HL7 v3 Core Principles for more information.  Ordering of codings is undefined and SHALL NOT be used to infer meaning. Generally, at most only one of the coding values will be labeled as UserSelected = true.",,0,*,0..*,CodeableConcept.coding,0,*,ele-1,error,All FHIR elements must have a @value or children,hasValue() | (children().count() > id.count()),@value|f:*|h:div,"['rim', 'v2', 'rim', 'orim', 'v2', 'rim', 'orim']","['n/a', 'CE/CNE/CWE subset one of the sets of component 1-3 or 4-6', 'CV', 'fhir:Coding rdfs:subClassOf dt:CDCoding', 'C*E.1-8, C*E.10-22', 'union(., ./translation)', 'fhir:CodeableConcept.coding rdfs:subPropertyOf dt:CD.coding']",Coding,ele-1,true,,,,,,,,,,,,,,Allows for translations and alternate encodings within a code system.  Also supports communication of the same instance to systems requiring different encodings.,,,,,,snomedCT,,,,
32,ARS|s_CareConnect-GPC-DiagnosticReport-1,DiagnosticReport.category.coding:snomedCT.id,DiagnosticReport.category.coding.id,xml:id (or equivalent in JSON),unique id for the element within a resource (for internal references). This may be any string value that does not contain spaces.,Note that FHIR strings may not exceed 1MB in size,,0,1,0..1,Element.id,0,1,ele-1,error,All FHIR elements must have a @value or children,hasValue() | (children().count() > id.count()),@value|f:*|h:div,rim,n/a,string,ele-1,,xmlAttr,,,,,,,,,,,,,,,,,,,,,,,
33,ARS|s_CareConnect-GPC-DiagnosticReport-1,DiagnosticReport.category.coding:snomedCT.extension,DiagnosticReport.category.coding.extension,Additional Content defined by implementations,"May be used to represent additional information that is not part of the basic definition of the element. In order to make the use of extensions safe and manageable, there is a strict set of governance  applied to the definition and use of extensions. Though any implementer is allowed to define an extension, there is a set of requirements that SHALL be met as part of the definition of the extension.","There can be no stigma associated with the use of extensions by any application, project, or standard - regardless of the institution or jurisdiction that uses or defines the extensions.  The use of extensions is what allows the FHIR specification to retain a core level of simplicity for everyone.","['extensions', 'user content']",0,*,0..*,Element.extension,0,*,"['ele-1', 'ext-1']","['error', 'error']","['All FHIR elements must have a @value or children', 'Must have either extensions or value[x], not both']","['hasValue() | (children().count() > id.count())', 'extension.exists() != value.exists()']","['@value|f:*|h:div', ""exists(f:extension)!=exists(f:*[starts-with(local-name(.), 'value')])""]","['rim', 'rim']","['n/a', 'N/A']",Extension,ele-1,,,value,url,Extensions are always sliced by (at least) url,open,,,,,,,,,,,,,,,,,,,
34,ARS|s_CareConnect-GPC-DiagnosticReport-1,DiagnosticReport.category.coding:snomedCT.extension:snomedCTDescriptionID,DiagnosticReport.category.coding.extension,Additional Content defined by implementations,"May be used to represent additional information that is not part of the basic definition of the element. In order to make the use of extensions safe and manageable, there is a strict set of governance  applied to the definition and use of extensions. Though any implementer is allowed to define an extension, there is a set of requirements that SHALL be met as part of the definition of the extension.","There can be no stigma associated with the use of extensions by any application, project, or standard - regardless of the institution or jurisdiction that uses or defines the extensions.  The use of extensions is what allows the FHIR specification to retain a core level of simplicity for everyone.","['extensions', 'user content']",0,*,0..*,Element.extension,0,*,"['ele-1', 'ext-1']","['error', 'error']","['All FHIR elements must have a @value or children', 'Must have either extensions or value[x], not both']","['hasValue() | (children().count() > id.count())', 'extension.exists() != value.exists()']","['@value|f:*|h:div', ""exists(f:extension)!=exists(f:*[starts-with(local-name(.), 'value')])""]","['rim', 'rim']","['n/a', 'N/A']",Extension,ele-1,,,,,,,,,,,,,,,,,,,,,snomedCTDescriptionID,https://fhir.hl7.org.uk/STU3/StructureDefinition/Extension-coding-sctdescid,,,
35,ARS|s_CareConnect-GPC-DiagnosticReport-1,DiagnosticReport.category.coding:snomedCT.extension:snomedCTDescriptionID.id,DiagnosticReport.category.coding.extension.id,xml:id (or equivalent in JSON),unique id for the element within a resource (for internal references). This may be any string value that does not contain spaces.,Note that FHIR strings may not exceed 1MB in size,,0,1,0..1,Element.id,0,1,ele-1,error,All FHIR elements must have a @value or children,hasValue() | (children().count() > id.count()),@value|f:*|h:div,rim,n/a,string,ele-1,,xmlAttr,,,,,,,,,,,,,,,,,,,,,,,
36,ARS|s_CareConnect-GPC-DiagnosticReport-1,DiagnosticReport.category.coding:snomedCT.extension:snomedCTDescriptionID.extension,DiagnosticReport.category.coding.extension.extension,Additional Content defined by implementations,"May be used to represent additional information that is not part of the basic definition of the element. In order to make the use of extensions safe and manageable, there is a strict set of governance  applied to the definition and use of extensions. Though any implementer is allowed to define an extension, there is a set of requirements that SHALL be met as part of the definition of the extension.","There can be no stigma associated with the use of extensions by any application, project, or standard - regardless of the institution or jurisdiction that uses or defines the extensions.  The use of extensions is what allows the FHIR specification to retain a core level of simplicity for everyone.","['extensions', 'user content']",0,*,0..*,Element.extension,0,*,"['ele-1', 'ext-1']","['error', 'error']","['All FHIR elements must have a @value or children', 'Must have either extensions or value[x], not both']","['hasValue() | (children().count() > id.count())', 'extension.exists() != value.exists()']","['@value|f:*|h:div', ""exists(f:extension)!=exists(f:*[starts-with(local-name(.), 'value')])""]","['rim', 'rim']","['n/a', 'N/A']",Extension,ele-1,,,value,url,Extensions are always sliced by (at least) url,open,,,,,,,,,,,,,,,,,,,
37,ARS|s_CareConnect-GPC-DiagnosticReport-1,DiagnosticReport.category.coding:snomedCT.extension:snomedCTDescriptionID.url,DiagnosticReport.category.coding.extension.url,identifies the meaning of the extension,Source of the definition for the extension code - a logical name or a URL.,"The definition may point directly to a computable or human-readable definition of the extensibility codes, or it may be a logical URI as declared in some other specification. The definition SHALL be a URI for the Structure Definition defining the extension.",,1,1,1..1,Extension.url,1,1,ele-1,error,All FHIR elements must have a @value or children,hasValue() | (children().count() > id.count()),@value|f:*|h:div,"['rim', 'rim']","['n/a', 'N/A']",uri,ele-1,,xmlAttr,,,,,,,,,,,,,,,,,,,,,https://fhir.hl7.org.uk/STU3/StructureDefinition/Extension-coding-sctdescid,,
38,ARS|s_CareConnect-GPC-DiagnosticReport-1,DiagnosticReport.category.coding:snomedCT.extension:snomedCTDescriptionID.value[x],DiagnosticReport.category.coding.extension.value[x],Value of extension,Value of extension - may be a resource or one of a constrained set of the data types (see Extensibility in the spec for list).,"A stream of bytes, base64 encoded",,0,1,0..1,Extension.value[x],0,1,ele-1,error,All FHIR elements must have a @value or children,hasValue() | (children().count() > id.count()),@value|f:*|h:div,"['rim', 'rim']","['n/a', 'N/A']","['base64Binary', 'boolean', 'code', 'date', 'dateTime', 'decimal', 'id', 'instant', 'integer', 'markdown', 'oid', 'positiveInt', 'string', 'time', 'unsignedInt', 'uri', 'Address', 'Age', 'Annotation', 'Attachment', 'CodeableConcept', 'Coding', 'ContactPoint', 'Count', 'Distance', 'Duration', 'HumanName', 'Identifier', 'Money', 'Period', 'Quantity', 'Range', 'Ratio', 'Reference', 'SampledData', 'Signature', 'Timing', 'Meta']",ele-1,,,,,,,,,,,,,,,,,,,,,,,,,
39,ARS|s_CareConnect-GPC-DiagnosticReport-1,DiagnosticReport.category.coding:snomedCT.system,DiagnosticReport.category.coding.system,Identity of the terminology system,The identification of the code system that defines the meaning of the symbol in the code.,"The URI may be an OID (urn:oid:...) or a UUID (urn:uuid:...).  OIDs and UUIDs SHALL be references to the HL7 OID registry. Otherwise, the URI should come from HL7's list of FHIR defined special URIs or it should de-reference to some definition that establish the system clearly and unambiguously.",,1,1,1..1,Coding.system,0,1,ele-1,error,All FHIR elements must have a @value or children,hasValue() | (children().count() > id.count()),@value|f:*|h:div,"['rim', 'v2', 'rim', 'orim']","['n/a', 'C*E.3', './codeSystem', 'fhir:Coding.system rdfs:subPropertyOf dt:CDCoding.codeSystem']",uri,ele-1,true,,,,,,,,,,,,,,Need to be unambiguous about the source of the definition of the symbol.,,,,,,,,http://snomed.info/sct,,
40,ARS|s_CareConnect-GPC-DiagnosticReport-1,DiagnosticReport.category.coding:snomedCT.version,DiagnosticReport.category.coding.version,Version of the system - if relevant,"The version of the code system which was used when choosing this code. Note that a well-maintained code system does not need the version reported, because the meaning of codes is consistent across versions. However this cannot consistently be assured. and when the meaning is not guaranteed to be consistent, the version SHOULD be exchanged.","Where the terminology does not clearly define what string should be used to identify code system versions, the recommendation is to use the date (expressed in FHIR date format) on which that version was officially published as the version date.",,0,1,0..1,Coding.version,0,1,ele-1,error,All FHIR elements must have a @value or children,hasValue() | (children().count() > id.count()),@value|f:*|h:div,"['rim', 'v2', 'rim', 'orim']","['n/a', 'C*E.7', './codeSystemVersion', 'fhir:Coding.version rdfs:subPropertyOf dt:CDCoding.codeSystemVersion']",string,ele-1,true,,,,,,,,,,,,,,,,,,,,,,,,
41,ARS|s_CareConnect-GPC-DiagnosticReport-1,DiagnosticReport.category.coding:snomedCT.code,DiagnosticReport.category.coding.code,Symbol in syntax defined by the system,A symbol in syntax defined by the system. The symbol may be a predefined code or an expression in a syntax defined by the coding system (e.g. post-coordination).,Note that FHIR strings may not exceed 1MB in size,,1,1,1..1,Coding.code,0,1,ele-1,error,All FHIR elements must have a @value or children,hasValue() | (children().count() > id.count()),@value|f:*|h:div,"['rim', 'v2', 'rim', 'orim']","['n/a', 'C*E.1', './code', 'fhir:Coding.code rdfs:subPropertyOf dt:CDCoding.code']",code,ele-1,true,,,,,,,,,,,,,,Need to refer to a particular code in the system.,,,,,,,,,,
42,ARS|s_CareConnect-GPC-DiagnosticReport-1,DiagnosticReport.category.coding:snomedCT.display,DiagnosticReport.category.coding.display,Representation defined by the system,"A representation of the meaning of the code in the system, following the rules of the system.",Note that FHIR strings may not exceed 1MB in size,,1,1,1..1,Coding.display,0,1,ele-1,error,All FHIR elements must have a @value or children,hasValue() | (children().count() > id.count()),@value|f:*|h:div,"['rim', 'v2', 'rim', 'orim']","['n/a', 'C*E.2 - but note this is not well followed', 'CV.displayName', 'fhir:Coding.display rdfs:subPropertyOf dt:CDCoding.displayName']",string,ele-1,true,,,,,,,,,,,,,,Need to be able to carry a human-readable meaning of the code for readers that do not know  the system.,,,,,,,,,http://hl7.org/fhir/StructureDefinition/elementdefinition-translatable,true
43,ARS|s_CareConnect-GPC-DiagnosticReport-1,DiagnosticReport.category.coding:snomedCT.userSelected,DiagnosticReport.category.coding.userSelected,If this coding was chosen directly by the user,Indicates that this coding was chosen by a user directly - i.e. off a pick list of available items (codes or displays).,"Amongst a set of alternatives, a directly chosen code is the most appropriate starting point for new translations. There is some ambiguity about what exactly 'directly chosen' implies, and trading partner agreement may be needed to clarify the use of this element and its consequences more completely.",,0,1,0..1,Coding.userSelected,0,1,ele-1,error,All FHIR elements must have a @value or children,hasValue() | (children().count() > id.count()),@value|f:*|h:div,"['rim', 'v2', 'rim', 'orim']","['n/a', 'Sometimes implied by being first', 'CD.codingRationale', 'fhir:Coding.userSelected fhir:mapsTo dt:CDCoding.codingRationale. fhir:Coding.userSelected fhir:hasMap fhir:Coding.userSelected.map. fhir:Coding.userSelected.map a fhir:Map;   fhir:target dt:CDCoding.codingRationale. fhir:Coding.userSelected\\#true a [     fhir:source ""true"";     fhir:target dt:CDCoding.codingRationale\\#O   ]']",boolean,ele-1,true,,,,,,,,,,,,,,"This has been identified as a clinical safety criterium - that this exact system/code pair was chosen explicitly, rather than inferred by the system based on some rules or language processing.",,,,,,,,,,
44,ARS|s_CareConnect-GPC-DiagnosticReport-1,DiagnosticReport.category.text,DiagnosticReport.category.text,Plain text representation of the concept,A human language representation of the concept as seen/selected/uttered by the user who entered the data and/or which represents the intended meaning of the user.,Very often the text is the same as a displayName of one of the codings.,,0,1,0..1,CodeableConcept.text,0,1,ele-1,error,All FHIR elements must have a @value or children,hasValue() | (children().count() > id.count()),@value|f:*|h:div,"['rim', 'v2', 'rim', 'orim']","['n/a', 'C*E.9. But note many systems use C*E.2 for this', './originalText[mediaType/code=""text/plain""]/data', 'fhir:CodeableConcept.text rdfs:subPropertyOf dt:CD.originalText']",string,ele-1,true,,,,,,,,,,,,,,"The codes from the terminologies do not always capture the correct meaning with all the nuances of the human using them, or sometimes there is no appropriate code at all. In these cases, the text is used to capture the full meaning of the source.",,,,,,,,,http://hl7.org/fhir/StructureDefinition/elementdefinition-translatable,true
45,ARS|s_CareConnect-GPC-DiagnosticReport-1,DiagnosticReport.code,DiagnosticReport.code,Name/Code for this diagnostic report,A code or name that describes this diagnostic report.,"Not all terminology uses fit this general pattern. In some cases, models should not use CodeableConcept and use Coding directly and provide their own structure for managing text, codings, translations and the relationship between elements and pre- and post-coordination.",Type,1,1,1..1,DiagnosticReport.code,1,1,ele-1,error,All FHIR elements must have a @value or children,hasValue() | (children().count() > id.count()),@value|f:*|h:div,"['rim', 'v2', 'rim', 'orim', 'workflow', 'v2', 'rim', 'w5']","['n/a', 'CE/CNE/CWE', 'CD', 'fhir:CodeableConcept rdfs:subClassOf dt:CD', 'Event.code', ""OBR-4 (HL7 v2 doesn't provide an easy way to indicate both the ordered test and the performed panel)"", 'code', 'what']",CodeableConcept,ele-1,true,,,,,,http://hl7.org/fhir/StructureDefinition/elementdefinition-bindingName,DiagnosticReportCodes,,preferred,Codes that describe Diagnostic Reports.,http://hl7.org/fhir/ValueSet/report-codes,,,,,,,,,,,,,
