47,Simplifier|CareConnect-GPC-Condition-1.xml,Condition.identifier.type.text,Condition.identifier.type.text,Plain text representation of the concept,A human language representation of the concept as seen/selected/uttered by the user who entered the data and/or which represents the intended meaning of the user.,0,1,0..1,CodeableConcept.text,0,1,0..1,ele-1,error,All FHIR elements must have a @value or children,hasValue() | (children().count() > id.count()),@value|f:*|h:div,"['rim', 'v2', 'rim', 'orim']","['n/a', 'C*E.9. But note many systems use C*E.2 for this', './originalText[mediaType/code=""text/plain""]/data', 'fhir:CodeableConcept.text rdfs:subPropertyOf dt:CD.originalText']",Very often the text is the same as a displayName of one of the codings.,string,ele-1,true,,,,,,,,,,,,,"The codes from the terminologies do not always capture the correct meaning with all the nuances of the human using them, or sometimes there is no appropriate code at all. In these cases, the text is used to capture the full meaning of the source.",http://hl7.org/fhir/StructureDefinition/elementdefinition-translatable,true,,,,,,,,,,,,,
48,Simplifier|CareConnect-GPC-Condition-1.xml,Condition.identifier.system,Condition.identifier.system,The namespace for the identifier value,"Establishes the namespace for the value - that is, a URL that describes a set values that are unique.",1,1,1..1,Identifier.system,0,1,0..1,ele-1,error,All FHIR elements must have a @value or children,hasValue() | (children().count() > id.count()),@value|f:*|h:div,"['rim', 'v2', 'rim', 'servd']","['n/a', 'CX.4 / EI-2-4', 'II.root or Role.id.root', './IdentifierType']",see http://en.wikipedia.org/wiki/Uniform_resource_identifier,uri,ele-1,true,,,,,,,,,,,,,"There are many sets  of identifiers.  To perform matching of two identifiers, we need to know what set we're dealing with. The system identifies a particular set of unique identifiers.",,,,,,,,General,http://www.acme.com/identifiers/patient or urn:ietf:rfc:3986 if the Identifier.value itself is a full uri,,,,,,
49,Simplifier|CareConnect-GPC-Condition-1.xml,Condition.identifier.value,Condition.identifier.value,The value that is unique,The portion of the identifier typically relevant to the user and which is unique within the context of the system.,1,1,1..1,Identifier.value,0,1,0..1,ele-1,error,All FHIR elements must have a @value or children,hasValue() | (children().count() > id.count()),@value|f:*|h:div,"['rim', 'v2', 'rim', 'servd']","['n/a', 'CX.1 / EI.1', 'II.extension or II.root if system indicates OID or GUID (Or Role.id.extension or root)', './Value']","If the value is a full URI, then the system SHALL be urn:ietf:rfc:3986.  The value's primary purpose is computational mapping.  As a result, it may be normalized for comparison purposes (e.g. removing non-significant whitespace, dashes, etc.)  A value formatted for human display can be conveyed using the [Rendered Value extension](extension-rendered-value.html).",string,ele-1,true,,,,,,,,,,,,,,,,,,,,,General,,123456,,,,,
50,Simplifier|CareConnect-GPC-Condition-1.xml,Condition.identifier.period,Condition.identifier.period,Time period when id is/was valid for use,Time period during which identifier is/was valid for use.,0,1,0..1,Identifier.period,0,1,0..1,"['ele-1', 'per-1']","['error', 'error']","['All FHIR elements must have a @value or children', 'If present, start SHALL have a lower value than end']","['hasValue() | (children().count() > id.count())', 'start.empty() or end.empty() or (start <= end)']","['@value|f:*|h:div', 'not(exists(f:start)) or not(exists(f:end)) or (f:start/@value <= f:end/@value)']","['rim', 'v2', 'rim', 'v2', 'rim', 'servd']","['n/a', 'DR', 'IVL<TS>[lowClosed=""true"" and highClosed=""true""] or URG<TS>[lowClosed=""true"" and highClosed=""true""]', 'CX.7 + CX.8', 'Role.effectiveTime or implied by context', './StartDate and ./EndDate']","This is not a duration - that's a measure of time (a separate type), but a duration that occurs at a fixed value of time. A Period specifies a range of time; the context of use will specify whether the entire range applies (e.g. ""the patient was an inpatient of the hospital for this time range"") or one value from the range applies (e.g. ""give to the patient between these two times""). If duration is required, specify the type as Interval|Duration.",Period,ele-1,true,,,,,,,,,,,,,,,,,,,,,,,,,,,,
51,Simplifier|CareConnect-GPC-Condition-1.xml,Condition.identifier.period.id,Condition.identifier.period.id,xml:id (or equivalent in JSON),unique id for the element within a resource (for internal references). This may be any string value that does not contain spaces.,0,1,0..1,Element.id,0,1,0..1,ele-1,error,All FHIR elements must have a @value or children,hasValue() | (children().count() > id.count()),@value|f:*|h:div,rim,n/a,Note that FHIR strings may not exceed 1MB in size,string,ele-1,,xmlAttr,,,,,,,,,,,,,,,,,,,,,,,,,,,
52,Simplifier|CareConnect-GPC-Condition-1.xml,Condition.identifier.period.extension,Condition.identifier.period.extension,Additional Content defined by implementations,"May be used to represent additional information that is not part of the basic definition of the element. In order to make the use of extensions safe and manageable, there is a strict set of governance  applied to the definition and use of extensions. Though any implementer is allowed to define an extension, there is a set of requirements that SHALL be met as part of the definition of the extension.",0,*,0..*,Element.extension,0,*,0..*,"['ele-1', 'ext-1']","['error', 'error']","['All FHIR elements must have a @value or children', 'Must have either extensions or value[x], not both']","['hasValue() | (children().count() > id.count())', 'extension.exists() != value.exists()']","['@value|f:*|h:div', ""exists(f:extension)!=exists(f:*[starts-with(local-name(.), 'value')])""]","['rim', 'rim']","['n/a', 'N/A']","There can be no stigma associated with the use of extensions by any application, project, or standard - regardless of the institution or jurisdiction that uses or defines the extensions.  The use of extensions is what allows the FHIR specification to retain a core level of simplicity for everyone.",Extension,ele-1,,,value,url,Extensions are always sliced by (at least) url,open,"['extensions', 'user content']",,,,,,,,,,,,,,,,,,,,,,
53,Simplifier|CareConnect-GPC-Condition-1.xml,Condition.identifier.period.start,Condition.identifier.period.start,Starting time with inclusive boundary,The start of the period. The boundary is inclusive.,0,1,0..1,Period.start,0,1,0..1,ele-1,error,All FHIR elements must have a @value or children,hasValue() | (children().count() > id.count()),@value|f:*|h:div,"['rim', 'v2', 'rim']","['n/a', 'DR.1', './low']","If the low element is missing, the meaning is that the low boundary is not known.",dateTime,"['ele-1', 'per-1']",true,,,,,,,,,,,,,,,,,,,,,,,,,,,,
54,Simplifier|CareConnect-GPC-Condition-1.xml,Condition.identifier.period.end,Condition.identifier.period.end,"End time with inclusive boundary, if not ongoing","The end of the period. If the end of the period is missing, it means that the period is ongoing. The start may be in the past, and the end date in the future, which means that period is expected/planned to end at that time.",0,1,0..1,Period.end,0,1,0..1,ele-1,error,All FHIR elements must have a @value or children,hasValue() | (children().count() > id.count()),@value|f:*|h:div,"['rim', 'v2', 'rim']","['n/a', 'DR.2', './high']",The high value includes any matching date/time. i.e. 2012-02-03T10:00:00 is in a period that has a end value of 2012-02-03.,dateTime,"['ele-1', 'per-1']",true,,,,,,,,,,,,,,,,,,,,,,,,"If the end of the period is missing, it means that the period is ongoing",,,,
55,Simplifier|CareConnect-GPC-Condition-1.xml,Condition.identifier.assigner,Condition.identifier.assigner,Organization that issued id (may be just text),Organization that issued/manages the identifier.,0,1,0..1,Identifier.assigner,0,1,0..1,"['ele-1', 'ref-1']","['error', 'error']","['All FHIR elements must have a @value or children', 'SHALL have a contained resource if a local reference is provided']","['hasValue() | (children().count() > id.count())', ""reference.startsWith('#').not() or (reference.substring(1).trace('url') in %resource.contained.id.trace('ids'))""]","['@value|f:*|h:div', ""not(starts-with(f:reference/@value, '#')) or exists(ancestor::*[self::f:entry or self::f:parameter]/f:resource/f:*/f:contained/f:*[f:id/@value=substring-after(current()/f:reference/@value, '#')]|/*/f:contained/f:*[f:id/@value=substring-after(current()/f:reference/@value, '#')])""]","['rim', 'rim', 'v2', 'rim', 'servd']","['n/a', 'The target of a resource reference is a RIM entry point (Act, Role, or Entity)', 'CX.4 / (CX.4,CX.9,CX.10)', 'II.assigningAuthorityName but note that this is an improper use by the definition of the field.  Also Role.scoper', './IdentifierIssuingAuthority']",The Identifier.assigner may omit the .reference element and only contain a .display element reflecting the name or other textual information about the assigning organization.,Reference,ele-1,true,,,,,,,,,,,,,,,,,,,,,,,,,https://fhir.nhs.uk/STU3/StructureDefinition/CareConnect-GPC-Organization-1,,,
56,Simplifier|CareConnect-GPC-Condition-1.xml,Condition.identifier.assigner.id,Condition.identifier.assigner.id,xml:id (or equivalent in JSON),unique id for the element within a resource (for internal references). This may be any string value that does not contain spaces.,0,1,0..1,Element.id,0,1,0..1,ele-1,error,All FHIR elements must have a @value or children,hasValue() | (children().count() > id.count()),@value|f:*|h:div,rim,n/a,Note that FHIR strings may not exceed 1MB in size,string,ele-1,,xmlAttr,,,,,,,,,,,,,,,,,,,,,,,,,,,
57,Simplifier|CareConnect-GPC-Condition-1.xml,Condition.identifier.assigner.extension,Condition.identifier.assigner.extension,Additional Content defined by implementations,"May be used to represent additional information that is not part of the basic definition of the element. In order to make the use of extensions safe and manageable, there is a strict set of governance  applied to the definition and use of extensions. Though any implementer is allowed to define an extension, there is a set of requirements that SHALL be met as part of the definition of the extension.",0,*,0..*,Element.extension,0,*,0..*,"['ele-1', 'ext-1']","['error', 'error']","['All FHIR elements must have a @value or children', 'Must have either extensions or value[x], not both']","['hasValue() | (children().count() > id.count())', 'extension.exists() != value.exists()']","['@value|f:*|h:div', ""exists(f:extension)!=exists(f:*[starts-with(local-name(.), 'value')])""]","['rim', 'rim']","['n/a', 'N/A']","There can be no stigma associated with the use of extensions by any application, project, or standard - regardless of the institution or jurisdiction that uses or defines the extensions.  The use of extensions is what allows the FHIR specification to retain a core level of simplicity for everyone.",Extension,ele-1,,,value,url,Extensions are always sliced by (at least) url,open,"['extensions', 'user content']",,,,,,,,,,,,,,,,,,,,,,
58,Simplifier|CareConnect-GPC-Condition-1.xml,Condition.identifier.assigner.reference,Condition.identifier.assigner.reference,"Literal reference, Relative, internal or absolute URL","A reference to a location at which the other resource is found. The reference may be a relative reference, in which case it is relative to the service base URL, or an absolute URL that resolves to the location where the resource is found. The reference may be version specific or not. If the reference is not to a FHIR RESTful server, then it should be assumed to be version specific. Internal fragment references (start with '#') refer to contained resources.",0,1,0..1,Reference.reference,0,1,0..1,ele-1,error,All FHIR elements must have a @value or children,hasValue() | (children().count() > id.count()),@value|f:*|h:div,"['rim', 'rim']","['n/a', 'N/A']","Using absolute URLs provides a stable scalable approach suitable for a cloud/web context, while using relative/logical references provides a flexible approach suitable for use when trading across closed eco-system boundaries.   Absolute URLs do not need to point to a FHIR RESTful server, though this is the preferred approach. If the URL conforms to the structure ""/[type]/[id]"" then it should be assumed that the reference is to a FHIR RESTful server.",string,"['ele-1', 'ref-1']",true,,,,,,,,,,,,,,,,,,,,,,,,,,,,
59,Simplifier|CareConnect-GPC-Condition-1.xml,Condition.identifier.assigner.identifier,Condition.identifier.assigner.identifier,"Logical reference, when literal reference is not known","An identifier for the other resource. This is used when there is no way to reference the other resource directly, either because the entity is not available through a FHIR server, or because there is no way for the author of the resource to convert a known identifier to an actual location. There is no requirement that a Reference.identifier point to something that is actually exposed as a FHIR instance, but it SHALL point to a business concept that would be expected to be exposed as a FHIR instance, and that instance would need to be of a FHIR resource type allowed by the reference.",0,1,0..1,Reference.identifier,0,1,0..1,ele-1,error,All FHIR elements must have a @value or children,hasValue() | (children().count() > id.count()),@value|f:*|h:div,"['rim', 'v2', 'rim', 'servd', 'rim']","['n/a', 'CX / EI (occasionally, more often EI maps to a resource id or a URL)', 'II - see see identifier pattern at http://wiki.hl7.org/index.php?title=Common_Design_Patterns#Identifier_Pattern for relevant discussion. The Identifier class is a little looser than the v3 type II because it allows URIs as well as registered OIDs or GUIDs.  Also maps to Role[classCode=IDENT]', 'Identifier', '.identifier']","When an identifier is provided in place of a reference, any system processing the reference will only be able to resolve the identifier to a reference if it understands the business context in which the identifier is used. Sometimes this is global (e.g. a national identifier) but often it is not. For this reason, none of the useful mechanisms described for working with references (e.g. chaining, includes) are possible, nor should servers be expected to be able resolve the reference. Servers may accept an identifier based reference untouched, resolve it, and/or reject it - see CapabilityStatement.rest.resource.referencePolicy.   When both an identifier and a literal reference are provided, the literal reference is preferred. Applications processing the resource are allowed - but not required - to check that the identifier matches the literal reference  Applications converting a logical reference to a literal reference may choose to leave the logical reference present, or remove it.",Identifier,ele-1,true,,,,,,,,,,,,,,,,,,,,,,,,,,,,
60,Simplifier|CareConnect-GPC-Condition-1.xml,Condition.identifier.assigner.display,Condition.identifier.assigner.display,Text alternative for the resource,Plain text narrative that identifies the resource in addition to the resource reference.,0,1,0..1,Reference.display,0,1,0..1,ele-1,error,All FHIR elements must have a @value or children,hasValue() | (children().count() > id.count()),@value|f:*|h:div,"['rim', 'rim']","['n/a', 'N/A']","This is generally not the same as the Resource.text of the referenced resource.  The purpose is to identify what's being referenced, not to fully describe it.",string,ele-1,true,,,,,,,,,,,,,,http://hl7.org/fhir/StructureDefinition/elementdefinition-translatable,true,,,,,,,,,,,,,
61,Simplifier|CareConnect-GPC-Condition-1.xml,Condition.clinicalStatus,Condition.clinicalStatus,active | recurrence | inactive | remission | resolved,The clinical status of the condition.,0,1,0..1,Condition.clinicalStatus,0,1,0..1,ele-1,error,All FHIR elements must have a @value or children,hasValue() | (children().count() > id.count()),@value|f:*|h:div,"['rim', 'sct-concept', 'v2', 'rim', 'w5']","['n/a', '< 303105007 |Disease phases|', 'PRB-14 / DG1-6', 'Observation ACT .inboundRelationship[typeCode=COMP].source[classCode=OBS, code=""clinicalStatus"", moodCode=EVN].value', 'status']",This element is labeled as a modifier because the status contains codes that mark the condition as not currently valid or of concern.,code,"['ele-1', 'con-3', 'con-4']",true,,,,,,,http://hl7.org/fhir/StructureDefinition/elementdefinition-bindingName,ConditionClinicalStatus,,required,The clinical status of the condition or diagnosis.,http://hl7.org/fhir/ValueSet/condition-clinical,,,,true,,,,true,,,,,,,,
62,Simplifier|CareConnect-GPC-Condition-1.xml,Condition.verificationStatus,Condition.verificationStatus,provisional | differential | confirmed | refuted | entered-in-error | unknown,The verification status to support the clinical status of the condition.,0,1,0..1,Condition.verificationStatus,0,1,0..1,ele-1,error,All FHIR elements must have a @value or children,hasValue() | (children().count() > id.count()),@value|f:*|h:div,"['rim', 'sct-concept', 'v2', 'rim', 'sct-attr', 'w5']","['n/a', '< 410514004 |Finding context value|', 'PRB-13', 'Observation ACT .inboundRelationship[typeCode=COMP].source[classCode=OBS, code=""verificationStatus"", moodCode=EVN].value', '408729009', 'status']","verificationStatus is not required.  For example, when a patient has abdominal pain in the ED, there is not likely going to be a verification status.  This element is labeled as a modifier because the status contains the code refuted and entered-in-error that mark the Condition as not currently valid.",code,"['ele-1', 'con-3']",true,,,,,,,http://hl7.org/fhir/StructureDefinition/elementdefinition-bindingName,ConditionVerificationStatus,,required,The verification status to support or decline the clinical status of the condition or diagnosis.,http://hl7.org/fhir/ValueSet/condition-ver-status,,,,true,,,,true,,,,,,unknown,,
63,Simplifier|CareConnect-GPC-Condition-1.xml,Condition.category,Condition.category,complaint | symptom | finding | diagnosis | problem | need,A category assigned to the condition.,0,*,0..*,Condition.category,0,*,0..*,ele-1,error,All FHIR elements must have a @value or children,hasValue() | (children().count() > id.count()),@value|f:*|h:div,"['rim', 'v2', 'rim', 'orim', 'sct-concept', 'v2', 'rim', 'w5']","['n/a', 'CE/CNE/CWE', 'CD', 'fhir:CodeableConcept rdfs:subClassOf dt:CD', '< 404684003 |Clinical finding|', ""'problem' if from PRB-3. 'diagnosis' if from DG1 segment in PV1 message"", '.code', 'class']",The categorization is often highly contextual and may appear poorly differentiated or not very useful in other contexts.,CodeableConcept,ele-1,,,,,,,,http://hl7.org/fhir/StructureDefinition/elementdefinition-bindingName,ConditionCategory,,extensible,A category assigned to the condition.,https://fhir.nhs.uk/STU3/ValueSet/CareConnect-ConditionCategory-1,,,,,,,,true,,,,,,,,
64,Simplifier|CareConnect-GPC-Condition-1.xml,Condition.category.id,Condition.category.id,xml:id (or equivalent in JSON),unique id for the element within a resource (for internal references). This may be any string value that does not contain spaces.,0,1,0..1,Element.id,0,1,0..1,ele-1,error,All FHIR elements must have a @value or children,hasValue() | (children().count() > id.count()),@value|f:*|h:div,rim,n/a,Note that FHIR strings may not exceed 1MB in size,string,ele-1,,xmlAttr,,,,,,,,,,,,,,,,,,,,,,,,,,,
65,Simplifier|CareConnect-GPC-Condition-1.xml,Condition.category.extension,Condition.category.extension,Additional Content defined by implementations,"May be used to represent additional information that is not part of the basic definition of the element. In order to make the use of extensions safe and manageable, there is a strict set of governance  applied to the definition and use of extensions. Though any implementer is allowed to define an extension, there is a set of requirements that SHALL be met as part of the definition of the extension.",0,*,0..*,Element.extension,0,*,0..*,"['ele-1', 'ext-1']","['error', 'error']","['All FHIR elements must have a @value or children', 'Must have either extensions or value[x], not both']","['hasValue() | (children().count() > id.count())', 'extension.exists() != value.exists()']","['@value|f:*|h:div', ""exists(f:extension)!=exists(f:*[starts-with(local-name(.), 'value')])""]","['rim', 'rim']","['n/a', 'N/A']","There can be no stigma associated with the use of extensions by any application, project, or standard - regardless of the institution or jurisdiction that uses or defines the extensions.  The use of extensions is what allows the FHIR specification to retain a core level of simplicity for everyone.",Extension,ele-1,,,value,url,Extensions are always sliced by (at least) url,open,"['extensions', 'user content']",,,,,,,,,,,,,,,,,,,,,,
66,Simplifier|CareConnect-GPC-Condition-1.xml,Condition.category.coding,Condition.category.coding,Code defined by a terminology system,A reference to a code defined by a terminology system.,0,*,0..*,CodeableConcept.coding,0,*,0..*,ele-1,error,All FHIR elements must have a @value or children,hasValue() | (children().count() > id.count()),@value|f:*|h:div,"['rim', 'v2', 'rim', 'orim', 'v2', 'rim', 'orim']","['n/a', 'CE/CNE/CWE subset one of the sets of component 1-3 or 4-6', 'CV', 'fhir:Coding rdfs:subClassOf dt:CDCoding', 'C*E.1-8, C*E.10-22', 'union(., ./translation)', 'fhir:CodeableConcept.coding rdfs:subPropertyOf dt:CD.coding']","Codes may be defined very casually in enumerations, or code lists, up to very formal definitions such as SNOMED CT - see the HL7 v3 Core Principles for more information.  Ordering of codings is undefined and SHALL NOT be used to infer meaning. Generally, at most only one of the coding values will be labeled as UserSelected = true.",Coding,ele-1,true,,,,,,,,,,,,,Allows for translations and alternate encodings within a code system.  Also supports communication of the same instance to systems requiring different encodings.,,,,,,,,,,,,,,,
67,Simplifier|CareConnect-GPC-Condition-1.xml,Condition.category.coding.id,Condition.category.coding.id,xml:id (or equivalent in JSON),unique id for the element within a resource (for internal references). This may be any string value that does not contain spaces.,0,1,0..1,Element.id,0,1,0..1,ele-1,error,All FHIR elements must have a @value or children,hasValue() | (children().count() > id.count()),@value|f:*|h:div,rim,n/a,Note that FHIR strings may not exceed 1MB in size,string,ele-1,,xmlAttr,,,,,,,,,,,,,,,,,,,,,,,,,,,
68,Simplifier|CareConnect-GPC-Condition-1.xml,Condition.category.coding.extension,Condition.category.coding.extension,Additional Content defined by implementations,"May be used to represent additional information that is not part of the basic definition of the element. In order to make the use of extensions safe and manageable, there is a strict set of governance  applied to the definition and use of extensions. Though any implementer is allowed to define an extension, there is a set of requirements that SHALL be met as part of the definition of the extension.",0,*,0..*,Element.extension,0,*,0..*,"['ele-1', 'ext-1']","['error', 'error']","['All FHIR elements must have a @value or children', 'Must have either extensions or value[x], not both']","['hasValue() | (children().count() > id.count())', 'extension.exists() != value.exists()']","['@value|f:*|h:div', ""exists(f:extension)!=exists(f:*[starts-with(local-name(.), 'value')])""]","['rim', 'rim']","['n/a', 'N/A']","There can be no stigma associated with the use of extensions by any application, project, or standard - regardless of the institution or jurisdiction that uses or defines the extensions.  The use of extensions is what allows the FHIR specification to retain a core level of simplicity for everyone.",Extension,ele-1,,,value,url,Extensions are always sliced by (at least) url,open,"['extensions', 'user content']",,,,,,,,,,,,,,,,,,,,,,
69,Simplifier|CareConnect-GPC-Condition-1.xml,Condition.category.coding.system,Condition.category.coding.system,Identity of the terminology system,The identification of the code system that defines the meaning of the symbol in the code.,1,1,1..1,Coding.system,0,1,0..1,ele-1,error,All FHIR elements must have a @value or children,hasValue() | (children().count() > id.count()),@value|f:*|h:div,"['rim', 'v2', 'rim', 'orim']","['n/a', 'C*E.3', './codeSystem', 'fhir:Coding.system rdfs:subPropertyOf dt:CDCoding.codeSystem']","The URI may be an OID (urn:oid:...) or a UUID (urn:uuid:...).  OIDs and UUIDs SHALL be references to the HL7 OID registry. Otherwise, the URI should come from HL7's list of FHIR defined special URIs or it should de-reference to some definition that establish the system clearly and unambiguously.",uri,ele-1,true,,,,,,,,,,,,,Need to be unambiguous about the source of the definition of the symbol.,,,,,,,,,,,,,,,
