46,ARS|s_CareConnect-GPC-DiagnosticReport-1,DiagnosticReport.code.id,DiagnosticReport.code.id,xml:id (or equivalent in JSON),unique id for the element within a resource (for internal references). This may be any string value that does not contain spaces.,Note that FHIR strings may not exceed 1MB in size,,0,1,0..1,Element.id,0,1,ele-1,error,All FHIR elements must have a @value or children,hasValue() | (children().count() > id.count()),@value|f:*|h:div,rim,n/a,string,ele-1,,xmlAttr,,,,,,,,,,,,,,,,,,,,,,,
47,ARS|s_CareConnect-GPC-DiagnosticReport-1,DiagnosticReport.code.extension,DiagnosticReport.code.extension,Additional Content defined by implementations,"May be used to represent additional information that is not part of the basic definition of the element. In order to make the use of extensions safe and manageable, there is a strict set of governance  applied to the definition and use of extensions. Though any implementer is allowed to define an extension, there is a set of requirements that SHALL be met as part of the definition of the extension.","There can be no stigma associated with the use of extensions by any application, project, or standard - regardless of the institution or jurisdiction that uses or defines the extensions.  The use of extensions is what allows the FHIR specification to retain a core level of simplicity for everyone.","['extensions', 'user content']",0,*,0..*,Element.extension,0,*,"['ele-1', 'ext-1']","['error', 'error']","['All FHIR elements must have a @value or children', 'Must have either extensions or value[x], not both']","['hasValue() | (children().count() > id.count())', 'extension.exists() != value.exists()']","['@value|f:*|h:div', ""exists(f:extension)!=exists(f:*[starts-with(local-name(.), 'value')])""]","['rim', 'rim']","['n/a', 'N/A']",Extension,ele-1,,,value,url,Extensions are always sliced by (at least) url,open,,,,,,,,,,,,,,,,,,,
48,ARS|s_CareConnect-GPC-DiagnosticReport-1,DiagnosticReport.code.coding,DiagnosticReport.code.coding,Code defined by a terminology system,A reference to a code defined by a terminology system.,"Codes may be defined very casually in enumerations, or code lists, up to very formal definitions such as SNOMED CT - see the HL7 v3 Core Principles for more information.  Ordering of codings is undefined and SHALL NOT be used to infer meaning. Generally, at most only one of the coding values will be labeled as UserSelected = true.",,0,*,0..*,CodeableConcept.coding,0,*,ele-1,error,All FHIR elements must have a @value or children,hasValue() | (children().count() > id.count()),@value|f:*|h:div,"['rim', 'v2', 'rim', 'orim', 'v2', 'rim', 'orim']","['n/a', 'CE/CNE/CWE subset one of the sets of component 1-3 or 4-6', 'CV', 'fhir:Coding rdfs:subClassOf dt:CDCoding', 'C*E.1-8, C*E.10-22', 'union(., ./translation)', 'fhir:CodeableConcept.coding rdfs:subPropertyOf dt:CD.coding']",Coding,ele-1,true,,value,system,,open,,,,,,,,,Allows for translations and alternate encodings within a code system.  Also supports communication of the same instance to systems requiring different encodings.,,,,,,,,,,
49,ARS|s_CareConnect-GPC-DiagnosticReport-1,DiagnosticReport.code.coding:snomedCT,DiagnosticReport.code.coding,Code defined by a terminology system,A reference to a code defined by a terminology system.,"Codes may be defined very casually in enumerations, or code lists, up to very formal definitions such as SNOMED CT - see the HL7 v3 Core Principles for more information.  Ordering of codings is undefined and SHALL NOT be used to infer meaning. Generally, at most only one of the coding values will be labeled as UserSelected = true.",,0,*,0..*,CodeableConcept.coding,0,*,ele-1,error,All FHIR elements must have a @value or children,hasValue() | (children().count() > id.count()),@value|f:*|h:div,"['rim', 'v2', 'rim', 'orim', 'v2', 'rim', 'orim']","['n/a', 'CE/CNE/CWE subset one of the sets of component 1-3 or 4-6', 'CV', 'fhir:Coding rdfs:subClassOf dt:CDCoding', 'C*E.1-8, C*E.10-22', 'union(., ./translation)', 'fhir:CodeableConcept.coding rdfs:subPropertyOf dt:CD.coding']",Coding,ele-1,true,,,,,,,,,extensible,A code from the SNOMED Clinical Terminology UK,https://fhir.hl7.org.uk/STU3/ValueSet/CareConnect-ReportCodeSnCT-1,,,Allows for translations and alternate encodings within a code system.  Also supports communication of the same instance to systems requiring different encodings.,,,,,,snomedCT,,,,
50,ARS|s_CareConnect-GPC-DiagnosticReport-1,DiagnosticReport.code.coding:snomedCT.id,DiagnosticReport.code.coding.id,xml:id (or equivalent in JSON),unique id for the element within a resource (for internal references). This may be any string value that does not contain spaces.,Note that FHIR strings may not exceed 1MB in size,,0,1,0..1,Element.id,0,1,ele-1,error,All FHIR elements must have a @value or children,hasValue() | (children().count() > id.count()),@value|f:*|h:div,rim,n/a,string,ele-1,,xmlAttr,,,,,,,,,,,,,,,,,,,,,,,
51,ARS|s_CareConnect-GPC-DiagnosticReport-1,DiagnosticReport.code.coding:snomedCT.extension,DiagnosticReport.code.coding.extension,Additional Content defined by implementations,"May be used to represent additional information that is not part of the basic definition of the element. In order to make the use of extensions safe and manageable, there is a strict set of governance  applied to the definition and use of extensions. Though any implementer is allowed to define an extension, there is a set of requirements that SHALL be met as part of the definition of the extension.","There can be no stigma associated with the use of extensions by any application, project, or standard - regardless of the institution or jurisdiction that uses or defines the extensions.  The use of extensions is what allows the FHIR specification to retain a core level of simplicity for everyone.","['extensions', 'user content']",0,*,0..*,Element.extension,0,*,"['ele-1', 'ext-1']","['error', 'error']","['All FHIR elements must have a @value or children', 'Must have either extensions or value[x], not both']","['hasValue() | (children().count() > id.count())', 'extension.exists() != value.exists()']","['@value|f:*|h:div', ""exists(f:extension)!=exists(f:*[starts-with(local-name(.), 'value')])""]","['rim', 'rim']","['n/a', 'N/A']",Extension,ele-1,,,value,url,Extensions are always sliced by (at least) url,open,,,,,,,,,,,,,,,,,,,
52,ARS|s_CareConnect-GPC-DiagnosticReport-1,DiagnosticReport.code.coding:snomedCT.extension:snomedCTDescriptionID,DiagnosticReport.code.coding.extension,Additional Content defined by implementations,"May be used to represent additional information that is not part of the basic definition of the element. In order to make the use of extensions safe and manageable, there is a strict set of governance  applied to the definition and use of extensions. Though any implementer is allowed to define an extension, there is a set of requirements that SHALL be met as part of the definition of the extension.","There can be no stigma associated with the use of extensions by any application, project, or standard - regardless of the institution or jurisdiction that uses or defines the extensions.  The use of extensions is what allows the FHIR specification to retain a core level of simplicity for everyone.","['extensions', 'user content']",0,*,0..*,Element.extension,0,*,"['ele-1', 'ext-1']","['error', 'error']","['All FHIR elements must have a @value or children', 'Must have either extensions or value[x], not both']","['hasValue() | (children().count() > id.count())', 'extension.exists() != value.exists()']","['@value|f:*|h:div', ""exists(f:extension)!=exists(f:*[starts-with(local-name(.), 'value')])""]","['rim', 'rim']","['n/a', 'N/A']",Extension,ele-1,,,,,,,,,,,,,,,,,,,,,snomedCTDescriptionID,https://fhir.hl7.org.uk/STU3/StructureDefinition/Extension-coding-sctdescid,,,
53,ARS|s_CareConnect-GPC-DiagnosticReport-1,DiagnosticReport.code.coding:snomedCT.extension:snomedCTDescriptionID.id,DiagnosticReport.code.coding.extension.id,xml:id (or equivalent in JSON),unique id for the element within a resource (for internal references). This may be any string value that does not contain spaces.,Note that FHIR strings may not exceed 1MB in size,,0,1,0..1,Element.id,0,1,ele-1,error,All FHIR elements must have a @value or children,hasValue() | (children().count() > id.count()),@value|f:*|h:div,rim,n/a,string,ele-1,,xmlAttr,,,,,,,,,,,,,,,,,,,,,,,
54,ARS|s_CareConnect-GPC-DiagnosticReport-1,DiagnosticReport.code.coding:snomedCT.extension:snomedCTDescriptionID.extension,DiagnosticReport.code.coding.extension.extension,Additional Content defined by implementations,"May be used to represent additional information that is not part of the basic definition of the element. In order to make the use of extensions safe and manageable, there is a strict set of governance  applied to the definition and use of extensions. Though any implementer is allowed to define an extension, there is a set of requirements that SHALL be met as part of the definition of the extension.","There can be no stigma associated with the use of extensions by any application, project, or standard - regardless of the institution or jurisdiction that uses or defines the extensions.  The use of extensions is what allows the FHIR specification to retain a core level of simplicity for everyone.","['extensions', 'user content']",0,*,0..*,Element.extension,0,*,"['ele-1', 'ext-1']","['error', 'error']","['All FHIR elements must have a @value or children', 'Must have either extensions or value[x], not both']","['hasValue() | (children().count() > id.count())', 'extension.exists() != value.exists()']","['@value|f:*|h:div', ""exists(f:extension)!=exists(f:*[starts-with(local-name(.), 'value')])""]","['rim', 'rim']","['n/a', 'N/A']",Extension,ele-1,,,value,url,Extensions are always sliced by (at least) url,open,,,,,,,,,,,,,,,,,,,
55,ARS|s_CareConnect-GPC-DiagnosticReport-1,DiagnosticReport.code.coding:snomedCT.extension:snomedCTDescriptionID.url,DiagnosticReport.code.coding.extension.url,identifies the meaning of the extension,Source of the definition for the extension code - a logical name or a URL.,"The definition may point directly to a computable or human-readable definition of the extensibility codes, or it may be a logical URI as declared in some other specification. The definition SHALL be a URI for the Structure Definition defining the extension.",,1,1,1..1,Extension.url,1,1,ele-1,error,All FHIR elements must have a @value or children,hasValue() | (children().count() > id.count()),@value|f:*|h:div,"['rim', 'rim']","['n/a', 'N/A']",uri,ele-1,,xmlAttr,,,,,,,,,,,,,,,,,,,,,https://fhir.hl7.org.uk/STU3/StructureDefinition/Extension-coding-sctdescid,,
56,ARS|s_CareConnect-GPC-DiagnosticReport-1,DiagnosticReport.code.coding:snomedCT.extension:snomedCTDescriptionID.value[x],DiagnosticReport.code.coding.extension.value[x],Value of extension,Value of extension - may be a resource or one of a constrained set of the data types (see Extensibility in the spec for list).,"A stream of bytes, base64 encoded",,0,1,0..1,Extension.value[x],0,1,ele-1,error,All FHIR elements must have a @value or children,hasValue() | (children().count() > id.count()),@value|f:*|h:div,"['rim', 'rim']","['n/a', 'N/A']","['base64Binary', 'boolean', 'code', 'date', 'dateTime', 'decimal', 'id', 'instant', 'integer', 'markdown', 'oid', 'positiveInt', 'string', 'time', 'unsignedInt', 'uri', 'Address', 'Age', 'Annotation', 'Attachment', 'CodeableConcept', 'Coding', 'ContactPoint', 'Count', 'Distance', 'Duration', 'HumanName', 'Identifier', 'Money', 'Period', 'Quantity', 'Range', 'Ratio', 'Reference', 'SampledData', 'Signature', 'Timing', 'Meta']",ele-1,,,,,,,,,,,,,,,,,,,,,,,,,
57,ARS|s_CareConnect-GPC-DiagnosticReport-1,DiagnosticReport.code.coding:snomedCT.system,DiagnosticReport.code.coding.system,Identity of the terminology system,The identification of the code system that defines the meaning of the symbol in the code.,"The URI may be an OID (urn:oid:...) or a UUID (urn:uuid:...).  OIDs and UUIDs SHALL be references to the HL7 OID registry. Otherwise, the URI should come from HL7's list of FHIR defined special URIs or it should de-reference to some definition that establish the system clearly and unambiguously.",,1,1,1..1,Coding.system,0,1,ele-1,error,All FHIR elements must have a @value or children,hasValue() | (children().count() > id.count()),@value|f:*|h:div,"['rim', 'v2', 'rim', 'orim']","['n/a', 'C*E.3', './codeSystem', 'fhir:Coding.system rdfs:subPropertyOf dt:CDCoding.codeSystem']",uri,ele-1,true,,,,,,,,,,,,,,Need to be unambiguous about the source of the definition of the symbol.,,,,,,,,http://snomed.info/sct,,
58,ARS|s_CareConnect-GPC-DiagnosticReport-1,DiagnosticReport.code.coding:snomedCT.version,DiagnosticReport.code.coding.version,Version of the system - if relevant,"The version of the code system which was used when choosing this code. Note that a well-maintained code system does not need the version reported, because the meaning of codes is consistent across versions. However this cannot consistently be assured. and when the meaning is not guaranteed to be consistent, the version SHOULD be exchanged.","Where the terminology does not clearly define what string should be used to identify code system versions, the recommendation is to use the date (expressed in FHIR date format) on which that version was officially published as the version date.",,0,1,0..1,Coding.version,0,1,ele-1,error,All FHIR elements must have a @value or children,hasValue() | (children().count() > id.count()),@value|f:*|h:div,"['rim', 'v2', 'rim', 'orim']","['n/a', 'C*E.7', './codeSystemVersion', 'fhir:Coding.version rdfs:subPropertyOf dt:CDCoding.codeSystemVersion']",string,ele-1,true,,,,,,,,,,,,,,,,,,,,,,,,
59,ARS|s_CareConnect-GPC-DiagnosticReport-1,DiagnosticReport.code.coding:snomedCT.code,DiagnosticReport.code.coding.code,Symbol in syntax defined by the system,A symbol in syntax defined by the system. The symbol may be a predefined code or an expression in a syntax defined by the coding system (e.g. post-coordination).,Note that FHIR strings may not exceed 1MB in size,,1,1,1..1,Coding.code,0,1,ele-1,error,All FHIR elements must have a @value or children,hasValue() | (children().count() > id.count()),@value|f:*|h:div,"['rim', 'v2', 'rim', 'orim']","['n/a', 'C*E.1', './code', 'fhir:Coding.code rdfs:subPropertyOf dt:CDCoding.code']",code,ele-1,true,,,,,,,,,,,,,,Need to refer to a particular code in the system.,,,,,,,,,,
60,ARS|s_CareConnect-GPC-DiagnosticReport-1,DiagnosticReport.code.coding:snomedCT.display,DiagnosticReport.code.coding.display,Representation defined by the system,"A representation of the meaning of the code in the system, following the rules of the system.",Note that FHIR strings may not exceed 1MB in size,,1,1,1..1,Coding.display,0,1,ele-1,error,All FHIR elements must have a @value or children,hasValue() | (children().count() > id.count()),@value|f:*|h:div,"['rim', 'v2', 'rim', 'orim']","['n/a', 'C*E.2 - but note this is not well followed', 'CV.displayName', 'fhir:Coding.display rdfs:subPropertyOf dt:CDCoding.displayName']",string,ele-1,true,,,,,,,,,,,,,,Need to be able to carry a human-readable meaning of the code for readers that do not know  the system.,,,,,,,,,http://hl7.org/fhir/StructureDefinition/elementdefinition-translatable,true
61,ARS|s_CareConnect-GPC-DiagnosticReport-1,DiagnosticReport.code.coding:snomedCT.userSelected,DiagnosticReport.code.coding.userSelected,If this coding was chosen directly by the user,Indicates that this coding was chosen by a user directly - i.e. off a pick list of available items (codes or displays).,"Amongst a set of alternatives, a directly chosen code is the most appropriate starting point for new translations. There is some ambiguity about what exactly 'directly chosen' implies, and trading partner agreement may be needed to clarify the use of this element and its consequences more completely.",,0,1,0..1,Coding.userSelected,0,1,ele-1,error,All FHIR elements must have a @value or children,hasValue() | (children().count() > id.count()),@value|f:*|h:div,"['rim', 'v2', 'rim', 'orim']","['n/a', 'Sometimes implied by being first', 'CD.codingRationale', 'fhir:Coding.userSelected fhir:mapsTo dt:CDCoding.codingRationale. fhir:Coding.userSelected fhir:hasMap fhir:Coding.userSelected.map. fhir:Coding.userSelected.map a fhir:Map;   fhir:target dt:CDCoding.codingRationale. fhir:Coding.userSelected\\#true a [     fhir:source ""true"";     fhir:target dt:CDCoding.codingRationale\\#O   ]']",boolean,ele-1,true,,,,,,,,,,,,,,"This has been identified as a clinical safety criterium - that this exact system/code pair was chosen explicitly, rather than inferred by the system based on some rules or language processing.",,,,,,,,,,
62,ARS|s_CareConnect-GPC-DiagnosticReport-1,DiagnosticReport.code.text,DiagnosticReport.code.text,Plain text representation of the concept,A human language representation of the concept as seen/selected/uttered by the user who entered the data and/or which represents the intended meaning of the user.,Very often the text is the same as a displayName of one of the codings.,,0,1,0..1,CodeableConcept.text,0,1,ele-1,error,All FHIR elements must have a @value or children,hasValue() | (children().count() > id.count()),@value|f:*|h:div,"['rim', 'v2', 'rim', 'orim']","['n/a', 'C*E.9. But note many systems use C*E.2 for this', './originalText[mediaType/code=""text/plain""]/data', 'fhir:CodeableConcept.text rdfs:subPropertyOf dt:CD.originalText']",string,ele-1,true,,,,,,,,,,,,,,"The codes from the terminologies do not always capture the correct meaning with all the nuances of the human using them, or sometimes there is no appropriate code at all. In these cases, the text is used to capture the full meaning of the source.",,,,,,,,,http://hl7.org/fhir/StructureDefinition/elementdefinition-translatable,true
63,ARS|s_CareConnect-GPC-DiagnosticReport-1,DiagnosticReport.subject,DiagnosticReport.subject,"The subject of the report - usually, but not always, the patient","The subject of the report. Usually, but not always, this is a patient. However diagnostic services also perform analyses on specimens collected from a variety of other sources.","References SHALL be a reference to an actual FHIR resource, and SHALL be resolveable (allowing for access control, temporary unavailability, etc). Resolution can be either by retrieval from the URL, or, where applicable by resource type, by treating an absolute reference as a canonical URL and looking it up in a local registry/repository.",Patient,1,1,1..1,DiagnosticReport.subject,0,1,"['ele-1', 'ref-1']","['error', 'error']","['All FHIR elements must have a @value or children', 'SHALL have a contained resource if a local reference is provided']","['hasValue() | (children().count() > id.count())', ""reference.startsWith('#').not() or (reference.substring(1).trace('url') in %resource.contained.id.trace('ids'))""]","['@value|f:*|h:div', ""not(starts-with(f:reference/@value, '#')) or exists(ancestor::*[self::f:entry or self::f:parameter]/f:resource/f:*/f:contained/f:*[f:id/@value=substring-after(current()/f:reference/@value, '#')]|/*/f:contained/f:*[f:id/@value=substring-after(current()/f:reference/@value, '#')])""]","['rim', 'rim', 'workflow', 'v2', 'rim', 'w5']","['n/a', 'The target of a resource reference is a RIM entry point (Act, Role, or Entity)', 'Event.subject', 'PID-3 (no HL7 v2 mapping for Group or Device)', 'participation[typeCode=SBJ]', 'who.focus']","['Reference', 'Reference', 'Reference', 'Reference']",ele-1,true,,,,,,,,,,,,,,SHALL know the subject context.,,,,"['http://hl7.org/fhir/StructureDefinition/Group', 'http://hl7.org/fhir/StructureDefinition/Device', 'https://fhir.nhs.uk/STU3/StructureDefinition/CareConnect-GPC-Patient-1', 'https://fhir.nhs.uk/STU3/StructureDefinition/CareConnect-GPC-Location-1']",,,,,,
64,ARS|s_CareConnect-GPC-DiagnosticReport-1,DiagnosticReport.context,DiagnosticReport.context,Health care event when test ordered,The healthcare event  (e.g. a patient and healthcare provider interaction) which this DiagnosticReport per is about.,"This will typically be the encounter the event occurred within, but some events may be initiated prior to or after the official completion of an encounter or episode but still be tied to the context of the encounter or episode (e.g. pre-admission lab tests).",Encounter,0,1,0..1,DiagnosticReport.context,0,1,"['ele-1', 'ref-1']","['error', 'error']","['All FHIR elements must have a @value or children', 'SHALL have a contained resource if a local reference is provided']","['hasValue() | (children().count() > id.count())', ""reference.startsWith('#').not() or (reference.substring(1).trace('url') in %resource.contained.id.trace('ids'))""]","['@value|f:*|h:div', ""not(starts-with(f:reference/@value, '#')) or exists(ancestor::*[self::f:entry or self::f:parameter]/f:resource/f:*/f:contained/f:*[f:id/@value=substring-after(current()/f:reference/@value, '#')]|/*/f:contained/f:*[f:id/@value=substring-after(current()/f:reference/@value, '#')])""]","['rim', 'rim', 'workflow', 'v2', 'rim', 'w5']","['n/a', 'The target of a resource reference is a RIM entry point (Act, Role, or Entity)', 'Event.context', 'PV1-19', 'inboundRelationship[typeCode=COMP].source[classCode=ENC, moodCode=EVN]', 'context']",Reference,ele-1,true,,,,,,,,,,,,,,Links the request to the Encounter context.,,,,https://fhir.nhs.uk/STU3/StructureDefinition/CareConnect-GPC-Encounter-1,,,,,,
65,ARS|s_CareConnect-GPC-DiagnosticReport-1,DiagnosticReport.effective[x],DiagnosticReport.effective[x],Clinically relevant time/time-period for report,"The time or time-period the observed values are related to. When the subject of the report is a patient, this is usually either the time of the procedure or of specimen collection(s), but very often the source of the date/time is not known, only the date/time itself.","If the diagnostic procedure was performed on the patient, this is the time it was performed. If there are specimens, the diagnostically relevant time can be derived from the specimen collection times, but the specimen information is not always available, and the exact relationship between the specimens and the diagnostically relevant time is not always automatic.","['Observation time', 'Effective Time', 'Occurrence']",0,1,0..1,DiagnosticReport.effective[x],0,1,ele-1,error,All FHIR elements must have a @value or children,hasValue() | (children().count() > id.count()),@value|f:*|h:div,"['rim', 'workflow', 'v2', 'rim', 'w5']","['n/a', 'Event.occurrence[x]', 'OBR-7', 'effectiveTime', 'when.done']","['dateTime', 'Period']",ele-1,true,,,,,,,,,,,,,,Need to know where in the patient history to file/present this report.,,,,,,,,,,
66,ARS|s_CareConnect-GPC-DiagnosticReport-1,DiagnosticReport.issued,DiagnosticReport.issued,DateTime this version was released,The date and time that this version of the report was released from the source diagnostic service.,"May be different from the update time of the resource itself, because that is the status of the record (potentially a secondary copy), not the actual release time of the report.","['Date Created', 'Date published', 'Date Issued']",1,1,1..1,DiagnosticReport.issued,0,1,ele-1,error,All FHIR elements must have a @value or children,hasValue() | (children().count() > id.count()),@value|f:*|h:div,"['rim', 'v2', 'rim', 'w5']","['n/a', 'OBR-22', 'participation[typeCode=VRF or AUT].time', 'when.recorded']",instant,ele-1,true,,,,,,,,,,,,,,Clinicians need to be able to check the date that the report was released.,,,,,,,,,,
67,ARS|s_CareConnect-GPC-DiagnosticReport-1,DiagnosticReport.performer,DiagnosticReport.performer,Participants in producing the report,Indicates who or what participated in producing the report.,,"['Laboratory', 'Service', 'Practitioner', 'Department', 'Company']",0,*,0..*,DiagnosticReport.performer,0,*,ele-1,error,All FHIR elements must have a @value or children,hasValue() | (children().count() > id.count()),@value|f:*|h:div,"['rim', 'workflow', 'v2', 'rim', 'w5']","['n/a', 'Event.performer', 'PRT-8 (where this PRT-4-Participation = ""PO"")', '.participation[typeCode=PRF]', 'who.witness']",BackboneElement,ele-1,true,,,,,,,,,,,,,,,,,,,true,,,,,
68,ARS|s_CareConnect-GPC-DiagnosticReport-1,DiagnosticReport.performer.id,DiagnosticReport.performer.id,xml:id (or equivalent in JSON),unique id for the element within a resource (for internal references). This may be any string value that does not contain spaces.,Note that FHIR strings may not exceed 1MB in size,,0,1,0..1,Element.id,0,1,ele-1,error,All FHIR elements must have a @value or children,hasValue() | (children().count() > id.count()),@value|f:*|h:div,rim,n/a,string,ele-1,,xmlAttr,,,,,,,,,,,,,,,,,,,,,,,
