49,ARS|s_CareConnect-GPC-Medication-1,Medication.manufacturer.reference,Medication.manufacturer.reference,"Literal reference, Relative, internal or absolute URL","A reference to a location at which the other resource is found. The reference may be a relative reference, in which case it is relative to the service base URL, or an absolute URL that resolves to the location where the resource is found. The reference may be version specific or not. If the reference is not to a FHIR RESTful server, then it should be assumed to be version specific. Internal fragment references (start with '#') refer to contained resources.",0,1,0..1,Reference.reference,0,1,ele-1,error,All FHIR elements must have a @value or children,hasValue() | (children().count() > id.count()),@value|f:*|h:div,"['rim', 'rim']","['n/a', 'N/A']","Using absolute URLs provides a stable scalable approach suitable for a cloud/web context, while using relative/logical references provides a flexible approach suitable for use when trading across closed eco-system boundaries.   Absolute URLs do not need to point to a FHIR RESTful server, though this is the preferred approach. If the URL conforms to the structure ""/[type]/[id]"" then it should be assumed that the reference is to a FHIR RESTful server.",string,"['ele-1', 'ref-1']",true,,,,,,,,,,,,,,,,,,,,,,,,,,
50,ARS|s_CareConnect-GPC-Medication-1,Medication.manufacturer.identifier,Medication.manufacturer.identifier,"Logical reference, when literal reference is not known","An identifier for the other resource. This is used when there is no way to reference the other resource directly, either because the entity is not available through a FHIR server, or because there is no way for the author of the resource to convert a known identifier to an actual location. There is no requirement that a Reference.identifier point to something that is actually exposed as a FHIR instance, but it SHALL point to a business concept that would be expected to be exposed as a FHIR instance, and that instance would need to be of a FHIR resource type allowed by the reference.",0,1,0..1,Reference.identifier,0,1,ele-1,error,All FHIR elements must have a @value or children,hasValue() | (children().count() > id.count()),@value|f:*|h:div,"['rim', 'v2', 'rim', 'servd', 'rim']","['n/a', 'CX / EI (occasionally, more often EI maps to a resource id or a URL)', 'II - see see identifier pattern at http://wiki.hl7.org/index.php?title=Common_Design_Patterns#Identifier_Pattern for relevant discussion. The Identifier class is a little looser than the v3 type II because it allows URIs as well as registered OIDs or GUIDs.  Also maps to Role[classCode=IDENT]', 'Identifier', '.identifier']","When an identifier is provided in place of a reference, any system processing the reference will only be able to resolve the identifier to a reference if it understands the business context in which the identifier is used. Sometimes this is global (e.g. a national identifier) but often it is not. For this reason, none of the useful mechanisms described for working with references (e.g. chaining, includes) are possible, nor should servers be expected to be able resolve the reference. Servers may accept an identifier based reference untouched, resolve it, and/or reject it - see CapabilityStatement.rest.resource.referencePolicy.   When both an identifier and a literal reference are provided, the literal reference is preferred. Applications processing the resource are allowed - but not required - to check that the identifier matches the literal reference  Applications converting a logical reference to a literal reference may choose to leave the logical reference present, or remove it.",Identifier,ele-1,true,,,,,,,,,,,,,,,,,,,,,,,,,,
51,ARS|s_CareConnect-GPC-Medication-1,Medication.manufacturer.display,Medication.manufacturer.display,Text alternative for the resource,Plain text narrative that identifies the resource in addition to the resource reference.,0,1,0..1,Reference.display,0,1,ele-1,error,All FHIR elements must have a @value or children,hasValue() | (children().count() > id.count()),@value|f:*|h:div,"['rim', 'rim']","['n/a', 'N/A']","This is generally not the same as the Resource.text of the referenced resource.  The purpose is to identify what's being referenced, not to fully describe it.",string,ele-1,true,,,,,,,,,,,,,,http://hl7.org/fhir/StructureDefinition/elementdefinition-translatable,true,,,,,,,,,,,
52,ARS|s_CareConnect-GPC-Medication-1,Medication.form,Medication.form,Codes that describe a medication dose form,Describes the form of the item.  Powder; tablets; capsule.,0,1,0..1,Medication.form,0,1,ele-1,error,All FHIR elements must have a @value or children,hasValue() | (children().count() > id.count()),@value|f:*|h:div,"['rim', 'v2', 'rim', 'orim', 'script10.6', 'v2', 'rim']","['n/a', 'CE/CNE/CWE', 'CD', 'fhir:CodeableConcept rdfs:subClassOf dt:CD', 'coding.code =  //element(*,DrugCodedType)/FormCode  coding.system = //element(*,DrugCodedType)/FormSourceCode', 'RXO-5-Requested Dosage Form / RXE-6-Give Dosage Form / RXD-6-Actual Dosage Form / RXG-8-Give Dosage Form / RXA-8-Administered Dosage Form', '.formCode']","When Medication is referenced from MedicationRequest, this is the ordered form.  When Medication is referenced within MedicationDispense, this is the dispensed form.  When Medication is referenced within MedicationAdministration, this is administered form.",CodeableConcept,ele-1,,,,,,,,http://hl7.org/fhir/StructureDefinition/elementdefinition-bindingName,MedicationForm,,required,A code from the SNOMED Clinical Terminology UK coding system that describes a medication dose form,https://fhir.nhs.uk/STU3/ValueSet/CareConnect-MedicationForm-1,,,,,,,,,,,,,,
53,ARS|s_CareConnect-GPC-Medication-1,Medication.form.id,Medication.form.id,xml:id (or equivalent in JSON),unique id for the element within a resource (for internal references). This may be any string value that does not contain spaces.,0,1,0..1,Element.id,0,1,ele-1,error,All FHIR elements must have a @value or children,hasValue() | (children().count() > id.count()),@value|f:*|h:div,rim,n/a,Note that FHIR strings may not exceed 1MB in size,string,ele-1,,xmlAttr,,,,,,,,,,,,,,,,,,,,,,,,,
54,ARS|s_CareConnect-GPC-Medication-1,Medication.form.extension,Medication.form.extension,Additional Content defined by implementations,"May be used to represent additional information that is not part of the basic definition of the element. In order to make the use of extensions safe and manageable, there is a strict set of governance  applied to the definition and use of extensions. Though any implementer is allowed to define an extension, there is a set of requirements that SHALL be met as part of the definition of the extension.",0,*,0..*,Element.extension,0,*,"['ele-1', 'ext-1']","['error', 'error']","['All FHIR elements must have a @value or children', 'Must have either extensions or value[x], not both']","['hasValue() | (children().count() > id.count())', 'extension.exists() != value.exists()']","['@value|f:*|h:div', ""exists(f:extension)!=exists(f:*[starts-with(local-name(.), 'value')])""]","['rim', 'rim']","['n/a', 'N/A']","There can be no stigma associated with the use of extensions by any application, project, or standard - regardless of the institution or jurisdiction that uses or defines the extensions.  The use of extensions is what allows the FHIR specification to retain a core level of simplicity for everyone.",Extension,ele-1,,,value,url,Extensions are always sliced by (at least) url,open,"['extensions', 'user content']",,,,,,,,,,,,,,,,,,,,
55,ARS|s_CareConnect-GPC-Medication-1,Medication.form.coding,Medication.form.coding,Code defined by a terminology system,A reference to a code defined by a terminology system.,0,*,0..*,CodeableConcept.coding,0,*,ele-1,error,All FHIR elements must have a @value or children,hasValue() | (children().count() > id.count()),@value|f:*|h:div,"['rim', 'v2', 'rim', 'orim', 'v2', 'rim', 'orim']","['n/a', 'CE/CNE/CWE subset one of the sets of component 1-3 or 4-6', 'CV', 'fhir:Coding rdfs:subClassOf dt:CDCoding', 'C*E.1-8, C*E.10-22', 'union(., ./translation)', 'fhir:CodeableConcept.coding rdfs:subPropertyOf dt:CD.coding']","Codes may be defined very casually in enumerations, or code lists, up to very formal definitions such as SNOMED CT - see the HL7 v3 Core Principles for more information.  Ordering of codings is undefined and SHALL NOT be used to infer meaning. Generally, at most only one of the coding values will be labeled as UserSelected = true.",Coding,ele-1,true,,,,,,,,,,,,,Allows for translations and alternate encodings within a code system.  Also supports communication of the same instance to systems requiring different encodings.,,,,,,,,,,,,,
56,ARS|s_CareConnect-GPC-Medication-1,Medication.form.coding.id,Medication.form.coding.id,xml:id (or equivalent in JSON),unique id for the element within a resource (for internal references). This may be any string value that does not contain spaces.,0,1,0..1,Element.id,0,1,ele-1,error,All FHIR elements must have a @value or children,hasValue() | (children().count() > id.count()),@value|f:*|h:div,rim,n/a,Note that FHIR strings may not exceed 1MB in size,string,ele-1,,xmlAttr,,,,,,,,,,,,,,,,,,,,,,,,,
57,ARS|s_CareConnect-GPC-Medication-1,Medication.form.coding.extension,Medication.form.coding.extension,Additional Content defined by implementations,"May be used to represent additional information that is not part of the basic definition of the element. In order to make the use of extensions safe and manageable, there is a strict set of governance  applied to the definition and use of extensions. Though any implementer is allowed to define an extension, there is a set of requirements that SHALL be met as part of the definition of the extension.",0,*,0..*,Element.extension,0,*,"['ele-1', 'ext-1']","['error', 'error']","['All FHIR elements must have a @value or children', 'Must have either extensions or value[x], not both']","['hasValue() | (children().count() > id.count())', 'extension.exists() != value.exists()']","['@value|f:*|h:div', ""exists(f:extension)!=exists(f:*[starts-with(local-name(.), 'value')])""]","['rim', 'rim']","['n/a', 'N/A']","There can be no stigma associated with the use of extensions by any application, project, or standard - regardless of the institution or jurisdiction that uses or defines the extensions.  The use of extensions is what allows the FHIR specification to retain a core level of simplicity for everyone.",Extension,ele-1,,,value,url,Extensions are always sliced by (at least) url,open,"['extensions', 'user content']",,,,,,,,,,,,,,,,,,,,
58,ARS|s_CareConnect-GPC-Medication-1,Medication.form.coding.extension:snomedCTDescriptionID,Medication.form.coding.extension,The SNOMED CT Description ID for the display,The SNOMED CT Description ID for the display.,0,1,0..1,Element.extension,0,*,"['ele-1', 'ext-1']","['error', 'error']","['All FHIR elements must have a @value or children', 'Must have either extensions or value[x], not both']","['hasValue() | (children().count() > id.count())', 'extension.exists() != value.exists()']","['@value|f:*|h:div', ""exists(f:extension)!=exists(f:*[starts-with(local-name(.), 'value')])""]","['rim', 'rim']","['n/a', 'N/A']","There can be no stigma associated with the use of extensions by any application, project, or standard - regardless of the institution or jurisdiction that uses or defines the extensions.  The use of extensions is what allows the FHIR specification to retain a core level of simplicity for everyone.",Extension,ele-1,,,,,,,"['extensions', 'user content']",,,,,,,,,,,,snomedCTDescriptionID,https://fhir.nhs.uk/STU3/StructureDefinition/Extension-coding-sctdescid,,,,,,,
59,ARS|s_CareConnect-GPC-Medication-1,Medication.form.coding.system,Medication.form.coding.system,Identity of the terminology system,The identification of the code system that defines the meaning of the symbol in the code.,1,1,1..1,Coding.system,0,1,ele-1,error,All FHIR elements must have a @value or children,hasValue() | (children().count() > id.count()),@value|f:*|h:div,"['rim', 'v2', 'rim', 'orim']","['n/a', 'C*E.3', './codeSystem', 'fhir:Coding.system rdfs:subPropertyOf dt:CDCoding.codeSystem']","The URI may be an OID (urn:oid:...) or a UUID (urn:uuid:...).  OIDs and UUIDs SHALL be references to the HL7 OID registry. Otherwise, the URI should come from HL7's list of FHIR defined special URIs or it should de-reference to some definition that establish the system clearly and unambiguously.",uri,ele-1,true,,,,,,,,,,,,,Need to be unambiguous about the source of the definition of the symbol.,,,,,,,,,,,,,
60,ARS|s_CareConnect-GPC-Medication-1,Medication.form.coding.version,Medication.form.coding.version,Version of the system - if relevant,"The version of the code system which was used when choosing this code. Note that a well-maintained code system does not need the version reported, because the meaning of codes is consistent across versions. However this cannot consistently be assured. and when the meaning is not guaranteed to be consistent, the version SHOULD be exchanged.",0,0,0..0,Coding.version,0,1,ele-1,error,All FHIR elements must have a @value or children,hasValue() | (children().count() > id.count()),@value|f:*|h:div,"['rim', 'v2', 'rim', 'orim']","['n/a', 'C*E.7', './codeSystemVersion', 'fhir:Coding.version rdfs:subPropertyOf dt:CDCoding.codeSystemVersion']","Where the terminology does not clearly define what string should be used to identify code system versions, the recommendation is to use the date (expressed in FHIR date format) on which that version was officially published as the version date.",string,ele-1,true,,,,,,,,,,,,,,,,,,,,,,,,,,
61,ARS|s_CareConnect-GPC-Medication-1,Medication.form.coding.code,Medication.form.coding.code,Symbol in syntax defined by the system,A symbol in syntax defined by the system. The symbol may be a predefined code or an expression in a syntax defined by the coding system (e.g. post-coordination).,1,1,1..1,Coding.code,0,1,ele-1,error,All FHIR elements must have a @value or children,hasValue() | (children().count() > id.count()),@value|f:*|h:div,"['rim', 'v2', 'rim', 'orim']","['n/a', 'C*E.1', './code', 'fhir:Coding.code rdfs:subPropertyOf dt:CDCoding.code']",Note that FHIR strings may not exceed 1MB in size,code,ele-1,true,,,,,,,,,,,,,Need to refer to a particular code in the system.,,,,,,,,,,,,,
62,ARS|s_CareConnect-GPC-Medication-1,Medication.form.coding.display,Medication.form.coding.display,Representation defined by the system,"A representation of the meaning of the code in the system, following the rules of the system.",0,1,0..1,Coding.display,0,1,ele-1,error,All FHIR elements must have a @value or children,hasValue() | (children().count() > id.count()),@value|f:*|h:div,"['rim', 'v2', 'rim', 'orim']","['n/a', 'C*E.2 - but note this is not well followed', 'CV.displayName', 'fhir:Coding.display rdfs:subPropertyOf dt:CDCoding.displayName']",Note that FHIR strings may not exceed 1MB in size,string,ele-1,true,,,,,,,,,,,,,Need to be able to carry a human-readable meaning of the code for readers that do not know  the system.,http://hl7.org/fhir/StructureDefinition/elementdefinition-translatable,true,,,,,,,,,,,
63,ARS|s_CareConnect-GPC-Medication-1,Medication.form.coding.userSelected,Medication.form.coding.userSelected,If this coding was chosen directly by the user,Indicates that this coding was chosen by a user directly - i.e. off a pick list of available items (codes or displays).,0,1,0..1,Coding.userSelected,0,1,ele-1,error,All FHIR elements must have a @value or children,hasValue() | (children().count() > id.count()),@value|f:*|h:div,"['rim', 'v2', 'rim', 'orim']","['n/a', 'Sometimes implied by being first', 'CD.codingRationale', 'fhir:Coding.userSelected fhir:mapsTo dt:CDCoding.codingRationale. fhir:Coding.userSelected fhir:hasMap fhir:Coding.userSelected.map. fhir:Coding.userSelected.map a fhir:Map;   fhir:target dt:CDCoding.codingRationale. fhir:Coding.userSelected\\#true a [     fhir:source ""true"";     fhir:target dt:CDCoding.codingRationale\\#O   ]']","Amongst a set of alternatives, a directly chosen code is the most appropriate starting point for new translations. There is some ambiguity about what exactly 'directly chosen' implies, and trading partner agreement may be needed to clarify the use of this element and its consequences more completely.",boolean,ele-1,true,,,,,,,,,,,,,"This has been identified as a clinical safety criterium - that this exact system/code pair was chosen explicitly, rather than inferred by the system based on some rules or language processing.",,,,,,,,,,,,,
64,ARS|s_CareConnect-GPC-Medication-1,Medication.form.text,Medication.form.text,Plain text representation of the concept,A human language representation of the concept as seen/selected/uttered by the user who entered the data and/or which represents the intended meaning of the user.,0,1,0..1,CodeableConcept.text,0,1,ele-1,error,All FHIR elements must have a @value or children,hasValue() | (children().count() > id.count()),@value|f:*|h:div,"['rim', 'v2', 'rim', 'orim']","['n/a', 'C*E.9. But note many systems use C*E.2 for this', './originalText[mediaType/code=""text/plain""]/data', 'fhir:CodeableConcept.text rdfs:subPropertyOf dt:CD.originalText']",Very often the text is the same as a displayName of one of the codings.,string,ele-1,true,,,,,,,,,,,,,"The codes from the terminologies do not always capture the correct meaning with all the nuances of the human using them, or sometimes there is no appropriate code at all. In these cases, the text is used to capture the full meaning of the source.",http://hl7.org/fhir/StructureDefinition/elementdefinition-translatable,true,,,,,,,,,,,
65,ARS|s_CareConnect-GPC-Medication-1,Medication.ingredient,Medication.ingredient,Active or inactive ingredient,Identifies a particular constituent of interest in the product.,0,*,0..*,Medication.ingredient,0,*,ele-1,error,All FHIR elements must have a @value or children,hasValue() | (children().count() > id.count()),@value|f:*|h:div,"['rim', 'rim']","['n/a', '.scopesRole[typeCode=INGR]']","The ingredients need not be a complete list.  If an ingredient is not specified, this does not indicate whether an ingredient is present or absent.  If an ingredient is specified it does not mean that all ingredients are specified.  It is possible to specify both inactive and active ingredients.",BackboneElement,ele-1,,,,,,,,,,,,,,,,,,,,,,,,,,,
66,ARS|s_CareConnect-GPC-Medication-1,Medication.ingredient.id,Medication.ingredient.id,xml:id (or equivalent in JSON),unique id for the element within a resource (for internal references). This may be any string value that does not contain spaces.,0,1,0..1,Element.id,0,1,ele-1,error,All FHIR elements must have a @value or children,hasValue() | (children().count() > id.count()),@value|f:*|h:div,rim,n/a,Note that FHIR strings may not exceed 1MB in size,string,ele-1,,xmlAttr,,,,,,,,,,,,,,,,,,,,,,,,,
67,ARS|s_CareConnect-GPC-Medication-1,Medication.ingredient.extension,Medication.ingredient.extension,Additional Content defined by implementations,"May be used to represent additional information that is not part of the basic definition of the element. In order to make the use of extensions safe and manageable, there is a strict set of governance  applied to the definition and use of extensions. Though any implementer is allowed to define an extension, there is a set of requirements that SHALL be met as part of the definition of the extension.",0,*,0..*,Element.extension,0,*,"['ele-1', 'ext-1']","['error', 'error']","['All FHIR elements must have a @value or children', 'Must have either extensions or value[x], not both']","['hasValue() | (children().count() > id.count())', 'extension.exists() != value.exists()']","['@value|f:*|h:div', ""exists(f:extension)!=exists(f:*[starts-with(local-name(.), 'value')])""]","['rim', 'rim']","['n/a', 'N/A']","There can be no stigma associated with the use of extensions by any application, project, or standard - regardless of the institution or jurisdiction that uses or defines the extensions.  The use of extensions is what allows the FHIR specification to retain a core level of simplicity for everyone.",Extension,ele-1,,,value,url,Extensions are always sliced by (at least) url,open,"['extensions', 'user content']",,,,,,,,,,,,,,,,,,,,
68,ARS|s_CareConnect-GPC-Medication-1,Medication.ingredient.modifierExtension,Medication.ingredient.modifierExtension,Extensions that cannot be ignored,"May be used to represent additional information that is not part of the basic definition of the element, and that modifies the understanding of the element that contains it. Usually modifier elements provide negation or qualification. In order to make the use of extensions safe and manageable, there is a strict set of governance applied to the definition and use of extensions. Though any implementer is allowed to define an extension, there is a set of requirements that SHALL be met as part of the definition of the extension. Applications processing a resource are required to check for modifier extensions.",0,*,0..*,BackboneElement.modifierExtension,0,*,"['ele-1', 'ext-1']","['error', 'error']","['All FHIR elements must have a @value or children', 'Must have either extensions or value[x], not both']","['hasValue() | (children().count() > id.count())', 'extension.exists() != value.exists()']","['@value|f:*|h:div', ""exists(f:extension)!=exists(f:*[starts-with(local-name(.), 'value')])""]","['rim', 'rim']","['n/a', 'N/A']","There can be no stigma associated with the use of extensions by any application, project, or standard - regardless of the institution or jurisdiction that uses or defines the extensions.  The use of extensions is what allows the FHIR specification to retain a core level of simplicity for everyone.",Extension,ele-1,true,,,,,,"['extensions', 'user content', 'modifiers']",,,,,,,,,,true,,,,,,,,,,
69,ARS|s_CareConnect-GPC-Medication-1,Medication.ingredient.item[x],Medication.ingredient.item[x],The product contained,The actual ingredient - either a substance (simple ingredient) or another medication.,1,1,1..1,Medication.ingredient.item[x],1,1,ele-1,error,All FHIR elements must have a @value or children,hasValue() | (children().count() > id.count()),@value|f:*|h:div,"['rim', 'v2', 'rim', 'orim', 'script10.6', 'v2', 'rim']","['n/a', 'CE/CNE/CWE', 'CD', 'fhir:CodeableConcept rdfs:subClassOf dt:CD', 'coding.code = //element(*,MedicationType)/DrugCoded/ProductCode  coding.system = //element(*,MedicationType)/DrugCoded/ProductCodeQualifier  coding.display = //element(*,MedicationType)/DrugDescription', 'RXC-2-Component Code  if medication: RXO-1-Requested Give Code / RXE-2-Give Code / RXD-2-Dispense/Give Code / RXG-4-Give Code / RXA-5-Administered Code', '.player']","Not all terminology uses fit this general pattern. In some cases, models should not use CodeableConcept and use Coding directly and provide their own structure for managing text, codings, translations and the relationship between elements and pre- and post-coordination.","['CodeableConcept', 'Reference', 'Reference']",ele-1,,,,,,,,,,,,,,,,,,,,,"['http://hl7.org/fhir/StructureDefinition/Substance', 'https://fhir.nhs.uk/STU3/StructureDefinition/CareConnect-GPC-Medication-1']",,,,,,
70,ARS|s_CareConnect-GPC-Medication-1,Medication.ingredient.isActive,Medication.ingredient.isActive,Active ingredient indicator,Indication of whether thisingredient affectsthe therapeutic action of the drug.,0,1,0..1,Medication.ingredient.isActive,0,1,ele-1,error,All FHIR elements must have a @value or children,hasValue() | (children().count() > id.count()),@value|f:*|h:div,"['rim', 'rim']","['n/a', 'NA']",,boolean,ele-1,,,,,,,,,,,,,,True indicates that the ingredient affects the therapeutic action of the drug (i.e. active).  False indicates that the ingredient does not affect the therapeutic action of the drug (i.e. inactive).,,,,,,,,,,,,,
71,ARS|s_CareConnect-GPC-Medication-1,Medication.ingredient.amount,Medication.ingredient.amount,Quantity of ingredient present,"Specifies how many (or how much) of the items there are in this Medication.  For example, 250 mg per tablet.  This is expressed as a ratio where the numerator is 250mg and the denominator is 1 tablet.",0,1,0..1,Medication.ingredient.amount,0,1,"['ele-1', 'rat-1']","['error', 'error']","['All FHIR elements must have a @value or children', 'Numerator and denominator SHALL both be present, or both are absent. If both are absent, there SHALL be some extension present']","['hasValue() | (children().count() > id.count())', '(numerator.empty() xor denominator.exists()) and (numerator.exists() or extension.exists())']","['@value|f:*|h:div', '(count(f:numerator) = count(f:denominator)) and ((count(f:numerator) > 0) or (count(f:extension) > 0))']","['rim', 'v2', 'rim', 'script10.6', 'v2', 'rim']","['n/a', 'N/A', 'RTO', '//element(*,DrugCodedType)/Strength', 'RXC-3-Component Amount & RXC-4-Component Units  if medication: RXO-2-Requested Give Amount - Minimum & RXO-4-Requested Give Units / RXO-3-Requested Give Amount - Maximum & RXO-4-Requested Give Units / RXO-11-Requested Dispense Amount & RXO-12-Requested Dispense Units / RXE-3-Give Amount - Minimum & RXE-5-Give Units / RXE-4-Give Amount - Maximum & RXE-5-Give Units / RXE-10-Dispense Amount & RXE-10-Dispense Units', '.quantity']",,Ratio,ele-1,,,,,,,,,,,,,,,,,,,,,,,,,,,
72,ARS|s_CareConnect-GPC-Medication-1,Medication.ingredient.amount.id,Medication.ingredient.amount.id,xml:id (or equivalent in JSON),unique id for the element within a resource (for internal references). This may be any string value that does not contain spaces.,0,1,0..1,Element.id,0,1,ele-1,error,All FHIR elements must have a @value or children,hasValue() | (children().count() > id.count()),@value|f:*|h:div,rim,n/a,Note that FHIR strings may not exceed 1MB in size,string,ele-1,,xmlAttr,,,,,,,,,,,,,,,,,,,,,,,,,
