,source,element_id,element_path_value,element_short_value,element_definition_value,element_comment_value,element_alias_value,element_min_value,element_max_value,element_cardinality,element_base_path_value,element_base_min_value,element_base_max_value,element_constraint_key_value,element_constraint_severity_value,element_constraint_human_value,element_constraint_expression_value,element_constraint_xpath_value,element_mapping_identity_value,element_mapping_map_value,element_type_code_value,element_condition_value,element_isSummary_value,element_representation_value,element_slicing_discriminator_type_value,element_slicing_discriminator_path_value,element_slicing_description_value,element_slicing_rules_value,element_binding_extension_url,element_binding_extension_valueString_value,element_binding_extension_valueBoolean_value,element_binding_strength_value,element_binding_description_value,element_binding_valueSetReference_reference_value,element_isModifier_value,element_binding_extension_valueReference_reference_value,element_requirements_value,element_example_label_value,element_example_valueUri_value,element_example_valueString_value,element_type_targetProfile_value,element_mustSupport_value,element_sliceName_value,element_type_profile_value,element_fixedUri_value,element_extension_url,element_extension_valueBoolean_value
0,ARS|s_CareConnect-GPC-DiagnosticReport-1,DiagnosticReport,DiagnosticReport,"A Diagnostic report - a combination of request information, atomic results, images, interpretation, as well as formatted reports","The findings and interpretation of diagnostic  tests performed on patients, groups of patients, devices, and locations, and/or specimens derived from these. The report includes clinical context such as requesting and provider information, and some mix of atomic results, images, textual and coded interpretations, and formatted representation of diagnostic reports.","This is intended to capture a single report, and is not suitable for use in displaying summary information that covers multiple reports.  For example, this resource has not been designed for laboratory cumulative reporting formats nor detailed structured reports for sequencing.","['Report', 'Test', 'Result', 'Results', 'Labs', 'Laboratory']",0,*,0..*,Resource,0,*,"['dom-2', 'dom-1', 'dom-4', 'dom-3']","['error', 'error', 'error', 'error']","['If the resource is contained in another resource, it SHALL NOT contain nested Resources', 'If the resource is contained in another resource, it SHALL NOT contain any narrative', 'If a resource is contained in another resource, it SHALL NOT have a meta.versionId or a meta.lastUpdated', 'If the resource is contained in another resource, it SHALL be referred to from elsewhere in the resource']","['contained.contained.empty()', 'contained.text.empty()', 'contained.meta.versionId.empty() and contained.meta.lastUpdated.empty()', ""contained.where(('#'+id in %resource.descendants().reference).not()).empty()""]","['not(parent::f:contained and f:contained)', 'not(parent::f:contained and f:text)', 'not(exists(f:contained/*/f:meta/f:versionId)) and not(exists(f:contained/*/f:meta/f:lastUpdated))', ""not(exists(for $id in f:contained/*/@id return $id[not(ancestor::f:contained/parent::*/descendant::f:reference/@value=concat('#', $id))]))""]","['rim', 'workflow', 'v2', 'rim', 'w5']","['Entity. Role, or Act', 'Event', 'ORU -> OBR', 'Observation[classCode=OBS, moodCode=EVN]', 'clinical.diagnostics']",,,,,,,,,,,,,,,,,,,,,,,,,,,
1,ARS|s_CareConnect-GPC-DiagnosticReport-1,DiagnosticReport.id,DiagnosticReport.id,Logical id of this artifact,"The logical id of the resource, as used in the URL for the resource. Once assigned, this value never changes.",The only time that a resource does not have an id is when it is being submitted to the server using a create operation.,,0,1,0..1,Resource.id,0,1,ele-1,error,All FHIR elements must have a @value or children,hasValue() | (children().count() > id.count()),@value|f:*|h:div,rim,n/a,id,ele-1,true,,,,,,,,,,,,,,,,,,,,,,,,
2,ARS|s_CareConnect-GPC-DiagnosticReport-1,DiagnosticReport.meta,DiagnosticReport.meta,Metadata about the resource,The metadata about the resource. This is content that is maintained by the infrastructure. Changes to the content may not always be associated with version changes to the resource.,,,0,1,0..1,Resource.meta,0,1,ele-1,error,All FHIR elements must have a @value or children,hasValue() | (children().count() > id.count()),@value|f:*|h:div,"['rim', 'rim']","['n/a', 'N/A']",Meta,ele-1,true,,,,,,,,,,,,,,,,,,,,,,,,
3,ARS|s_CareConnect-GPC-DiagnosticReport-1,DiagnosticReport.meta.id,DiagnosticReport.meta.id,xml:id (or equivalent in JSON),unique id for the element within a resource (for internal references). This may be any string value that does not contain spaces.,Note that FHIR strings may not exceed 1MB in size,,0,1,0..1,Element.id,0,1,ele-1,error,All FHIR elements must have a @value or children,hasValue() | (children().count() > id.count()),@value|f:*|h:div,rim,n/a,string,ele-1,,xmlAttr,,,,,,,,,,,,,,,,,,,,,,,
4,ARS|s_CareConnect-GPC-DiagnosticReport-1,DiagnosticReport.meta.extension,DiagnosticReport.meta.extension,Additional Content defined by implementations,"May be used to represent additional information that is not part of the basic definition of the element. In order to make the use of extensions safe and manageable, there is a strict set of governance  applied to the definition and use of extensions. Though any implementer is allowed to define an extension, there is a set of requirements that SHALL be met as part of the definition of the extension.","There can be no stigma associated with the use of extensions by any application, project, or standard - regardless of the institution or jurisdiction that uses or defines the extensions.  The use of extensions is what allows the FHIR specification to retain a core level of simplicity for everyone.","['extensions', 'user content']",0,*,0..*,Element.extension,0,*,"['ele-1', 'ext-1']","['error', 'error']","['All FHIR elements must have a @value or children', 'Must have either extensions or value[x], not both']","['hasValue() | (children().count() > id.count())', 'extension.exists() != value.exists()']","['@value|f:*|h:div', ""exists(f:extension)!=exists(f:*[starts-with(local-name(.), 'value')])""]","['rim', 'rim']","['n/a', 'N/A']",Extension,ele-1,,,value,url,Extensions are always sliced by (at least) url,open,,,,,,,,,,,,,,,,,,,
5,ARS|s_CareConnect-GPC-DiagnosticReport-1,DiagnosticReport.meta.versionId,DiagnosticReport.meta.versionId,Version specific identifier,"The version specific identifier, as it appears in the version portion of the URL. This values changes when the resource is created, updated, or deleted.","The server assigns this value, and ignores what the client specifies, except in the case that the server is imposing version integrity on updates/deletes.",,0,1,0..1,Meta.versionId,0,1,ele-1,error,All FHIR elements must have a @value or children,hasValue() | (children().count() > id.count()),@value|f:*|h:div,rim,n/a,id,ele-1,true,,,,,,,,,,,,,,,,,,,,,,,,
6,ARS|s_CareConnect-GPC-DiagnosticReport-1,DiagnosticReport.meta.lastUpdated,DiagnosticReport.meta.lastUpdated,When the resource version last changed,When the resource last changed - e.g. when the version changed.,This value is always populated except when the resource is first being created. The server / resource manager sets this value; what a client provides is irrelevant.,,0,1,0..1,Meta.lastUpdated,0,1,ele-1,error,All FHIR elements must have a @value or children,hasValue() | (children().count() > id.count()),@value|f:*|h:div,rim,n/a,instant,ele-1,true,,,,,,,,,,,,,,,,,,,,,,,,
7,ARS|s_CareConnect-GPC-DiagnosticReport-1,DiagnosticReport.meta.profile,DiagnosticReport.meta.profile,Profiles this resource claims to conform to,A list of profiles (references to [StructureDefinition](structuredefinition.html#) resources) that this resource claims to conform to. The URL is a reference to [StructureDefinition.url]().,It is up to the server and/or other infrastructure of policy to determine whether/how these claims are verified and/or updated over time.  The list of profile URLs is a set.,,1,*,1..*,Meta.profile,0,*,ele-1,error,All FHIR elements must have a @value or children,hasValue() | (children().count() > id.count()),@value|f:*|h:div,rim,n/a,uri,ele-1,true,,,,,,,,,,,,,,,,,,,,,,,,
8,ARS|s_CareConnect-GPC-DiagnosticReport-1,DiagnosticReport.meta.security,DiagnosticReport.meta.security,Security Labels applied to this resource,Security labels applied to this resource. These tags connect specific resources to the overall security policy and infrastructure.,"The security labels can be updated without changing the stated version of the resource  The list of security labels is a set. Uniqueness is based the system/code, and version and display are ignored.",,0,*,0..*,Meta.security,0,*,ele-1,error,All FHIR elements must have a @value or children,hasValue() | (children().count() > id.count()),@value|f:*|h:div,"['rim', 'v2', 'rim', 'orim']","['n/a', 'CE/CNE/CWE subset one of the sets of component 1-3 or 4-6', 'CV', 'fhir:Coding rdfs:subClassOf dt:CDCoding']",Coding,ele-1,true,,,,,,"['http://hl7.org/fhir/StructureDefinition/elementdefinition-bindingName', 'http://hl7.org/fhir/StructureDefinition/elementdefinition-isCommonBinding']",SecurityLabels,true,extensible,Security Labels from the Healthcare Privacy and Security Classification System.,http://hl7.org/fhir/ValueSet/security-labels,,,,,,,,,,,,,
9,ARS|s_CareConnect-GPC-DiagnosticReport-1,DiagnosticReport.meta.tag,DiagnosticReport.meta.tag,Tags applied to this resource,"Tags applied to this resource. Tags are intended to be used to identify and relate resources to process and workflow, and applications are not required to consider the tags when interpreting the meaning of a resource.","The tags can be updated without changing the stated version of the resource.  The list of tags is a set. Uniqueness is based the system/code, and version and display are ignored.",,0,*,0..*,Meta.tag,0,*,ele-1,error,All FHIR elements must have a @value or children,hasValue() | (children().count() > id.count()),@value|f:*|h:div,"['rim', 'v2', 'rim', 'orim']","['n/a', 'CE/CNE/CWE subset one of the sets of component 1-3 or 4-6', 'CV', 'fhir:Coding rdfs:subClassOf dt:CDCoding']",Coding,ele-1,true,,,,,,http://hl7.org/fhir/StructureDefinition/elementdefinition-bindingName,Tags,,example,"Codes that represent various types of tags, commonly workflow-related; e.g. ""Needs review by Dr. Jones""",http://hl7.org/fhir/ValueSet/common-tags,,,,,,,,,,,,,
10,ARS|s_CareConnect-GPC-DiagnosticReport-1,DiagnosticReport.implicitRules,DiagnosticReport.implicitRules,A set of rules under which this content was created,"A reference to a set of rules that were followed when the resource was constructed, and which must be understood when processing the content.","Asserting this rule set restricts the content to be only understood by a limited set of trading partners. This inherently limits the usefulness of the data in the long term. However, the existing health eco-system is highly fractured, and not yet ready to define, collect, and exchange data in a generally computable sense. Wherever possible, implementers and/or specification writers should avoid using this element.   This element is labelled as a modifier because the implicit rules may provide additional knowledge about the resource that modifies it's meaning or interpretation.",,0,1,0..1,Resource.implicitRules,0,1,ele-1,error,All FHIR elements must have a @value or children,hasValue() | (children().count() > id.count()),@value|f:*|h:div,rim,n/a,uri,ele-1,true,,,,,,,,,,,,true,,,,,,,,,,,,
11,ARS|s_CareConnect-GPC-DiagnosticReport-1,DiagnosticReport.language,DiagnosticReport.language,Language of the resource content,The base language in which the resource is written.,"Language is provided to support indexing and accessibility (typically, services such as text to speech use the language tag). The html language tag in the narrative applies  to the narrative. The language tag on the resource may be used to specify the language of other presentations generated from the data in the resource  Not all the content has to be in the base language. The Resource.language should not be assumed to apply to the narrative automatically. If a language is specified, it should it also be specified on the div element in the html (see rules in HTML5 for information about the relationship between xml:lang and the html lang attribute).",,0,1,0..1,Resource.language,0,1,ele-1,error,All FHIR elements must have a @value or children,hasValue() | (children().count() > id.count()),@value|f:*|h:div,rim,n/a,code,ele-1,,,,,,,"['http://hl7.org/fhir/StructureDefinition/elementdefinition-maxValueSet', 'http://hl7.org/fhir/StructureDefinition/elementdefinition-bindingName', 'http://hl7.org/fhir/StructureDefinition/elementdefinition-isCommonBinding']",Language,true,extensible,A human language.,http://hl7.org/fhir/ValueSet/languages,,http://hl7.org/fhir/ValueSet/all-languages,,,,,,,,,,,
12,ARS|s_CareConnect-GPC-DiagnosticReport-1,DiagnosticReport.text,DiagnosticReport.text,"Text summary of the resource, for human interpretation","A human-readable narrative that contains a summary of the resource, and may be used to represent the content of the resource to a human. The narrative need not encode all the structured data, but is required to contain sufficient detail to make it ""clinically safe"" for a human to just read the narrative. Resource definitions may define what content should be represented in the narrative to ensure clinical safety.","Contained resources do not have narrative. Resources that are not contained SHOULD have a narrative. In some cases, a resource may only have text with little or no additional discrete data (as long as all minOccurs=1 elements are satisfied).  This may be necessary for data from legacy systems where information is captured as a ""text blob"" or where text is additionally entered raw or narrated and encoded in formation is added later.","['narrative', 'html', 'xhtml', 'display']",0,1,0..1,DomainResource.text,0,1,ele-1,error,All FHIR elements must have a @value or children,hasValue() | (children().count() > id.count()),@value|f:*|h:div,"['rim', 'rim', 'rim']","['n/a', 'N/A', 'Act.text?']",Narrative,"['ele-1', 'dom-1']",,,,,,,,,,,,,,,,,,,,,,,,,
13,ARS|s_CareConnect-GPC-DiagnosticReport-1,DiagnosticReport.contained,DiagnosticReport.contained,"Contained, inline Resources","These resources do not have an independent existence apart from the resource that contains them - they cannot be identified independently, and nor can they have their own independent transaction scope.","This should never be done when the content can be identified properly, as once identification is lost, it is extremely difficult (and context dependent) to restore it again.","['inline resources', 'anonymous resources', 'contained resources']",0,*,0..*,DomainResource.contained,0,*,,,,,,"['rim', 'rim']","['Entity. Role, or Act', 'N/A']",Resource,,,,,,,,,,,,,,,,,,,,,,,,,,
14,ARS|s_CareConnect-GPC-DiagnosticReport-1,DiagnosticReport.extension,DiagnosticReport.extension,Additional Content defined by implementations,"May be used to represent additional information that is not part of the basic definition of the resource. In order to make the use of extensions safe and manageable, there is a strict set of governance  applied to the definition and use of extensions. Though any implementer is allowed to define an extension, there is a set of requirements that SHALL be met as part of the definition of the extension.","There can be no stigma associated with the use of extensions by any application, project, or standard - regardless of the institution or jurisdiction that uses or defines the extensions.  The use of extensions is what allows the FHIR specification to retain a core level of simplicity for everyone.","['extensions', 'user content']",0,*,0..*,DomainResource.extension,0,*,"['ele-1', 'ext-1']","['error', 'error']","['All FHIR elements must have a @value or children', 'Must have either extensions or value[x], not both']","['hasValue() | (children().count() > id.count())', 'extension.exists() != value.exists()']","['@value|f:*|h:div', ""exists(f:extension)!=exists(f:*[starts-with(local-name(.), 'value')])""]","['rim', 'rim']","['n/a', 'N/A']",Extension,ele-1,,,value,url,Extensions are always sliced by (at least) url,open,,,,,,,,,,,,,,,,,,,
15,ARS|s_CareConnect-GPC-DiagnosticReport-1,DiagnosticReport.modifierExtension,DiagnosticReport.modifierExtension,Extensions that cannot be ignored,"May be used to represent additional information that is not part of the basic definition of the resource, and that modifies the understanding of the element that contains it. Usually modifier elements provide negation or qualification. In order to make the use of extensions safe and manageable, there is a strict set of governance applied to the definition and use of extensions. Though any implementer is allowed to define an extension, there is a set of requirements that SHALL be met as part of the definition of the extension. Applications processing a resource are required to check for modifier extensions.","There can be no stigma associated with the use of extensions by any application, project, or standard - regardless of the institution or jurisdiction that uses or defines the extensions.  The use of extensions is what allows the FHIR specification to retain a core level of simplicity for everyone.","['extensions', 'user content']",0,*,0..*,DomainResource.modifierExtension,0,*,"['ele-1', 'ext-1']","['error', 'error']","['All FHIR elements must have a @value or children', 'Must have either extensions or value[x], not both']","['hasValue() | (children().count() > id.count())', 'extension.exists() != value.exists()']","['@value|f:*|h:div', ""exists(f:extension)!=exists(f:*[starts-with(local-name(.), 'value')])""]","['rim', 'rim']","['n/a', 'N/A']",Extension,ele-1,,,value,url,Extensions are always sliced by (at least) url,open,,,,,,,true,,,,,,,,,,,,
16,ARS|s_CareConnect-GPC-DiagnosticReport-1,DiagnosticReport.identifier,DiagnosticReport.identifier,Business identifier for report,Identifiers assigned to this report by the performer or other systems.,Usually assigned by the Information System of the diagnostic service provider (filler id).,"['ReportID', 'Filler ID', 'Placer ID']",1,*,1..*,DiagnosticReport.identifier,0,*,ele-1,error,All FHIR elements must have a @value or children,hasValue() | (children().count() > id.count()),@value|f:*|h:div,"['rim', 'v2', 'rim', 'servd', 'workflow', 'v2', 'rim', 'w5']","['n/a', 'CX / EI (occasionally, more often EI maps to a resource id or a URL)', 'II - see see identifier pattern at http://wiki.hl7.org/index.php?title=Common_Design_Patterns#Identifier_Pattern for relevant discussion. The Identifier class is a little looser than the v3 type II because it allows URIs as well as registered OIDs or GUIDs.  Also maps to Role[classCode=IDENT]', 'Identifier', 'Event.identifier', 'OBR-51', 'id', 'id']",Identifier,ele-1,true,,,,,,,,,,,,,,"Need to know what identifier to use when making queries about this report from the source laboratory, and for linking to the report outside FHIR context.",,,,,,,,,,
17,ARS|s_CareConnect-GPC-DiagnosticReport-1,DiagnosticReport.identifier.id,DiagnosticReport.identifier.id,xml:id (or equivalent in JSON),unique id for the element within a resource (for internal references). This may be any string value that does not contain spaces.,Note that FHIR strings may not exceed 1MB in size,,0,1,0..1,Element.id,0,1,ele-1,error,All FHIR elements must have a @value or children,hasValue() | (children().count() > id.count()),@value|f:*|h:div,rim,n/a,string,ele-1,,xmlAttr,,,,,,,,,,,,,,,,,,,,,,,
18,ARS|s_CareConnect-GPC-DiagnosticReport-1,DiagnosticReport.identifier.extension,DiagnosticReport.identifier.extension,Additional Content defined by implementations,"May be used to represent additional information that is not part of the basic definition of the element. In order to make the use of extensions safe and manageable, there is a strict set of governance  applied to the definition and use of extensions. Though any implementer is allowed to define an extension, there is a set of requirements that SHALL be met as part of the definition of the extension.","There can be no stigma associated with the use of extensions by any application, project, or standard - regardless of the institution or jurisdiction that uses or defines the extensions.  The use of extensions is what allows the FHIR specification to retain a core level of simplicity for everyone.","['extensions', 'user content']",0,*,0..*,Element.extension,0,*,"['ele-1', 'ext-1']","['error', 'error']","['All FHIR elements must have a @value or children', 'Must have either extensions or value[x], not both']","['hasValue() | (children().count() > id.count())', 'extension.exists() != value.exists()']","['@value|f:*|h:div', ""exists(f:extension)!=exists(f:*[starts-with(local-name(.), 'value')])""]","['rim', 'rim']","['n/a', 'N/A']",Extension,ele-1,,,value,url,Extensions are always sliced by (at least) url,open,,,,,,,,,,,,,,,,,,,
19,ARS|s_CareConnect-GPC-DiagnosticReport-1,DiagnosticReport.identifier.use,DiagnosticReport.identifier.use,usual | official | temp | secondary (If known),The purpose of this identifier.,"This is labeled as ""Is Modifier"" because applications should not mistake a temporary id for a permanent one. Applications can assume that an identifier is permanent unless it explicitly says that it is temporary.",,0,1,0..1,Identifier.use,0,1,ele-1,error,All FHIR elements must have a @value or children,hasValue() | (children().count() > id.count()),@value|f:*|h:div,"['rim', 'v2', 'rim']","['n/a', 'N/A', 'Role.code or implied by context']",code,ele-1,true,,,,,,http://hl7.org/fhir/StructureDefinition/elementdefinition-bindingName,IdentifierUse,,required,"Identifies the purpose for this identifier, if known .",http://hl7.org/fhir/ValueSet/identifier-use,true,,Allows the appropriate identifier for a particular context of use to be selected from among a set of identifiers.,,,,,,,,,,
20,ARS|s_CareConnect-GPC-DiagnosticReport-1,DiagnosticReport.identifier.type,DiagnosticReport.identifier.type,Description of identifier,A coded type for the identifier that can be used to determine which identifier to use for a specific purpose.,"This element deals only with general categories of identifiers.  It SHOULD not be used for codes that correspond 1..1 with the Identifier.system. Some identifiers may fall into multiple categories due to common usage.   Where the system is known, a type is unnecessary because the type is always part of the system definition. However systems often need to handle identifiers where the system is not known. There is not a 1:1 relationship between type and system, since many different systems have the same type.",,0,1,0..1,Identifier.type,0,1,ele-1,error,All FHIR elements must have a @value or children,hasValue() | (children().count() > id.count()),@value|f:*|h:div,"['rim', 'v2', 'rim', 'orim', 'v2', 'rim']","['n/a', 'CE/CNE/CWE', 'CD', 'fhir:CodeableConcept rdfs:subClassOf dt:CD', 'CX.5', 'Role.code or implied by context']",CodeableConcept,ele-1,true,,,,,,"['http://hl7.org/fhir/StructureDefinition/elementdefinition-bindingName', 'http://hl7.org/fhir/StructureDefinition/elementdefinition-isCommonBinding']",IdentifierType,true,extensible,A coded type for an identifier that can be used to determine which identifier to use for a specific purpose.,http://hl7.org/fhir/ValueSet/identifier-type,,,Allows users to make use of identifiers when the identifier system is not known.,,,,,,,,,,
21,ARS|s_CareConnect-GPC-DiagnosticReport-1,DiagnosticReport.identifier.system,DiagnosticReport.identifier.system,The namespace for the identifier value,"Establishes the namespace for the value - that is, a URL that describes a set values that are unique.",see http://en.wikipedia.org/wiki/Uniform_resource_identifier,,1,1,1..1,Identifier.system,0,1,ele-1,error,All FHIR elements must have a @value or children,hasValue() | (children().count() > id.count()),@value|f:*|h:div,"['rim', 'v2', 'rim', 'servd']","['n/a', 'CX.4 / EI-2-4', 'II.root or Role.id.root', './IdentifierType']",uri,ele-1,true,,,,,,,,,,,,,,"There are many sets  of identifiers.  To perform matching of two identifiers, we need to know what set we're dealing with. The system identifies a particular set of unique identifiers.",General,http://www.acme.com/identifiers/patient or urn:ietf:rfc:3986 if the Identifier.value itself is a full uri,,,,,,,,
22,ARS|s_CareConnect-GPC-DiagnosticReport-1,DiagnosticReport.identifier.value,DiagnosticReport.identifier.value,The value that is unique,The portion of the identifier typically relevant to the user and which is unique within the context of the system.,"If the value is a full URI, then the system SHALL be urn:ietf:rfc:3986.  The value's primary purpose is computational mapping.  As a result, it may be normalized for comparison purposes (e.g. removing non-significant whitespace, dashes, etc.)  A value formatted for human display can be conveyed using the [Rendered Value extension](extension-rendered-value.html).",,1,1,1..1,Identifier.value,0,1,ele-1,error,All FHIR elements must have a @value or children,hasValue() | (children().count() > id.count()),@value|f:*|h:div,"['rim', 'v2', 'rim', 'servd']","['n/a', 'CX.1 / EI.1', 'II.extension or II.root if system indicates OID or GUID (Or Role.id.extension or root)', './Value']",string,ele-1,true,,,,,,,,,,,,,,,General,,123456,,,,,,,
