69,ARS|s_CareConnect-GPC-ProblemHeader-Condition-1,Condition.code.coding:snomedCT.version,Condition.code.coding.version,Version of the system - if relevant,"The version of the code system which was used when choosing this code. Note that a well-maintained code system does not need the version reported, because the meaning of codes is consistent across versions. However this cannot consistently be assured. and when the meaning is not guaranteed to be consistent, the version SHOULD be exchanged.",0,0,0..0,Coding.version,0,1,ele-1,error,All FHIR elements must have a @value or children,hasValue() | (children().count() > id.count()),@value|f:*|h:div,"['rim', 'v2', 'rim', 'orim']","['n/a', 'C*E.7', './codeSystemVersion', 'fhir:Coding.version rdfs:subPropertyOf dt:CDCoding.codeSystemVersion']","Where the terminology does not clearly define what string should be used to identify code system versions, the recommendation is to use the date (expressed in FHIR date format) on which that version was officially published as the version date.",string,ele-1,true,,,,,,,,,,,,,,,,,,,,,,,,,,,,,
70,ARS|s_CareConnect-GPC-ProblemHeader-Condition-1,Condition.code.coding:snomedCT.code,Condition.code.coding.code,Symbol in syntax defined by the system,A symbol in syntax defined by the system. The symbol may be a predefined code or an expression in a syntax defined by the coding system (e.g. post-coordination).,1,1,1..1,Coding.code,0,1,ele-1,error,All FHIR elements must have a @value or children,hasValue() | (children().count() > id.count()),@value|f:*|h:div,"['rim', 'v2', 'rim', 'orim']","['n/a', 'C*E.1', './code', 'fhir:Coding.code rdfs:subPropertyOf dt:CDCoding.code']",Note that FHIR strings may not exceed 1MB in size,code,ele-1,true,,,,,,,,,,,,,,,,,,,,Need to refer to a particular code in the system.,,,,,,,,,
71,ARS|s_CareConnect-GPC-ProblemHeader-Condition-1,Condition.code.coding:snomedCT.display,Condition.code.coding.display,Representation defined by the system,"A representation of the meaning of the code in the system, following the rules of the system.",1,1,1..1,Coding.display,0,1,ele-1,error,All FHIR elements must have a @value or children,hasValue() | (children().count() > id.count()),@value|f:*|h:div,"['rim', 'v2', 'rim', 'orim']","['n/a', 'C*E.2 - but note this is not well followed', 'CV.displayName', 'fhir:Coding.display rdfs:subPropertyOf dt:CDCoding.displayName']",Note that FHIR strings may not exceed 1MB in size,string,ele-1,true,,,,,,,,,,,,,,,,,,,,Need to be able to carry a human-readable meaning of the code for readers that do not know  the system.,,,,,,http://hl7.org/fhir/StructureDefinition/elementdefinition-translatable,true,,
72,ARS|s_CareConnect-GPC-ProblemHeader-Condition-1,Condition.code.coding:snomedCT.userSelected,Condition.code.coding.userSelected,If this coding was chosen directly by the user,Indicates that this coding was chosen by a user directly - i.e. off a pick list of available items (codes or displays).,0,1,0..1,Coding.userSelected,0,1,ele-1,error,All FHIR elements must have a @value or children,hasValue() | (children().count() > id.count()),@value|f:*|h:div,"['rim', 'v2', 'rim', 'orim']","['n/a', 'Sometimes implied by being first', 'CD.codingRationale', 'fhir:Coding.userSelected fhir:mapsTo dt:CDCoding.codingRationale. fhir:Coding.userSelected fhir:hasMap fhir:Coding.userSelected.map. fhir:Coding.userSelected.map a fhir:Map;   fhir:target dt:CDCoding.codingRationale. fhir:Coding.userSelected\\#true a [     fhir:source ""true"";     fhir:target dt:CDCoding.codingRationale\\#O   ]']","Amongst a set of alternatives, a directly chosen code is the most appropriate starting point for new translations. There is some ambiguity about what exactly 'directly chosen' implies, and trading partner agreement may be needed to clarify the use of this element and its consequences more completely.",boolean,ele-1,true,,,,,,,,,,,,,,,,,,,,"This has been identified as a clinical safety criterium - that this exact system/code pair was chosen explicitly, rather than inferred by the system based on some rules or language processing.",,,,,,,,,
73,ARS|s_CareConnect-GPC-ProblemHeader-Condition-1,Condition.code.text,Condition.code.text,Plain text representation of the concept,A human language representation of the concept as seen/selected/uttered by the user who entered the data and/or which represents the intended meaning of the user.,0,1,0..1,CodeableConcept.text,0,1,ele-1,error,All FHIR elements must have a @value or children,hasValue() | (children().count() > id.count()),@value|f:*|h:div,"['rim', 'v2', 'rim', 'orim']","['n/a', 'C*E.9. But note many systems use C*E.2 for this', './originalText[mediaType/code=""text/plain""]/data', 'fhir:CodeableConcept.text rdfs:subPropertyOf dt:CD.originalText']",Very often the text is the same as a displayName of one of the codings.,string,ele-1,true,,,,,,,,,,,,,,,,,,,,"The codes from the terminologies do not always capture the correct meaning with all the nuances of the human using them, or sometimes there is no appropriate code at all. In these cases, the text is used to capture the full meaning of the source.",,,,,,http://hl7.org/fhir/StructureDefinition/elementdefinition-translatable,true,,
74,ARS|s_CareConnect-GPC-ProblemHeader-Condition-1,Condition.bodySite,Condition.bodySite,"Anatomical location, if relevant",The anatomical location where this condition manifests itself.,0,*,0..*,Condition.bodySite,0,*,ele-1,error,All FHIR elements must have a @value or children,hasValue() | (children().count() > id.count()),@value|f:*|h:div,"['rim', 'v2', 'rim', 'orim', 'sct-concept', 'rim', 'sct-attr']","['n/a', 'CE/CNE/CWE', 'CD', 'fhir:CodeableConcept rdfs:subClassOf dt:CD', '< 442083009  |Anatomical or acquired body structure|', '.targetBodySiteCode', '363698007']","Only used if not implicit in code found in Condition.code. If the use case requires attributes from the BodySite resource (e.g. to identify and track separately) then use the standard extension [body-site-instance](extension-body-site-instance.html).  May be a summary code, or a reference to a very precise definition of the location, or both.",CodeableConcept,ele-1,true,,,,,,,http://hl7.org/fhir/StructureDefinition/elementdefinition-bindingName,BodySite,,example,Codes describing anatomical locations. May include laterality.,http://hl7.org/fhir/ValueSet/body-site,,,,,,,,,,,,,,,,,
75,ARS|s_CareConnect-GPC-ProblemHeader-Condition-1,Condition.subject,Condition.subject,Who has the condition?,Indicates the patient or group who the condition record is associated with.,1,1,1..1,Condition.subject,1,1,"['ele-1', 'ref-1']","['error', 'error']","['All FHIR elements must have a @value or children', 'SHALL have a contained resource if a local reference is provided']","['hasValue() | (children().count() > id.count())', ""reference.startsWith('#').not() or (reference.substring(1).trace('url') in %resource.contained.id.trace('ids'))""]","['@value|f:*|h:div', ""not(starts-with(f:reference/@value, '#')) or exists(ancestor::*[self::f:entry or self::f:parameter]/f:resource/f:*/f:contained/f:*[f:id/@value=substring-after(current()/f:reference/@value, '#')]|/*/f:contained/f:*[f:id/@value=substring-after(current()/f:reference/@value, '#')])""]","['rim', 'rim', 'v2', 'rim', 'w5']","['n/a', 'The target of a resource reference is a RIM entry point (Act, Role, or Entity)', 'PID-3', '.participation[typeCode=SBJ].role[classCode=PAT]', 'who.focus']","References SHALL be a reference to an actual FHIR resource, and SHALL be resolveable (allowing for access control, temporary unavailability, etc). Resolution can be either by retrieval from the URL, or, where applicable by resource type, by treating an absolute reference as a canonical URL and looking it up in a local registry/repository.",Reference,ele-1,true,,,,,,patient,,,,,,,,,,,,,https://fhir.nhs.uk/STU3/StructureDefinition/CareConnect-GPC-Patient-1,Group is typically used for veterinary or public health use cases.,,,,,,,,,
76,ARS|s_CareConnect-GPC-ProblemHeader-Condition-1,Condition.context,Condition.context,Encounter or episode when condition first asserted,Encounter during which the condition was first asserted.,0,1,0..1,Condition.context,0,1,"['ele-1', 'ref-1']","['error', 'error']","['All FHIR elements must have a @value or children', 'SHALL have a contained resource if a local reference is provided']","['hasValue() | (children().count() > id.count())', ""reference.startsWith('#').not() or (reference.substring(1).trace('url') in %resource.contained.id.trace('ids'))""]","['@value|f:*|h:div', ""not(starts-with(f:reference/@value, '#')) or exists(ancestor::*[self::f:entry or self::f:parameter]/f:resource/f:*/f:contained/f:*[f:id/@value=substring-after(current()/f:reference/@value, '#')]|/*/f:contained/f:*[f:id/@value=substring-after(current()/f:reference/@value, '#')])""]","['rim', 'rim', 'v2', 'rim', 'w5']","['n/a', 'The target of a resource reference is a RIM entry point (Act, Role, or Entity)', 'PV1-19 (+PV1-54)', '.inboundRelationship[typeCode=COMP].source[classCode=ENC, moodCode=EVN]', 'context']","This record indicates the encounter this particular record is associated with.  In the case of a ""new"" diagnosis reflecting ongoing/revised information about the condition, this might be distinct from the first encounter in which the underlying condition was first ""known"".",Reference,ele-1,true,,,,,,encounter,,,,,,,,,,,true,,https://fhir.hl7.org.uk/STU3/StructureDefinition/CareConnect-Encounter-1,,,,,,,,,,
77,ARS|s_CareConnect-GPC-ProblemHeader-Condition-1,Condition.onset[x],Condition.onset[x],"Estimated or actual date,  date-time, or age","Estimated or actual date or date-time  the condition began, in the opinion of the clinician.",0,1,0..1,Condition.onset[x],0,1,ele-1,error,All FHIR elements must have a @value or children,hasValue() | (children().count() > id.count()),@value|f:*|h:div,"['rim', 'v2', 'rim', 'w5']","['n/a', 'PRB-16', '.effectiveTime.low or .inboundRelationship[typeCode=SUBJ].source[classCode=OBS, moodCode=EVN, code=""age at onset""].value', 'when.init']",Age is generally used when the patient reports an age at which the Condition began to occur.,"['dateTime', 'Age', 'Period', 'Range', 'string']",ele-1,true,,,,,,,,,,,,,,,,,true,,,,,,,,,,,,
78,ARS|s_CareConnect-GPC-ProblemHeader-Condition-1,Condition.abatement[x],Condition.abatement[x],If/when in resolution/remission,"The date or estimated date that the condition resolved or went into remission. This is called ""abatement"" because of the many overloaded connotations associated with ""remission"" or ""resolution"" - Conditions are never really resolved, but they can abate.",0,1,0..1,Condition.abatement[x],0,1,ele-1,error,All FHIR elements must have a @value or children,hasValue() | (children().count() > id.count()),@value|f:*|h:div,"['rim', 'rim', 'w5']","['n/a', '.effectiveTime.high or .inboundRelationship[typeCode=SUBJ].source[classCode=OBS, moodCode=EVN, code=""age at remission""].value or .inboundRelationship[typeCode=SUBJ]source[classCode=CONC, moodCode=EVN].status=completed', 'when.done']","There is no explicit distinction between resolution and remission because in many cases the distinction is not clear. Age is generally used when the patient reports an age at which the Condition abated.  If there is no abatement element, it is unknown whether the condition has resolved or entered remission; applications and users should generally assume that the condition is still valid.  When abatementString exists, it implies the condition is abated.","['dateTime', 'Age', 'boolean', 'Period', 'Range', 'string']","['ele-1', 'con-4']",,,,,,,,,,,,,,,,,,true,,,,,,,,,,,,
79,ARS|s_CareConnect-GPC-ProblemHeader-Condition-1,Condition.assertedDate,Condition.assertedDate,Date record was believed accurate,The date on which the existance of the Condition was first asserted or acknowledged.,1,1,1..1,Condition.assertedDate,0,1,ele-1,error,All FHIR elements must have a @value or children,hasValue() | (children().count() > id.count()),@value|f:*|h:div,"['rim', 'v2', 'rim', 'w5']","['n/a', 'REL-11', '.participation[typeCode=AUT].time', 'when.recorded']","The assertedDate represents the date when this particular Condition record was created in the EHR, not the date of the most recent update in terms of when severity, abatement, etc. were specified. The date of the last record modification can be retrieved from the resource metadata.",dateTime,ele-1,true,,,,,,,,,,,,,,,,,,,,,,,,,,,,,
80,ARS|s_CareConnect-GPC-ProblemHeader-Condition-1,Condition.asserter,Condition.asserter,Person who asserts this condition,Individual who is making the condition statement.,1,1,1..1,Condition.asserter,0,1,"['ele-1', 'ref-1']","['error', 'error']","['All FHIR elements must have a @value or children', 'SHALL have a contained resource if a local reference is provided']","['hasValue() | (children().count() > id.count())', ""reference.startsWith('#').not() or (reference.substring(1).trace('url') in %resource.contained.id.trace('ids'))""]","['@value|f:*|h:div', ""not(starts-with(f:reference/@value, '#')) or exists(ancestor::*[self::f:entry or self::f:parameter]/f:resource/f:*/f:contained/f:*[f:id/@value=substring-after(current()/f:reference/@value, '#')]|/*/f:contained/f:*[f:id/@value=substring-after(current()/f:reference/@value, '#')])""]","['rim', 'rim', 'v2', 'rim', 'w5']","['n/a', 'The target of a resource reference is a RIM entry point (Act, Role, or Entity)', 'REL-7.1 identifier + REL-7.12 type code', '.participation[typeCode=AUT].role', 'who.author']","References SHALL be a reference to an actual FHIR resource, and SHALL be resolveable (allowing for access control, temporary unavailability, etc). Resolution can be either by retrieval from the URL, or, where applicable by resource type, by treating an absolute reference as a canonical URL and looking it up in a local registry/repository.",Reference,ele-1,true,,,,,,,,,,,,,,,,,,,https://fhir.hl7.org.uk/STU3/StructureDefinition/CareConnect-Practitioner-1,,,,,,,,,,
81,ARS|s_CareConnect-GPC-ProblemHeader-Condition-1,Condition.stage,Condition.stage,"Stage/grade, usually assessed formally",Clinical stage or grade of a condition. May include formal severity assessments.,0,1,0..1,Condition.stage,0,1,"['ele-1', 'con-1']","['error', 'error']","['All FHIR elements must have a @value or children', 'Stage SHALL have summary or assessment']","['hasValue() | (children().count() > id.count())', 'summary.exists() or assessment.exists()']","['@value|f:*|h:div', 'exists(f:summary) or exists(f:assessment)']","['rim', 'rim']","['n/a', './inboundRelationship[typeCode=SUBJ].source[classCode=OBS, moodCode=EVN, code=""stage/grade""]']",,BackboneElement,ele-1,,,,,,,,,,,,,,,,,,,,,,,,,,,,,,
82,ARS|s_CareConnect-GPC-ProblemHeader-Condition-1,Condition.stage.id,Condition.stage.id,xml:id (or equivalent in JSON),unique id for the element within a resource (for internal references). This may be any string value that does not contain spaces.,0,1,0..1,Element.id,0,1,ele-1,error,All FHIR elements must have a @value or children,hasValue() | (children().count() > id.count()),@value|f:*|h:div,rim,n/a,Note that FHIR strings may not exceed 1MB in size,string,ele-1,,xmlAttr,,,,,,,,,,,,,,,,,,,,,,,,,,,,
83,ARS|s_CareConnect-GPC-ProblemHeader-Condition-1,Condition.stage.extension,Condition.stage.extension,Additional Content defined by implementations,"May be used to represent additional information that is not part of the basic definition of the element. In order to make the use of extensions safe and manageable, there is a strict set of governance  applied to the definition and use of extensions. Though any implementer is allowed to define an extension, there is a set of requirements that SHALL be met as part of the definition of the extension.",0,*,0..*,Element.extension,0,*,"['ele-1', 'ext-1']","['error', 'error']","['All FHIR elements must have a @value or children', 'Must have either extensions or value[x], not both']","['hasValue() | (children().count() > id.count())', 'extension.exists() != value.exists()']","['@value|f:*|h:div', ""exists(f:extension)!=exists(f:*[starts-with(local-name(.), 'value')])""]","['rim', 'rim']","['n/a', 'N/A']","There can be no stigma associated with the use of extensions by any application, project, or standard - regardless of the institution or jurisdiction that uses or defines the extensions.  The use of extensions is what allows the FHIR specification to retain a core level of simplicity for everyone.",Extension,ele-1,,,value,url,Extensions are always sliced by (at least) url,open,"['extensions', 'user content']",,,,,,,,,,,,,,,,,,,,,,,
84,ARS|s_CareConnect-GPC-ProblemHeader-Condition-1,Condition.stage.modifierExtension,Condition.stage.modifierExtension,Extensions that cannot be ignored,"May be used to represent additional information that is not part of the basic definition of the element, and that modifies the understanding of the element that contains it. Usually modifier elements provide negation or qualification. In order to make the use of extensions safe and manageable, there is a strict set of governance applied to the definition and use of extensions. Though any implementer is allowed to define an extension, there is a set of requirements that SHALL be met as part of the definition of the extension. Applications processing a resource are required to check for modifier extensions.",0,*,0..*,BackboneElement.modifierExtension,0,*,"['ele-1', 'ext-1']","['error', 'error']","['All FHIR elements must have a @value or children', 'Must have either extensions or value[x], not both']","['hasValue() | (children().count() > id.count())', 'extension.exists() != value.exists()']","['@value|f:*|h:div', ""exists(f:extension)!=exists(f:*[starts-with(local-name(.), 'value')])""]","['rim', 'rim']","['n/a', 'N/A']","There can be no stigma associated with the use of extensions by any application, project, or standard - regardless of the institution or jurisdiction that uses or defines the extensions.  The use of extensions is what allows the FHIR specification to retain a core level of simplicity for everyone.",Extension,ele-1,true,,,,,,"['extensions', 'user content', 'modifiers']",,,,,,,true,,,,,,,,,,,,,,,,
85,ARS|s_CareConnect-GPC-ProblemHeader-Condition-1,Condition.stage.summary,Condition.stage.summary,Simple summary (disease specific),"A simple summary of the stage such as ""Stage 3"". The determination of the stage is disease-specific.",0,1,0..1,Condition.stage.summary,0,1,ele-1,error,All FHIR elements must have a @value or children,hasValue() | (children().count() > id.count()),@value|f:*|h:div,"['rim', 'v2', 'rim', 'orim', 'sct-concept', 'v2', 'rim']","['n/a', 'CE/CNE/CWE', 'CD', 'fhir:CodeableConcept rdfs:subClassOf dt:CD', '< 254291000 |Staging and scales|', 'PRB-14', '.value']","Not all terminology uses fit this general pattern. In some cases, models should not use CodeableConcept and use Coding directly and provide their own structure for managing text, codings, translations and the relationship between elements and pre- and post-coordination.",CodeableConcept,"['ele-1', 'con-1']",,,,,,,,http://hl7.org/fhir/StructureDefinition/elementdefinition-bindingName,ConditionStage,,example,Codes describing condition stages (e.g. Cancer stages).,http://hl7.org/fhir/ValueSet/condition-stage,,,,,,,,,,,,,,,,,
86,ARS|s_CareConnect-GPC-ProblemHeader-Condition-1,Condition.stage.assessment,Condition.stage.assessment,Formal record of assessment,Reference to a formal record of the evidence on which the staging assessment is based.,0,*,0..*,Condition.stage.assessment,0,*,"['ele-1', 'ref-1']","['error', 'error']","['All FHIR elements must have a @value or children', 'SHALL have a contained resource if a local reference is provided']","['hasValue() | (children().count() > id.count())', ""reference.startsWith('#').not() or (reference.substring(1).trace('url') in %resource.contained.id.trace('ids'))""]","['@value|f:*|h:div', ""not(starts-with(f:reference/@value, '#')) or exists(ancestor::*[self::f:entry or self::f:parameter]/f:resource/f:*/f:contained/f:*[f:id/@value=substring-after(current()/f:reference/@value, '#')]|/*/f:contained/f:*[f:id/@value=substring-after(current()/f:reference/@value, '#')])""]","['rim', 'rim', 'rim']","['n/a', 'The target of a resource reference is a RIM entry point (Act, Role, or Entity)', '.self']","References SHALL be a reference to an actual FHIR resource, and SHALL be resolveable (allowing for access control, temporary unavailability, etc). Resolution can be either by retrieval from the URL, or, where applicable by resource type, by treating an absolute reference as a canonical URL and looking it up in a local registry/repository.","['Reference', 'Reference', 'Reference']","['ele-1', 'con-1']",,,,,,,,,,,,,,,,,,,,"['http://hl7.org/fhir/StructureDefinition/ClinicalImpression', 'http://hl7.org/fhir/StructureDefinition/DiagnosticReport', 'http://hl7.org/fhir/StructureDefinition/Observation']",,,,,,,,,,
87,ARS|s_CareConnect-GPC-ProblemHeader-Condition-1,Condition.evidence,Condition.evidence,Supporting evidence,Supporting Evidence / manifestations that are the basis on which this condition is suspected or confirmed.,0,*,0..*,Condition.evidence,0,*,"['ele-1', 'con-2']","['error', 'error']","['All FHIR elements must have a @value or children', 'evidence SHALL have code or details']","['hasValue() | (children().count() > id.count())', 'code.exists() or detail.exists()']","['@value|f:*|h:div', 'exists(f:code) or exists(f:detail)']","['rim', 'rim']","['n/a', '.outboundRelationship[typeCode=SPRT].target[classCode=OBS, moodCode=EVN]']","The evidence may be a simple list of coded symptoms/manifestations, or references to observations or formal assessments, or both.",BackboneElement,ele-1,,,,,,,,,,,,,,,,,,,,,,,,,,,,,,
88,ARS|s_CareConnect-GPC-ProblemHeader-Condition-1,Condition.evidence.id,Condition.evidence.id,xml:id (or equivalent in JSON),unique id for the element within a resource (for internal references). This may be any string value that does not contain spaces.,0,1,0..1,Element.id,0,1,ele-1,error,All FHIR elements must have a @value or children,hasValue() | (children().count() > id.count()),@value|f:*|h:div,rim,n/a,Note that FHIR strings may not exceed 1MB in size,string,ele-1,,xmlAttr,,,,,,,,,,,,,,,,,,,,,,,,,,,,
89,ARS|s_CareConnect-GPC-ProblemHeader-Condition-1,Condition.evidence.extension,Condition.evidence.extension,Additional Content defined by implementations,"May be used to represent additional information that is not part of the basic definition of the element. In order to make the use of extensions safe and manageable, there is a strict set of governance  applied to the definition and use of extensions. Though any implementer is allowed to define an extension, there is a set of requirements that SHALL be met as part of the definition of the extension.",0,*,0..*,Element.extension,0,*,"['ele-1', 'ext-1']","['error', 'error']","['All FHIR elements must have a @value or children', 'Must have either extensions or value[x], not both']","['hasValue() | (children().count() > id.count())', 'extension.exists() != value.exists()']","['@value|f:*|h:div', ""exists(f:extension)!=exists(f:*[starts-with(local-name(.), 'value')])""]","['rim', 'rim']","['n/a', 'N/A']","There can be no stigma associated with the use of extensions by any application, project, or standard - regardless of the institution or jurisdiction that uses or defines the extensions.  The use of extensions is what allows the FHIR specification to retain a core level of simplicity for everyone.",Extension,ele-1,,,value,url,Extensions are always sliced by (at least) url,open,"['extensions', 'user content']",,,,,,,,,,,,,,,,,,,,,,,
90,ARS|s_CareConnect-GPC-ProblemHeader-Condition-1,Condition.evidence.modifierExtension,Condition.evidence.modifierExtension,Extensions that cannot be ignored,"May be used to represent additional information that is not part of the basic definition of the element, and that modifies the understanding of the element that contains it. Usually modifier elements provide negation or qualification. In order to make the use of extensions safe and manageable, there is a strict set of governance applied to the definition and use of extensions. Though any implementer is allowed to define an extension, there is a set of requirements that SHALL be met as part of the definition of the extension. Applications processing a resource are required to check for modifier extensions.",0,*,0..*,BackboneElement.modifierExtension,0,*,"['ele-1', 'ext-1']","['error', 'error']","['All FHIR elements must have a @value or children', 'Must have either extensions or value[x], not both']","['hasValue() | (children().count() > id.count())', 'extension.exists() != value.exists()']","['@value|f:*|h:div', ""exists(f:extension)!=exists(f:*[starts-with(local-name(.), 'value')])""]","['rim', 'rim']","['n/a', 'N/A']","There can be no stigma associated with the use of extensions by any application, project, or standard - regardless of the institution or jurisdiction that uses or defines the extensions.  The use of extensions is what allows the FHIR specification to retain a core level of simplicity for everyone.",Extension,ele-1,true,,,,,,"['extensions', 'user content', 'modifiers']",,,,,,,true,,,,,,,,,,,,,,,,
